name,id,url,category,chain,token,coinGeckoID,description,subcategories,ninja,foundingYear,twitter,discord,telegram,blog,github,linkedin,verified
Polybase,a8p168,https://polybase.xyz/,COMPUTE,,,,"Polybase is a decentralized storage, index and query protocol for structured data.",RPC/Indexing,,,https://twitter.com/polybase_xyz?ref_src=twsrc%5Egoogle%7Ctwcamp%5Eserp%7Ctwgr%5Eauthor,989985926434394192,https://twitter.com/polybase_xyz?lang=en,https://medium.com/@polybase,https://github.com/polybase,https://www.linkedin.com/company/polybase,
Polymathic,ba6xjm,https://polymathic-ai.org/,NOT_DEPIN,,,,Polymathic AI develops versatile foundation models for machine learning applications in various scientific fields.,,,,https://twitter.com/PolymathicAI,,,,,https://github.com/PolymathicAI,
Polymesh,8ou3di,https://polymesh.network/,NOT_DEPIN,POLKADOT,POLYX,polymesh,"Polymesh is an institutional-grade permissioned blockchain built specifically for regulated assets. It streamlines antiquated processes and opens the door to new financial instruments by solving regulatory challenges with public infrastructure around identity, compliance, confidentiality, governance, and settlement.",,,,,,,,,,
Polytrade,t247l9,https://www.polytrade.finance/,NOT_DEPIN,,TRADE,,"Polytrade is a decentralized finance platform that specializes in tokenizing real-world assets, offering a marketplace for investing in and managing trade finance.",RWA,,,,1072833135697481859,,,,,
Pool,ueuvax,https://www.pooldata.io/,NOT_DEPIN,,POOL,,"Pool provides a platform and associated services to support Data Unions to develop, scale and monetize.",,,,https://twitter.com/pooldata,,,https://www.pooldata.io/blog,,https://www.linkedin.com/company/pool-data/,
Portalverse,6uwhcg,https://www.portalverse.net/,COMPUTE,,,,Decentralized cloud gaming and rendering network for immersive metaverses.,Gaming,,,https://twitter.com/Portalverse_Net,,,https://medium.com/@PORTALVERSE_NETWORK,https://github.com/Portalverse-Network,http://www.linkedin.com/company/portalverse-network,
Poseiden,ovnogm,https://www.poseidon.network/company/,COMPUTE,ETHEREUM,QQQ,qqq-token,Poseidon Network is a decentralized global network of idle P2P computing devices.,,,,https://twitter.com/REALIcePoseidon?ref_src=twsrc%5Egoogle%7Ctwcamp%5Eserp%7Ctwgr%5Eauthor,789323748267524097,,https://medium.com/@poseidon.os?source=topics_v2-2-843fc08660_4a77_4337_bdab_ff45d16f0324-17,https://github.com/poseidon,https://www.linkedin.com/company/poseidon,
Poseidon,hosx2o,https://www.poseidon.network/,COMPUTE,ETHEREUM,QQQ,poseidon-network,"Poseidon Network is a decentralized global network that collects and distributes idle resources from P2P devices, allowing everyone to build their own services in the fastest and cheapest way. This includes decentralized CDN, storage, and computing. Users can provide their unused bandwidth and storage from their devices, such as NAS, computers, and mobile devices.",,,,https://twitter.com/QQQtoken,789323748267524097,https://t.me/QQQ_Poseidon_En,https://medium.com/poseidonnetwork,https://github.com/poseidon-network,https://www.linkedin.com/company/poseidon-network,
Postmint,rbr871,https://www.postmint.xyz/,SERVICES,,,,"Postmint is a Web3 creator marketplace that offers a post-to-earn feature that rewards creators for marketing Web3 projects to their audience, with a refer-to-earn affiliate program.",,EV3 Sal,,,,,,,,
PowBlocks,hsnpun,https://powblocks.com/,NOT_DEPIN,ETHEREUM,XPB,powblocks,"PowBlocks is a dedicated decentralized layer-1 proof-of-work blockchain designed for the mining community. It distinguishes itself through its unique emission model, ingrained 5% block reward reduction per month, and commitment to decentralization. ",,,,,1148694380635488256,,,,,
PowerLedger,9a54pc,https://www.powerledger.io/,ENERGY,ETHEREUM,POWR,power-ledger,Powerledger is developing the world-first blockchain enabled energy and environmental commodity trading platform to make energy markets more efficient.,,,,,,,,,,
PPIO,wnnyld,https://www.ppio.cloud/,COMPUTE,,,,PPIO is a distributed cloud computing company that provides decentralized distributed cloud services.,,,,https://twitter.com/ppio_official?lang=en,,,https://www.ppio.cloud/blog/,https://github.com/PPIO,https://www.linkedin.com/company/ppio/,
Pragma,yt094j,https://www.pragmaoracle.com/,BLOCKCHAIN_INFRA,,,,Pragma is a decentralized oracle network that enhances the transparency and reliability of accessing real-world data for smart contracts while leveraging zero-knowledge cryptography for security.,,,,https://twitter.com/PragmaOracle,1014980263895375923,,https://mirror.xyz/pragmagic.eth,https://github.com/Astraly-Labs/Pragma,https://www.linkedin.com/company/pragma-oracle/about/,
Precipitate,wapwul,https://www.precipitate.ai/,AI,ETHEREUM,RAIN,precipitate-ai,"Precipitate is building an AI Blockchain infrastructure that enables developers to leverage the protocol's processing power, data rendering, computation, storage, and bandwidth to develop and deploy dApps loaded with an Artificial Intelligence System.",,ZZ,,,,,,,,
Prem,ygrlcj,https://www.premai.io/,AI,,,,Prem AI is a provider of an easy to use Generative AI Developer Platform. The Prem Network is a cutting-edge platform that leverages a distributed mesh of GPU provider to optimize the processing of large Open Source models.,,,,https://twitter.com/premai_io,1106634690825310228,,https://blog.premai.io/,https://github.com/premAI-io/,https://www.linkedin.com/company/premai/,
Presearch,7mrkii,https://presearch.io/,AI,ETHEREUM,PRE,presearch,Presearch is a decentralized search engine.,Rewards,,,https://twitter.com/presearchnews,961810036420665364,,-vhttps://news.presearch.io/-,,https://www.linkedin.com/company/presearchofficial/,
Privasea,2qrtt6,https://www.privasea.ai/,NOT_DEPIN,,,,Privasea is a privacy-focused AI network utilizing Fully Homomorphic Encryption to secure data during computations.,,,,https://twitter.com/Privasea_tech,1100689673078190180,https://t.me/Privasea_ai,,,http://www.linkedin.com/company/privasea-tech,
Privio,x4ccoy,https://privio.co/,AI,,,,"Privio: AI B2B SaaS software offering Workflow Mgmt, Timekeeping, CRM, and more.",Software,,,https://twitter.com/PrivioTech,,,,,https://www.linkedin.com/company/privio/,
Prodia,51ffds,https://prodia.com/,NOT_DEPIN,,,,Prodia is an easy-to-use Stable Diffusion API for AI-powered image generation.,,,,https://twitter.com/prodialabs,961289090886692964,,,,https://www.linkedin.com/company/prodia-labs/,
Proof of Play,f0g5ra,https://www.proofofplay.com/,BLOCKCHAIN_INFRA,,,,Proof of Play is a game studio and blockchain technology company that makes decentralized games and gaming infrastructure.,,,,https://twitter.com/ProofOfPlay/,933037216811319327,,https://piratenation.medium.com/,,https://www.linkedin.com/company/proof-of-play/,
Propbase,687b4m,https://www.propbase.app/,NOT_DEPIN,,PROPS,,"Propbase is a highly-scalable, fast, and secure blockchain-based platform for property tokenization and transaction.",RWA,,,,1030685279327105044,,,,,
Propchain,pe85na,https://propchain.com/,NOT_DEPIN,,PROPC,,"Propchain develops on a blockchain-based ecosystem for real-world assets and proptech solutions. Prop.com is a consumer-focused platform for tokenized real estate investments, ensuring seamless access to real-world assets and a digitally intuitive interface for asset ownership.",RWA,,,,,,,,,
Prophetic,n08otn,https://propheticai.co/,SENSORS,,,,Prophetic is a neurotech company pioneering a lucid dream-inducing device.,Hardware,,,https://twitter.com/propheticai?s=21&t=fIjcfJIO-bBnd1u8k55iLQ,,,,,https://www.linkedin.com/company/propheticai/,
Protico,ourync,https://protico.io/,NOT_DEPIN,,,,Protico is a Web3 Chatting network aiming to realize a universal chatting interface for enterprises and users across all Apps.,,,,https://twitter.com/protico_io,,,,,https://www.linkedin.com/company/protico/,
Proto,uq5rfx,https://www.proto-geo.xyz/,SENSORS,,,,Proto is a geospatial data company revolutionizing the industry through a user-generated mapping platform.,Positioning,W. L.,,,,,,,http://www.linkedin.com/company/dp-proto,
Protomaps,qppebc,https://protomaps.com/,NOT_DEPIN,,,,A free and open source map of the world.,,EV3 Sal,,,,,,,,
Proton,zidol7,https://proton.me/mail,NOT_DEPIN,,,,Keep your conversations private. Proton Mail is an encrypted email service based in Switzerland.,,EV3 Sal,,,,,,,,
ProvenRun,f0pj2v,https://provenrun.com/,NOT_DEPIN,,,,ProvenRun is a developer of a cybersecurity platform for connected vehicles and smart devices.,Auto,EV3 Sal,,,,,,,,
ProximaX,nwrj6s,https://www.proximax.ltd/en/,COMPUTE,BINANCE,XPX,proximax,ProximaX: Blockchain-based infrastructure and development combining tech with distributed service layers.,,,,https://twitter.com/ProximaXGang,,,,https://github.com/proximax-storage,https://www.linkedin.com/company/proximaxltd,
PublicAI,11aqyc,https://www.publicai.io/,AI,,,,PublicAI is a decentralized network focused on RHLF.,,,,https://twitter.com/PublicAI_,1067993454468153426,https://t.me/Public_AI,https://medium.com/@contact_88042,https://github.com/PublicAI01,http://www.linkedin.com/company/publicai01,
PulseFolio,ry8vac,https://pulsefolios.com/,AI,BINANCE,PULSE,pulsefolio,Decentralized AI protocol for personalized investment strategies.,,,,https://twitter.com/PulseFolio/,,https://t.me/PulsefolioPortal,,,,
Puml,1zh76b,https://puml.io/,BLOCKCHAIN_INFRA,ETHEREUM,PUMLX,pumlx,"PUML Better Health is a Web3 Sports, Fitness and Wellness company gamifying healthy behaviours via challenges in the metaverse and real-world.",,,,https://twitter.com/pumlhealthio,,https://t.me/pumlofficial,https://pumlhealthio.medium.com/,https://github.com/pumlapp,https://www.linkedin.com/company/pumlhealthio/,
Pundi X,i0kfij,https://pundix.com/,SENSORS,ETHEREUM,PUNDIX,pundi-x-new,Pundi X is a leading developer of blockchain-powered devices to transform retail businesses with its blockchain-based point-of-sale solution. It allows retail merchants and consumers to conduct instantaneous in-store transactions on its blockchain.,,ZZ,,,,,,,,
Purebet,iaysmn,https://www.purebet.io/,NOT_DEPIN,,,,Purebet is a cryptocurrency gambling platform that offers secure and transparent betting options for users worldwide.,Gaming,,,https://www.twitter.com/Purebet_io,904758233233752094,,https://purebet.medium.com/,,,
PureFi,5u6ch6,https://purefi.io/,AI,ETHEREUM,UFI,purefi,PureFi: DeFi AML protocol providing cryptoasset analytics and AML/KYC procedures to protect users from risks.,,,,https://twitter.com/Purefi_Protocol,,https://t.me/purefiprotocol,https://medium.com/purefi,,http://www.linkedin.com/company/purefi,
Push,nhurl1,https://push.org/,WIRELESS,ETHEREUM,PUSH,ethereum-push-notification-service,"Push Protocol: web3 cross-chain network for dapps, wallets, and services.",,,,https://twitter.com/pushprotocol,717089384838594695,,https://medium.com/push-protocol,,https://www.linkedin.com/company/push-protocol,
Pyse,44h60y,https://pyse.in/,ENERGY,,,,Pyse enables retail investing in renewable energy assets.,RWA,,,,,,http://www.linkedin.com/company/pysefin,,,
Pyth,5fwmoi,https://pyth.network/,BLOCKCHAIN_INFRA,SOLANA,PYTH,pyth-network,"Pyth Network is an innovative decentralized oracle that sources financial market data from over 90 first-party publishers, including major exchanges and market-making firms worldwide (e.g., CBOE, Binance, OKX, Bybit, etc.), and distributes the data across 40+ blockchains",,EV3 Sal,,https://twitter.com/PythNetwork,826115122799837205,https://t.me/Pyth_Network,https://pyth.network/blog,https://github.com/pyth-network,https://www.linkedin.com/company/pyth-network,
Q Blocks,j988an,https://qblocks.cloud/,COMPUTE,,,,Developer of a decentralised GPU computing platform.,,,,https://twitter.com/blocks_q,,,,,https://www.linkedin.com/company/q-blocks/,
q-ctrl,69yd7k,https://q-ctrl.com/,NOT_DEPIN,,,,"Q-ctrl uniquely addresses the problem of hardware error and instability in quantum computing, entirely through software.",Quantum,,,https://twitter.com/qctrlHQ,,,,https://github.com/qctrl,https://www.linkedin.com/company/q-ctrl/,
QANplatform,w0b37b,https://qanplatform.com/en,NOT_DEPIN,ETHEREUM,QANX,qanplatform,QANplatform - quantum-resistant Layer 1 hybrid blockchain platform for developers and enterprises to build on top.,"L1/L2, Quantum",,,https://twitter.com/QANplatform,867778552534138941,https://t.me/QANplatform,https://qanplatform.medium.com/,https://github.com/QANplatform,https://www.linkedin.com/company/qanplatform/,
Qiro,alkph8,https://www.qiro.fi/,NOT_DEPIN,,,,Qiro is a unified credit protocol enabling RWA-backed DeFi lending.,RWA,,,,,,,,https://www.linkedin.com/company/qiro-group/,
QLC,xpng8u,http://www.qlcchain.org/,WIRELESS,,,,QLC Chain is a next-gen public Blockchain enabling service providers and network operators.,,,,https://twitter.com/kepple_io,,https://t.me/KeppleAnnouncements,https://keppleio.medium.com/,,http://www.linkedin.com/company/qlcchain,
QRL,qc35tq,https://www.theqrl.org/,NOT_DEPIN,NATIVE,QRL,quantum-resistant-ledger,QRL: Post-quantum secure value store and decentralized communication.,,,,https://twitter.com/QRLedger?ref_src=twsrc%5Egoogle%7Ctwcamp%5Eserp%7Ctwgr%5Eauthor,,,https://medium.com/@QRL,https://github.com/topics/qrl,https://www.linkedin.com/company/qrl/about/,
Quadency,8tp7y2,https://quadency.com/,AI,ETHEREUM,QUAD,quadency,"Quadency simplifies crypto trading. It offers portfolio management, trading bots, and automation.",,,,https://twitter.com/quadency,,https://t.me/joinchat/Fbj0HRHlGePeT8QeV-4uBg,,https://github.com/quadency,https://www.linkedin.com/company/quadency,
Qualoo,cfy81h,https://www.qualoo.io/,WIRELESS,,QXT,,"Qualoo is building a DePIN to make the internet better for everybody, utilizing an incentivized global network of hardware and mobile nodes to map the entire digital landscape while offering governance, real-time diagnostics, and optimization of the entire internet.",,,,https://twitter.com/Qualoo_Network,,https://t.me/QualooNetwork,,,https://linkedin.com/company/qualoo,
Quant,7u7rag,https://quant.network/,NOT_DEPIN,ETHEREUM,QNT,quant-network,Quant is a blockchain project aiming to improve global information communication efficiency.,,,,https://twitter.com/quant_network,,,,,https://www.linkedin.com/company/quantnetwork/,
Quantinum,m5egmn,https://quantinium.cc/,WIRELESS,,,,"Quantinum: Institutional-grade blockchain, integrating decentralization, scalability, sustainability, and cybersecurity.",,,,,,,,,,
Qubic,8hzipe,https://web.qubic.li/,AI,,,,Qubic Network is a smart contract platform for AI applications.,,,,https://twitter.com/qubic_network,768887649540243497,,,https://github.com/qubic-li,,
Questbook,c5xom1,https://questbook.app/,NOT_DEPIN,,,,Grants program management software.,,,,,,,,,,
Quick Intel,c46wsw,https://quickintel.io/,AI,ARBITRUM,QUICKI,quick-intel,"Quicki is a suite of safety and security multi-chain tools for Blockchain, providing real-time scam detection.",,,,https://twitter.com/quicki_erc,1080146033264312320,https://t.me/Quicki_TG,,,,
Rad Live,ugl60x,https://rad.live/,NOT_DEPIN,,,,The first NFT-powered streaming service,,EV3 Sal,,,,,,,,
Radicle,n2u1ny,https://radicle.xyz/,SERVICES,,,,"Radicle is a peer-to-peer stack for building software together. Radicle functions as a peer-to-peer protocol where each user on the network runs identical software, known as the Radicle Stack.",,,,https://twitter.com/radicle,,,,,https://www.linkedin.com/company/radicleproject/,
Radius,kttpsl,https://www.radius.space/,SERVICES,,,,Radius is a decentralized network that connects independent workers and teams to the best projects in web3.,,,,https://twitter.com/joinradius,943268752001228820,,https://mirror.xyz/joinradius.eth,,https://www.linkedin.com/company/tephralabs/about/,
Rádius,wy42w1,https://www.theradius.xyz/,NOT_DEPIN,,,,_Radius is a shared sequencing layer designed to eliminate harmful MEV and censorship while creating economic value for rollups.,,,,,,,,,,
Radix,orblk8,https://www.radixdlt.com/,NOT_DEPIN,ETHEREUM,XRD,radix,"Radix is a decentralized layer 1 protocol and public network designed specifically for DeFi applications that offers a scalable, secure, and developer-friendly platform.",,,,https://twitter.com/RadixDLT,417762285172555786,https://t.me/radix_dlt,https://www.radixdlt.com/blog,https://github.com/radixdlt,https://www.linkedin.com/company/radixdlt/,
Railbird,xlbuml,https://railbirdexchange.com/,NOT_DEPIN,,,,HyperCycle is building a tiny but essential component that enables AI Machines to transact with other AI machines in a sub-second finality which results in unprecedented emergence,Environmental,,,,,,,,https://www.linkedin.com/company/railbird/,
Railgun,9g0voz,https://railgun.org/,BLOCKCHAIN_INFRA,ETHEREUM,RAIL,railgun,"RAILGUN is a privacy protocol built on Ethereum, BSC, Polygon, and Arbitrum that uses Zero-Knowledge cryptography to enable private transactions and DeFi interactions without leaving the user's chosen blockchain. ",,ZZ,,,,,,,,
Rainfall,jtmdi1,https://rainfall.one/,AI,,,,Empower billions of people via self-sovereign Personal AI.,,EV3 Sal,,,,,,,,
Raiz,or2okw,https://www.raiz.farm/,BLOCKCHAIN_INFRA,,,,Raiz Building is a sustainable farming company providing energy efficient urban farms for local consumers.,,,,https://twitter.com/RaizFarms,,,https://medium.com/nearweek/an-introduction-to-raiz-vertical-farms-the-farms-of-the-future-e62094b782c3,,http://www.linkedin.com/company/raiz-vertical-farms,
RAK,v959ss,https://www.rakwireless.com/en-us,WIRELESS,,,,"RAKwireless is an industrial-leading connectivity provider that builds infrastructures and Modular Edge devices for IoT, Smart City, and Smart Agriculture markets.",Mining,,,https://twitter.com/RAKwireless,,,,https://github.com/RAKWireless,https://www.linkedin.com/company/rakwireless/,
Rangeview,u0jkdv,https://rangeview.co/,NOT_DEPIN,,,,Developer of industrial machinery designed to make aerospace parts.,,,,,,,,,https://www.linkedin.com/company/rangeview,
Rapidata,y47135,https://www.rapidata.ai/,SERVICES,,,,A startup offering a new method for human-verified data processing at scale. Rapidata solves a fundamental problem faced by the modern AI industry.,,,,,,,,,https://www.linkedin.com/company/rapidata/,
Raven,r3vxyu,https://www.ravenprotocol.com/,AI,BINANCE,RAVEN,raven-protocol,Raven Protocol is a decentralized compute network using idle power for fast AI training.,Training,,,https://twitter.com/raven_protocol,,https://t.me/ravenprotocol,https://medium.com/ravenprotocol,,https://linkedin.com/company/ravenprotocol,
RDDL,wbocde,https://www.rddl.io/,WIRELESS,,,,RDDL Network is a secure Refi and Defi protocol with trust anchors.,IoT,,,http://twitter.com/RDDLNetwork,1044693472390697011,,,https://github.com/rddl-network,https://www.linkedin.com/company/rddl/,
Re,v7t50o,https://re.xyz/,BLOCKCHAIN_INFRA,,,,"Re is a blockchain-powered protocol that connects its Members with insurance companies and baskets of insurance policies, allowing them to earn premiums and yield.",,ZZ,,,,,,,,
Reactions,57ba4r,https://reactions.wtf/,NOT_DEPIN,,,,"Reactions is a decentralized social curation protocol that let users react to NFTs, allowing consumers to build influence and earn with communities.",,,,https://twitter.com/reactions_lab,869644271068778616,,,,https://www.linkedin.com/company/reactions-wtf/about/,
READYgg,wjko90,https://ready.gg/,NOT_DEPIN,,,,READYgg is a Layer3 gaming infrastructure for the Web3 creator economy.,Gaming,,,https://twitter.com/TheReadyGames,449614151262928897,https://t.me/readygamesofficial,,,https://www.linkedin.com/company/ready-makers-inc/,
Realio,tg1g7b,https://realio.network/,NOT_DEPIN,ETHEREUM,RIO,realio-network,Realio manages real-world assets across multiple chains using Cosmos SDK and Tendermint.,,,,https://twitter.com/realio_network,1016319560581914747,https://en.telghub.com/content?id=43971,https://medium.com/@Realio_Network,https://github.com/realiotech,https://www.linkedin.com/company/realio,
Really,twhfdd,https://www.really.com/,WIRELESS,,,,"Really Wireless is a decentralized mobile network based in Austin, Texas.",,,,https://twitter.com/reallywireless,,,,,http://www.linkedin.com/company/reallywireless,
ReapChain,15hta4,https://reapchain.com/,NOT_DEPIN,ETHEREUM,REAP,reapchain,ReapChain: Hybrid blockchain solving trilemma and integrating IoT through distributed storage and PID.,IoT,,,https://twitter.com/ReapChain,,https://t.me/ReapchianOfficial,https://medium.com/reapchain,https://github.com/reapchain/testnets,,
Receipts,zowtah,https://receipts.xyz/,NOT_DEPIN,,,,zk verified credentials minting,ZK,EV3 Sal,,,,,,,,
Reclaim,6kjw4f,https://www.reclaimprotocol.org/,NOT_DEPIN,,,,User consent & data integrity guaranteed cryptographically.,ZK,,,,,,https://blog.reclaimprotocol.org/,,,
redacted,wprila,https://redacted.onl/,WIRELESS,,,,"redacted is developing a Decentralized VPN for Web3 with a pay-as-you-go model, on Solana",,ZZ,,,,,,,,
RedStone,ap3amn,https://redstone.finance/,BLOCKCHAIN_INFRA,,REDSTONE,redstone,"RedStone is an Oracle that delivers frequently updated, reliable, and diverse data feeds for your dApp and smart contracts on multiple L1s & L2s.",,,,https://twitter.com/redstone_defi,,https://t.me/redstonefinance/,,https://github.com/redstone-finance,https://www.linkedin.com/company/redstone-finance/,
ReGen,sbgvjh,https://www.regen.network/,NOT_DEPIN,COSMOS,REGEN,regen,"ReGen focuses on Hydrogen, Ammonia, and Methanol trading for the New Fuel Economy.",Environmental,,,https://twitter.com/regen_pk,,,,,https://www.linkedin.com/company/regen-sw/,
Rejuve,4v0sqt,https://www.rejuve.ai/,AI,,RJV,,"Rejuve.AI is a decentralized, AI-driven longevity research network allowing people from all over the world to track their health data, receive valuable insights, contribute to cutting-edge longevity research, and earn rewards.",,,,,1120812469334577232,,,,,
Relation,t8wbyf,https://www.relationlabs.ai/home,NOT_DEPIN,,REL,relation-native-token,Relation Protocol is a decentralized social graph protocol for encoding relations in Web3.,,,,https://twitter.com/relationlabs,935837847511003186,https://t.me/therelationlabs,https://medium.com/@RelationLabs,https://github.com/relationlabs,,
Relative.FI,owdd6z,https://relative.fi/,AI,,,,"Relative Finance is building cross-sector dApps for derivatives and skill-based wagering across SocialFi, DeFi, and GameFi.",Social,,,https://twitter.com/relativefi,1074744445980909678,https://t.me/RelativeFinance,,https://github.com/relativefi,https://www.linkedin.com/company/supermetafi/about/,
Relay,b0vnal,https://www.relaywireless.com/,WIRELESS,,,,"Relay is a provider of tools for DeWi deployers and WISPs, facilitating telecom network building and management.",,,,https://twitter.com/relaydevice,,,,https://github.com/relay-tools,https://www.linkedin.com/company/relaypro,
Remix,up2zx1,https://remix.ai/,AI,,,,"Remix AI is a social mobile app on iOS and Android, that unites users to create, share, and remix AI images and video.",,EV3 Sal,,,,,,,,
Renatus,83jvhp,https://www.renatus-robotics.com/,BLOCKCHAIN_INFRA,,,,Renatus is the first logistics system completing orders at one station.,Robotics,,,https://twitter.com/renatusgaming?lang=en,,,https://discord.com/invite/G9SCvAE,,https://ie.linkedin.com/company/renatus-capital-partners,
Render,drs2bu,http://renderfoundation.com/,COMPUTE,ETHEREUM,RNDR,render-token,Render is a decentralized rendering platform for next-gen media production.,GPUs,,,https://twitter.com/rendernetwork,976195870825529354,https://t.me/rendernetwork,https://medium.com/@rendernetwork,https://github.com/rendernetwork/,http://www.linkedin.com/company/render-network-foundation,
ResearchHub,844cf4,https://www.researchhub.com/,BLOCKCHAIN_INFRA,ETHEREUM,RSC,researchcoin,"ResearchHub is a collaborative platform that accelerates scientific research by allowing researchers to share, summarize, and discuss articles in specialized Hubs. The platform incentivizes contributions through ResearchCoin (RSC), a token that rewards users based on community upvotes and determines their reputation and privileges.",,,,https://twitter.com/ResearchHubF,957082465258848266,,https://mirror.xyz/blog.researchhubfoundation.eth,https://github.com/ResearchHub,https://www.linkedin.com/company/researchhubtechnologies/,
Revert,hcinar,https://www.revert.dev/,NOT_DEPIN,,,,Revert makes it incredibly easy to build integrations with any third party API.,,,,https://twitter.com/revertdotdev,1126480907881160714,,https://www.linkedin.com/company/90436779/,,https://github.com/revertinc/Revert,
Revest Finance,68z42k,https://revest.finance/,NOT_DEPIN,ETHEREUM,RVST,revest-finance,Revest Protocol is an EVM-based system for the tokenization of financial positions in DeFi.,,,,https://twitter.com/RevestFinance,836435050086137906,,https://revestfinance.medium.com/,https://github.com/Revest-Finance,https://www.linkedin.com/company/revest-finance/,
RevoFi,bdxcwj,https://revofi.com/,WIRELESS,,,,RevoFi is a decentralized wireless infrastructure platform.,,,,https://twitter.com/revofico?lang=en,839162257862295554,,,,https://www.linkedin.com/company/revofi,
rhino.fi,d3ignz,https://rhino.fi/,NOT_DEPIN,,,,rhino.fi is the ultimate Layer 2 bridge for effortless multi-chain token movement.,,,,,745570257808130058,,,,,
Riddle&Code,cn2pt1,https://www.riddleandcode.com/,SENSORS,,,,Riddle&Code: Connecting physical assets with Web3 technology for secure communication and transactions.,IoT,,,https://twitter.com/riddleandcode,999216778393698364,,,,https://www.linkedin.com/company/riddle-&-code/,
Ridotto,dth4ai,https://www.ridotto.io/,NOT_DEPIN,ETHEREUM,RDT,ridotto,"Ridotto is a cross-chain Gaming and lottery protocol based on complete transparency, anonymity, security, and fairness.",,ZZ,,,,,,,,
