name,id,url,category,chain,token,cmcSlug,coinGeckoID,description,subcategories,twitter,discord,telegram,blog,github,linkedin
Kroo,z1mpcu,https://www.kroo.us/,WIRELESS,,,,,"Kroo: 5G rooftop connectivity infra for real estate owners, harnessing power of 5G.",--,https://twitter.com/KrooBank?ref_src=twsrc%5Egoogle%7Ctwcamp%5Eserp%7Ctwgr%5Eauthor,,,https://www.kroo.com/blog,https://github.com/b-social,http://www.linkedin.com/company/kroous
Kryptview,3zopno,https://kryptview.com/,OTHER,NATIVE,KVT,,kryptview,Kryptview rewards users for analyzing cryptos using P2P and Blockchain mechanisms.,--,https://twitter.com/thekryptview?lang=en,https://discord.com/invite/PRvUfY7Vjf,,https://kryptview.medium.com/,,
Kunji Finance,9zg5p3,https://www.kunji.finance/,NOT_DEPIN,ARBITRUM,KNJ,,kunji-finance,Kunji Finance: Decentralized asset management platform on Arbitrum chain.,DeFi,https://twitter.com/kunjitweets,https://discord.com/invite/nWktwnqYNa,https://t.me/+qUmTI8yQNQozNTc1,https://medium.com/@Kunjifinance,,http://www.linkedin.com/company/kunjiofficial
KWAI,4ccixw,https://kwailabs.com/,AI,BINANCE,KWAI,kwai-labs,kwai,"KWAI develops AI-powered smart assistant for Web3. Offers tools for crypto swapping, staking, and market tracking.",--,https://twitter.com/kwai_labs,,https://t.me/kwai_labs_announcement,https://kwailabs.medium.com/,,
Kwil,9xue69,https://www.kwil.com/,COMPUTE,,,,,Kwil is a permissionless SQL database for the decentralized internet.,Data,https://twitter.com/KwilTeam,https://discord.com/invite/HzRPZ59Kay,,https://medium.com/kwildb,https://github.com/kwilteam,http://www.linkedin.com/company/kwilteam
KYVE,u6mo76,https://www.kyve.network/,COMPUTE,COSMOS,KYVE,,kyve-network,"KYVE connects nodes to Arweave storage, ensuring trustless uploads.",Storage,https://twitter.com/KYVENetwork,https://discord.com/invite/PATvZvEmxF,https://t.me/kyvenet,https://kyve.medium.com/,https://github.com/KYVENetwork,http://www.linkedin.com/company/kyve
Lake,cpzurk,https://lakenetwork.io/,COMPUTE,,,,,"Lake: Decentralized storage for DApps and Blockchains, incentivizing users to become Storage Servers.",Storage,https://twitter.com/_lakenetwork,,https://t.me/lakenetwork,,,http://www.linkedin.com/company/lakenetwork
Lavita.AI,tylsdp,https://www.lavita.ai/,AI,NATIVE,LAVITA,,lavita,"Lavita.AI: Blockchain-AI healthcare platform, preserving data privacy & enabling research with biomedical datasets.",Health & Fitness,https://twitter.com/LavitaAI,,https://t.me/Lavita_AI,https://lavita-ai.medium.com/,,http://www.linkedin.com/company/lavita-ai
Layer Zero,cpd9pq,https://layerzero.network/,OTHER,,ZRO,,layerzero,Layer Zero is an omnichain interoperability protocol that enables the realization of cross-chain applications with a low level communication primitive.,Mining,,,,,,
LayerAI,y3zupj,https://layerai.org/,AI,ETHEREUM,LAI,cryptogpt,cryptogpt-token,"LayerAI is a blockchain for AI dev, providing layer-2 solution for efficient and secure applications.",--,https://twitter.com/LayerAIorg,https://discord.com/invite/cryptogpt,https://t.me/LayerAI_org,https://layeraiorg.medium.com/layerai-the-technology-ecosystem-for-the-data-first-age-8ffe4f25e236,,http://www.linkedin.com/company/layeraiorg
LENA,2qzmdn,https://www.lena.network/,NOT_DEPIN,,,,,"LENA: Web3 liquidity provider for NFT lending and borrowing. ETH pools, user autonomy.",--,https://twitter.com/LENA_Network,https://discord.com/invite/QbRBkmkRVB,,https://medium.com/@LENA_Network,,http://www.linkedin.com/company/lena-network
Lendwill,xofl5l,https://lendwill.com/,NOT_DEPIN,,,,,Lendwill uses blockchain for global credit profile. P2P model with verifiable data & credit history on blockchain.,DeFi,https://twitter.com/lendwill,,,,,https://www.linkedin.com/company/lendwill/
Liberte,c6hicp,,COMPUTE,,,,,Liberte is a DePIN compute framework for on-chain games.,Gaming,,,,,,
Lighthouse,24l8zf,https://www.lighthouse.storage/,COMPUTE,,,,,Lighthouse is a permanent file storage protocol allowing one-time payment for storing files forever.,--,https://twitter.com/lhediscovery,https://discord.com/invite/c4a4CGCdJG,https://t.me/LighthouseStorage,https://www.lighthouse.storage/blogs,https://github.com/GoogleChrome/lighthouse,https://www.linkedin.com/company/lighthouse-global/
Livepeer,0dpzm4,https://livepeer.org/,COMPUTE,ETHEREUM,LPT,livepeer,livepeer,Livepeer is a decentralized network for video encoders and streamers.,--,https://twitter.com/livepeerorg,https://discord.com/invite/livepeer,,https://medium.com/livepeer-blog,,http://www.linkedin.com/company/livepeer
LocalPro,0pgbgt,https://www.getlocalpro.xyz/,OTHER,,,,,"LocalPro: gamifies experiences, promotes trust, quests, badges, rewards, enhances skills, incentivizes collaboration.",Rewards,https://twitter.com/localpro_,,,,,https://www.linkedin.com/company/localpro-x
Logos,dojvzb,https://logos.co/,OTHER,,,logos,,"Logos provides trust-minimized, corruption-resistant governing services and institutions for citizens.",Legal,https://twitter.com/Logos_state,,,,https://github.com/logos-co,https://linkedin.com/company/logos-internet-marketing-experts
LongFi,nbam9o,https://www.longfisolutions.com/,WIRELESS,,,,,LongFi Solutions: Decentralized Infrastructure for community connectivity,Mining,https://twitter.com/LongFiSolutions,,,,https://github.com/topics/longfi,https://www.linkedin.com/company/longfisolutions/
Loop,t38une,https://www.theloopnetwork.org/,NOT_DEPIN,BINANCE,LOOP,,loopnetwork,Loop is a Layer-1 crypto ecosystem to address scalability in smart contracts.,L1/L2,https://twitter.com/loopnetwork3,,https://t.me/loopnetwork,,,
Lunyr,74rmzw,https://lunyr.com/,AI,ETHEREUM,LUN,lunyr,lunyr,Lunyr is a blockchain-based world knowledge base that rewards users for peer-reviewing and contributing information.,--,https://twitter.com/LunyrInc,https://discord.com/invite/Vaw5MWD,https://t.me/lunyrcommunity,https://medium.com/lunyr,,https://www.linkedin.com/company/lunyr/about/
M3tering,ae6gb1,https://m3tering.whynotswitch.com/,ENERGY,,,,,M3tering incentivizes solar energy investment for underserved regions.,--,https://twitter.com/whyNotSwitch,https://discord.com/invite/Z4AyRjh7gW,,,,http://www.linkedin.com/company/whynotswitch
MagnetAI,1yb2sw,,AI,,,,,"Magnet AI is a scalable, permissionless and cost-efficient platform for accessing compute power for inference.",GPUs,,,,,,
MaidSafeCoin,ubmhxr,https://maidsafe.net/,COMPUTE,ETHEREUM,EMAID,maidsafecoin,maidsafecoin,MaidSafeCoin is a decentralized data network built on autonomous principles for secure and efficient data-sharing.,--,https://twitter.com/maidsafe,https://discord.com/invite/0ak6ESm4oAR3oXik,https://t.me/safenetwork,https://medium.com/safenetwork,https://github.com/maidsafe/maidsafe.net,https://www.linkedin.com/company/maidsafe/about/
Mande,f3629t,https://www.mande.network/,OTHER,,,,,"Credibility infrastructure for Web3! We are solving for trust in web3 protocols and enabling applications which relies on reputation at its core. Credibility on our network is a record of credit score (generated via peer to peer votes) and verifiable credentials capturing activities, reputation and accomplishments of an individual asserted by some reputed entity like chainalysis.com for ex. ",,https://twitter.com/MandeNetwork,https://discord.com/invite/9Ugch3fRC2,,https://medium.com/@Mande_Network,,
Mapmetrics,lp6ty8,https://mapmetrics.org/,SENSORS,SOLANA,MMAPS,mapmetrics,mapmetrics,Mapmetrics is a web3 navigation app that rewards users with tokens and NFTs.,Auto,https://twitter.com/MapMetrics?ref_src=twsrc%5Egoogle%7Ctwcamp%5Eserp%7Ctwgr%5Eauthor,https://discord.com/invite/tA7qDzu4,,,https://github.com/MobileRoboticsSkoltech/map-metrics,https://nl.linkedin.com/company/mapmetrics
MASQ,0ezngt,https://masq.ai/,COMPUTE,ETHEREUM,MASQ,masq,masq,"MASQ is a decentralized VPN network built on Polygon, providing secure and private internet browsing.",VPN,https://twitter.com/MASQ_ai,https://discord.com/invite/masq,https://t.me/MASQ_ai,https://masq.ai/blog,https://github.com/MASQ-Project,https://linkedin.com/company/masqproject
Massive,s4glrh,https://www.joinmassive.com/,COMPUTE,,,,,Massive is an SDK enabling developers to offer premium content to users by leveraging their unused processing power.,--,,,,,https://github.com/topics/massive,https://www.linkedin.com/company/massive/about/
MatchX,sr6yh3,https://matchx.io/,WIRELESS,,,,,MatchX is a hardware and software company specializing in IoT solutions for the industry.,"IoT, Hardware, Software",https://twitter.com/matchx_iot,https://discord.com/invite/cgW7sDa,,,,https://www.linkedin.com/company/matchx/
Matrix AI,iev3ik,https://www.matrix.io/,AI,NATIVE,MAN,,matrix-ai-network,Matrix combines neuroscience with AI and blockchain to create digital user avatars in the Metaverse.,--,https://twitter.com/MatrixAINetwork,https://discord.com/invite/pz3a3GDGj8,https://t.me/matrixainetwork,https://www.matrix.io/blog.html,https://github.com/MatrixAINetwork,http://www.linkedin.com/company/matrixainetwork
Mawari,ygaj99,https://www.mawari.io/,COMPUTE,,,,,Mawari: Decentralized 3D content delivery platform for mobile XR devices.,CDN,https://twitter.com/mawarijp,,,,,https://www.linkedin.com/company/mawari/
MedeLeite,jtrmoh,https://www.medeleite.com/,OTHER,,,,,Full-stack supply chain platform for mlik production,Software,,,,,,
Media Network,iqnvgc,https://www.media.network/,COMPUTE,ETHEREUM,MEDIA,media-network,media-network,Media Network is a decentralized hub for web services.,--,https://twitter.com/Media_FDN,https://discord.com/invite/nyCS7ePWzf,https://t.me/Media_FDN,https://www.media.network/blog,https://github.com/mediafoundation,https://www.linkedin.com/company/media-network-inc./about/
Metablox,k5fxwj,https://metablox.io/,WIRELESS,,,,,"Metablox is a provider of enterprise-grade WiFi roaming solutions, delivering worldwide public access.",--,https://twitter.com/metablox,https://discord.com/invite/metablox,,https://metabloxnetwork.medium.com/metablox-x-cryptolab-ama-recap-highlights-ba556d3ce506,https://github.com/MetaBloxIO,https://www.linkedin.com/company/metablox/
Metafi,cu6hqb,https://www.metafi.org/,NOT_DEPIN,,,,,"Metafi enables embeded wallets, broadcast transactions, indexing on-chain events, and more for web3 game developers.",Gaming,https://twitter.com/MetaFi_Official,https://discord.com/invite/metafi,,https://www.bnbchain.org/en/blog/metafi-when-defi-meets-meta,https://github.com/metafiofficial,https://uk.linkedin.com/company/meta-fi
MetaFlyers,k9uwcc,https://www.metaflyers.xyz,NOT_DEPIN,,,,,"MetaFlyers: a decentralized rewards marketplace connecting consumers, brands, and NFT communities.",Rewards,https://twitter.com/metaflyers,,,https://medium.com/@metaflyers,,https://www.linkedin.com/company/metaflyers?trk=similar-pages
MetafourAI,wko5kg,,AI,,,,,MetafourAI is developing telepathy-enabled apps using EEG signals and language models.,--,,,,,,
MetaGravity,jvfvyy,https://www.metagravity.com/,COMPUTE,,,,,MetaGravity is a company building distributed compute infrastructure for metaverse gaming and virtual world simulations.,Gaming,https://twitter.com/MetaGravity_,https://discord.com/invite/MetaGravity,https://t.me/Felikxz,https://www.metagravity.com/blog,,https://www.linkedin.com/company/metagravityltd
MetaSpace,65et59,https://www.metaspacechain.com/,NOT_DEPIN,,,,,"MetaSpace: Decentralized 3D metaverse for interaction, gaming, concerts, and NFT trading.",--,https://twitter.com/metaspace_verse,https://discord.com/invite/u4jWrHV3XC,https://t.me/MetaSpace_Metaverse,https://metaspace-metaverse.medium.com/,,http://www.linkedin.com/company/metaspace-academy
Metaweave,4kyl37,https://metaweave.com/,OTHER,,,,,Metaweave is a social permadapp enabling direct interaction with the Blockweave using Arweave wallet.,--,,,,,,
Metis,0mfb31,https://www.metis.io/,NOT_DEPIN,ETHEREUM,METIS,metis,metis-token,Metis: Scalable platform for Ethereum & infrastructure development,L1/L2,https://twitter.com/MetisDAO,https://discord.com/invite/RqfEJZXnxd,https://t.me/MetisDAO,https://metisdao.medium.com/,https://github.com/MetisProtocol,http://www.linkedin.com/company/metis-io
MEVFree,8sxorc,https://mevfree.com/,AI,ETHEREUM,MEVFREE,mevfree,mevfree,MEVFree: Platform for crypto traders with tools and services to maximize profits.,--,https://twitter.com/mevfree,https://discord.com/invite/aGvXZk8zdS,https://t.me/MevFree,,https://github.com/mevfree,
MicroAI,a69lpw,https://micro.ai/,NOT_DEPIN,,,,,"MicroAI, an Edge AI-enablement company based in Dallas, TX., delivers Intelligent Asset Management solutions to companies within the Manufacturing, O&G, Automotive, Telecom, and Silicon sectors. MicroAI’s award-winning, proprietary, AI/ML solution—MicroAI AtomML(TM) --enables a transformational approach to using Edge-native AI (TM) to improve the performance and security of IIoT devices and machines. Our innovative technology further enables products such as MicroAI Security (TM) for catastrophic-thwarting threat detection and prevention, MicroAI AtomML+ being an agentless machine learning platform for optimization of IT and OT asset Ecosystems, MicroAI Factory for providing OEE optimization, asset lifecycle management, and predictive analytics to improve factories of the future, and as well as MicroAI Launchpad for being an enterprise platform, enabling the development of end-to-end, AI-enabled, asset management ecosystems. MicroAI is a leader in Industry 4.0 initiatives, providing Edge and Endpoint AI/ML solutions that deliver business value in the areas of Asset Optimization, Predictive Maintenance, and advanced Cyber-Security.",ML,https://twitter.com/gomicroai?s=11,,,https://www.linkedin.com/company/microai-ai/,,
MicroVisionChain,tt8j7l,https://www.microvisionchain.com/,NOT_DEPIN,NATIVE,SPACE,microvisionchain,microvisionchain,"MicroVisionChain: UTXO-based public blockchain with PoW, high-concurrency, Layer-1 smart contracts, and DID solution.",--,https://twitter.com/mvcglobal,https://discord.com/invite/RGHWazu9eS,https://t.me/mvcofficial,,https://github.com/mvc-labs/microvisionchain,https://www.linkedin.com/posts/mvc-mvcglobal-3a3a24248_mvc-activity-7000330320587739136-CIlV/?trk=public_profile_like_view
Millicent Labs,s1f9ke,https://www.millicent.io/,NOT_DEPIN,,,,,Millicent Labs upgrades financial systems with distributed ledger technology.,,https://twitter.com/MillicentLabs,,,https://www.millicent.io/blog,,https://www.linkedin.com/company/millicentlabs/
Mindland,pheffj,https://mndlnd.xyz/,SENSORS,,,,,Mindland is a meditation incentivization company that uses crypto incentives to encourage meditation practices.,Health & Fitness,https://twitter.com/MndlndOfficial,https://discord.com/invite/jMjhnCPFzF,,,,
Mindsync,gpjz8o,https://mindsync.ai/,AI,,,mindsync,,"Mindsync connects AI enthusiasts, miners, and businesses for AI solutions.",--,https://twitter.com/mind_sync,https://discord.com/invite/mindsync,https://t.me/mindsyncai,https://medium.com/mindsync-ai,https://github.com/mindsync-ai,https://www.linkedin.com/company/mindsync/
Minima,w75xgw,https://www.minima.global/,NOT_DEPIN,NATIVE,MINIMA,,minima,"Minima: Compact, secure blockchain accessible on mobile & IoT devices.","Mobile, IoT",https://twitter.com/Minima_Global,https://discord.com/invite/minima,https://t.me/Minima_Global,https://www.minima.global/blog,https://github.com/minima-global,http://www.linkedin.com/company/minimaglobal
MintMe,6927wm,https://www.mintme.com/,NOT_DEPIN,ETHEREUM,MINTME,,webchain,"MintMe secures Smart-Contract-powered DApps using internet-connected devices, leveraging CPU resources.",--,https://twitter.com/mintmeproject,https://discord.com/invite/uuZXhCn,https://t.me/joinchat/Hzio4lCr-95bHcbB1-RX9Q,,https://github.com/mintme-com,http://www.linkedin.com/company/mintme
Mintstars,gt1ww4,https://www.mintstars.com/,NOT_DEPIN,,,,,Mintstars is a subscription-based NFT platform empowering creators to control their content and earnings.,,https://twitter.com/MintStarsReal,https://discord.com/invite/WM2rYuGsGR,,,,http://www.linkedin.com/company/mintstars
MobiFi,ars9qg,https://mobifi.io/,OTHER,ETHEREUM,MOFI,mobi-finance,mobifi,MobiFi rewards users for making smarter mobility decisions.,Ridesharing,https://twitter.com/mobifi,https://discord.com/invite/sygDqZ6xrs,,https://medium.com/mobifi,,https://uk.linkedin.com/company/mobifi
Mobilian,diyark,https://mobiliancoin.com/,AI,,,,,Mobilian is a blockchain network empowering secure autonomous vehicles.,Auto,https://twitter.com/MobilianCoin,,https://t.me/mobiliancoin,,,https://www.linkedin.com/company/mobiliancoin/
MODA DAO,qwsoln,https://www.moda.audio/,NOT_DEPIN,ETHEREUM,MODA,moda-dao,moda-dao,"MODA DAO empowers music industry with NFTs, licensing, and DeFi.",--,https://twitter.com/moda_dao,https://discord.com/invite/gbm2ZNjGPK,https://t.me/modadao,,,https://www.linkedin.com/company/moda-foundation/
Modal Labs,xegpzk,https://modal.com/,COMPUTE,,,,,"Modal Labs offers Modal, a runtime for data teams.",--,https://twitter.com/modal_labs,,,https://modal.com/blog,https://github.com/modal-labs,https://www.linkedin.com/company/modal-labs/
Moflix,u35fhl,https://www.moflixgroup.com/,WIRELESS,,,,,Moflix enables telco operators to become the backbone of Web3 by issuing fully regulatory compliant Web3 access to their customers,,,https://discord.com/invite/e2AQSZP,,,,
Mogul,129mdn,https://www.mogul.club/,OTHER,,,,,Mogul is a blockchain-based platform enabling direct investment in cash-flowing properties for as little as $100.,RWA,,,,,,
MOI Protocol,0wfhe4,https://iome.ai/,NOT_DEPIN,,,,,MOI Protocol and IOMe: user-owned decentralized identities.,--,,,,,,
Monte Carlo,tjf1xo,https://monte-carlo.ai/,AI,,,,,Monte Carlo is a decentralized computing power protocol that incentivizes miners to provide off-chain computing power.,,https://twitter.com/montecarlostyle,,,,,http://www.linkedin.com/company/monte-carlo-fashions
Moonbeam,xu30b0,https://moonbeam.network/,OTHER,POLKADOT,GLMR,,moonbeam,Moonbeam is a cross-chain smart contract platform allowing users to interact with multiple blockchains simultaneously.,--,https://twitter.com/moonbeamnetwork,https://discord.com/invite/moonbeam,,-https://medium.com/moonbeam-network-,,https://www.linkedin.com/company/moonbeaminc
Motivus,6la025,http://motivus.cl/,COMPUTE,,,,,Motivus: collaborative HPC for algorithm creation and distribution.,--,https://twitter.com/motivushpcn,,,https://medium.com/@Motivus,https://github.com/motivus,https://www.linkedin.com/company/motivus/
MurAll,kvmdaw,https://murall.art/home,AI,ETHEREUM,PAINT,murall,paint,MurAll: A blockchain platform for artists to create art using limited token called PAINT.,--,https://twitter.com/MurAll_art,https://discord.murall.art/,https://t.me/MurALLart,https://murall.medium.com/,https://github.com/murall-art,
MXC,h1l8jh,https://www.mxc.org/,SENSORS,ETHEREUM,MXC,mxc,mxc,"MXC enables physical objects to be bridged with the metaverse, DeFi, IoT, and NFT marketplace.",--,https://twitter.com/mxcfoundation,https://discord.com/invite/mxcfoundation,https://t.me/mxcfoundation,https://www.mxc.org/blog,https://github.com/mxc-foundation,http://www.linkedin.com/company/mxc-foundation
Mycelium,vi4exr,https://www.myceliumnetworks.com/,WIRELESS,,,,,Mycelium is an enterprise DePIN deployer and operator of the Mycelium Testbed.,--,https://twitter.com/myceliumx,https://discord.com/invite/mycelium,,https://medium.com/mycelium-ecosystem-blog,,http://www.linkedin.com/company/myceliumnetworks
myMessage,1rcuf0,https://www.mymessage.io/,COMPUTE,,,,,"myMessage is a decentralized data storage protocol enabling secure, low-cost storage and transfer.",Storage,https://twitter.com/myMessageOS,https://discord.com/invite/BCKyD3HxRh,https://t.me/mymessageEN,https://medium.com/@myMessage,https://github.com/myMessageio,https://linkedin.com/company/mymessageofficial
Mysterium,8ci5ud,https://www.mysterium.network/,WIRELESS,NATIVE,MYST,mysterium,mysterium,Mysterium is a decentralized wireless network.,--,https://twitter.com/MysteriumNet,https://discord.com/invite/n3vtSwc,https://t.me/mysterium_network,https://www.mysterium.network/blog,https://github.com/MysteriumNetwork,http://www.linkedin.com/company/mysteriumnet
NATIX,uq4s3v,https://www.natix.network/,SENSORS,,,,,NATIX is a decentralized real-time mapping & surveillance network.,Auto,https://twitter.com/NATIXNetwork?ref_src=twsrc%5Egoogle%7Ctwcamp%5Eserp%7Ctwgr%5Eauthor,https://discord.onl/natix-network/,https://discord.com/invite/ZqrCX9HBx6,https://www.natix.io/blog,https://github.com/natix-io,https://www.linkedin.com/company/natixio
Nesten,gazzlx,https://nesten.io/,WIRELESS,NATIVE,NIT,nesten,nesten,Nesten - telecom company revolutionizing industry with community-driven network ops & blockchain.,--,,,,,,
NetMind.AI,d2uaff,https://netmind.ai/home,COMPUTE,,,,,NetMind.AI enables deep learning model development for AI applications.,--,https://twitter.com/NetMindAi,,,,https://github.com/protagolabs,https://www.linkedin.com/company/netmind-ai/
Network3,a246lv,https://network3.io/,COMPUTE,,,,,Network3 enhances network security and privacy through distributed nodes.,VPN,https://twitter.com/network3_com,https://discord.com/invite/EeGuvBvm3k,https://t.me/network3official,https://medium.com/@network3,,
Neurai,kntco7,https://neurai.org/,AI,,XNA,neurai,neurai,"Neurai: AI, analytics, decision making, predictive modeling, IoT using blockchain assets.",--,https://twitter.com/neurai_io,https://discord.com/invite/dxJSrSeXjF,,https://neuraiproject.medium.com/,,https://www.linkedin.com/company/neural-io/
Neural Internet,b57y1r,https://neuralinternet.ai/,AI,,,,,"Bittensor is a decentralized, blockchain-based machine learning network that powers Neural Internet, an AI R&D DAO.",--,https://twitter.com/neural_internet,https://discord.com/invite/neuralinternet,,https://medium.com/@neuralinternet,https://github.com/neuralinternet,https://linkedin.com/company/neural-internet
Neural Radiance Field,p8tp6s,https://www.nerfbot.io/,AI,ETHEREUM,NERF,neural-radiance-field,neural-radiance-field,Neural Radiance Fields enables users to generate immersive 3D environments and create realistic videos.,--,https://twitter.com/nerf_erc20,,https://t.me/NERFERC20,https://medium.com/@NeRF_ERC20/nerf-bot-enabling-neural-radiance-fields-for-the-masses-aaa7bb63c4ab,https://github.com/Nerfbotxyz/,
NeuralAgent,8deftt,https://neuralagent.ai/,WIRELESS,,,,,NeuralAgent is a global network of low-cost transportation infrastructure.,--,https://twitter.com/i/web/status/1608355280286351362?lang=ar-x-fm,,,https://www.crunchbase.com/organization/neuralagent,https://github.com/neuralagent,https://www.linkedin.com/company/neuralagent
Neurosity,6bppe0,https://neurosity.co/,OTHER,,,,,Neurosity is a developer of neural devices and applications that translate human brain thoughts into actionable output.,Hardware,https://twitter.com/neurosity,https://discord.com/invite/vDKnG8kUvQ,,https://medium.com/neurosity,https://github.com/neurosity,https://www.linkedin.com/company/neurosity
Neutral,enoo3p,https://www.neutralx.com/,OTHER,,,,,"Neutral is an exchange for environmental assets that combine tokenized carbon credits, renewable energy credits, and carbon forwards with specialized market infrastructure to deliver efficiency, transparency, and trust in these markets.",RWA,https://twitter.com/NeutralExchange,,,https://www.linkedin.com/company/neutral-exchange/about/,https://www.neutralx.com/blog,
Neutralx,1d8dh4,https://www.neutralx.com/,AI,,,,,"Neutral is an exchange for environmental assets. We combine tokenized carbon credits, renewable energy credits, and carbon forwards with specialized market infrastructure to deliver efficiency, transparency, and trust in these markets.",,https://twitter.com/NeutralExchange,,,https://www.linkedin.com/company/neutral-exchange/about/,,
Neutroon,uktna7,https://www.neutroon.com/,WIRELESS,,,,,Neutroon is a Network-as-a-Service platform enabling seamless deployment and management of private cellular networks.,Software,https://twitter.com/Neutron_org,,https://t.me/NeutronCoin,https://www.neutroon.com/blog,https://github.com/neutron-org,https://www.linkedin.com/company/neutroon/?originalSubdomain=es
NexGen Cloud,gw1fz5,https://www.nexgencloud.com/,COMPUTE,,,,,"NexGen Cloud: Affordable, sustainable cloud solutions for Web2 & Web3 ecosystems.",--,https://twitter.com/CloudNexgen,,,,,https://www.linkedin.com/company/nexgen-cloud
NFAi,40loq1,https://nfa.ai/,AI,ETHEREUM,NFAI,,not-financial-advice,"NFAi: decentralized hedge fund experiment focused on crypto data science, aiming to establish a profit-sharing fund.",--,https://twitter.com/nfalabs,https://discord.com/invite/nfalabs,https://t.me/nfalabs,https://medium.com/@nfalabs,,
NFT3 Labs,z1ks7o,https://nft3.com/,OTHER,,,,,"NFT3 Labs is a virtual identity framework, enabling personal monetization and identity-lveraging in Web3 applications.",--,https://twitter.com/nft3com,https://discord.com/invite/HgHuuS9wzx,https://t.me/nft3com,https://medium.com/nft3,https://github.com/nft3labs,http://www.linkedin.com/company/nft3
NGRAVE,4tlww3,https://www.ngrave.io/,NOT_DEPIN,,,,,NGRAVE is a blockchain company. Ngrave Zero is their air-gapped hardware wallet.,Wallet,https://twitter.com/ngrave_official,https://discord.com/invite/gapxmWEBNJ,,,https://github.com/ngraveio,https://www.linkedin.com/company/ngrave/
Nirvana Labs,3fiksg,https://www.nirvanalabs.io/,COMPUTE,,,,,Nirvana Labs: web3 infrastructure for blockchain apps.,--,https://twitter.com/nirvanalabsai?ref_src=twsrc%5Egoogle%7Ctwcamp%5Eserp%7Ctwgr%5Eauthor,https://discord.com/invite/EjQspBWqdD,,,,https://www.linkedin.com/company/nirvana-labs/
