name,id,url,category,chain,token,coinGeckoID,description,subcategories,ninja,foundingYear,twitter,discord,telegram,blog,github,linkedin,verified
0Knowledge,sq9otq,https://0101010011.xyz/,WIRELESS,ETHEREUM,0KN,0-knowledge-network,0KN is a next generation decentralized and incentivized metadata-private mixnet-based anonymous broadcast network with cryptographic security guarantees.,ZK,,,https://twitter.com/0Knowledge_net,,https://t.me/Entry_Portal_0KN,https://medium.com/@0knowledgee,https://github.com/31333337,,
0x0.ai,vqpvwd,https://0x0.ai/,AI,ETHEREUM,0X0,0x0-ai-ai-smart-contract,0x0.ai - AI for secure smart contract development.,,,,https://twitter.com/0x0audits,1105051738806951976,https://t.me/Portal0x0,https://medium.com/@privacy0x0,https://github.com/0x0exchange,https://www.linkedin.com/company/0x0/,
0xParc,zf9ws4,https://0xparc.org/,NOT_DEPIN,,,,Supporting the next generation of cryptography-enabled applications.,,EV3 Sal,,,,,,,,
1000Houses,2ly60i,https://www.1kh.org/,NOT_DEPIN,,,,"1000Houses is a tokenizing platform for real estate rent, connecting investors and tenants in a streamlined marketplace.",RWA,,,https://twitter.com/#!/Mitch_Stephen,,,https://1000houses.com/blog/,,https://www.linkedin.com/in/mitch-stephen-5a83156/,
2appy,s3mmvo,https://www.2appy.it/,NOT_DEPIN,,,,Digitize your communications in just a few clicks. The VoIP switchboard that saves you money in call management.,,,,,,,,,,
2DAI,cv1vse,https://dapp.2dai.io/,AI,ETHEREUM,2DAI,2dai-io,2DAI is an innovative AIaaS platform that combines multiple neural engines and leverages cutting-edge cloud technology to empower creative professionals to generate unique visuals and develop AI-powered solutions.,,ZZ,,,,,,,,
369 AI,lkgvvp,https://three69.io/,AI,ETHEREUM,369,,369 AI is a high-performance blockchain for AI applications.,,,,https://twitter.com/Three69AI,,https://t.me/Three69AI,,,,
3DOS,5dho62,https://3dos.io/,BLOCKCHAIN_INFRA,,,,3DOS is building a decentralized manufacturing network on Web 3.0 using NFTs as a licensing tool.,Manufacturing,,,https://twitter.com/3DOSNetwork,1065763640105521232,,,,https://www.linkedin.com/company/3dosio/,
3NUM,f5qe2h,https://www.3num.co/,WIRELESS,,,,3Num connects mobile subscribers for secure communication.,,,,https://twitter.com/3numdao,953486199799025704,,https://medium.com/@3NUMDAO,https://github.com/3numdao,https://www.linkedin.com/company/3numdao/,
3TV,jcp53v,https://twitter.com/3tv_chat?s=11,NOT_DEPIN,,,,The best place for groups to connect in web3,,,,https://twitter.com/3tv_chat?s=11,,,,,,
4everland,0tmpgv,https://www.4everland.org/,COMPUTE,,,,"4everland is a decentralized cloud provider integrating storage, computing, and networking resources.",Storage,,,https://twitter.com/4everland_org/status/1658444206254469126,852482727164117022,,,,https://au.linkedin.com/company/4everlandorg,
Access,i4tcnw,https://www.accessprotocol.co/,NOT_DEPIN,SOLANA,ACS,access-protocol,ACCESS Protocol lays the foundation for digital content monetization using a web3 wallet.,,,,,1001837380044587118,,,,,
Acurast,o2w9zn,https://acurast.com/,COMPUTE,NATIVE,ACU,acurast,"Acurast is a decentralized and serverless cloud platform with a trustless, verifiable, and confidential computing environment leveraging mobile hardware to disrupt traditional server infrastructure.",,ZZ,,http://x.com/Acurast,,https://t.me/acurastnetwork,https://acurast.medium.com/,https://github.com/Acurast,,
Acorn,a0dbki,https://acorn.eco/#/,BLOCKCHAIN_INFRA,NATIVE,ACN,acorn-protocol,Acorn Protocol is a data ecosystem that rewards users for contributing and monetizing data value in a vibrant way.,,,,https://twitter.com/AcornProtocol,,,,https://mobile.twitter.com/AcornProtocol/status/1706843598581358812,https://www.linkedin.com/company/acorn,
Acxyn,ktxx7q,https://www.acxyn.xyz/,BLOCKCHAIN_INFRA,,,,Acxyn: empowering Web3 games with economic potential and ownership of revenue streams.,Gaming,,,https://twitter.com/Acxynteam,,,,,http://www.linkedin.com/company/acxyn,
Adapt,ct8tqp,https://www.adaptframework.solutions/,COMPUTE,,,,"Adapt is a developer framework for full stack decentralized software development, focusing on peer to peer data sharing and decentralization of non-blockchain components of web3 dApps. The framework includes a system for building off-chain, highly portable smart contracts, and offers a choice of security frameworks such as Secure Enclaves, ZK provable computation and a future layer1 blockchain.",,,,,979396568597799012,,,,,
Addresso,a0a6d7,https://www.addresso.com/,NOT_DEPIN,,,,"Addresso is the address book app for the next era of the web, helping users store and organize wallet and smart contract addresses simply, intuitively, and privately.",,EV3 Sal,,,,,,,,
AdHash,p6m3rb,https://adhash.com/,BLOCKCHAIN_INFRA,,,,"AdHash: direct data exchange between publishers and advertisers, no intermediaries",Advertising,,,,,https://t.me/adhashprotocol,,https://github.com/AdHashProtocol,https://www.linkedin.com/company/adhashprotocol/,
Advantis,qvo0gi,https://www.advantistoken.com/,AI,ETHEREUM,ADVT,advantis,"Advantis AI empowers crypto enthusiasts with innovative solutions like AI Outlook, Scanner, and University.",,,,https://twitter.com/AdvantisToken,909875543128821811,https://t.me/advantisai,https://medium.com/@advantisai,,http://www.linkedin.com/company/advantisai,
AEGIS,ib50zn,https://aiaegis.org/,AI,ETHEREUM,AEGIS,aegis-ai,AEGIS AI is developing a pioneering Blockchain Security with AI-Enabled Audit Solutions,,,,https://twitter.com/AegisAISecurity,,https://t.me/AegisAISecurity,,,,
AeroNyx,5w860i,https://aeronyx.network/,WIRELESS,,,,"AeroNyx - decentralized DePIN protocol for privacy solutions, using Web3 principles.",,,,https://twitter.com/Aeronyx9,,,,,https://www.linkedin.com/company/aeronyx/,
Aethir,oo2cn2,https://www.aethir.com/,COMPUTE,,,,Aethir enables real-time rendering in the Metaverse.,,,,https://twitter.com/Aethir_,993758224438284291,,,,https://www.linkedin.com/company/aethir-limited,
Agave Zwolf,zd2zu6,https://agavezwolf.com/,SERVICES,,AGVZ,,"Agave Zwolf is the provider of a token that is backed up by a plant of blue agave which is used to produce Tequila. When a new plant is planted by AgaveZwolf, a new Token is issued.",,,,,,,,,,
Agnostic,2pv22r,https://agnostic.engineering/,BLOCKCHAIN_INFRA,,,,Agnostic is the fastest access to aggregated smart-contract data. It allows developers to build their decentralised app without worrying about devops and data engineering.,,,,,,,https://medium.com/agnosticeng,,https://www.linkedin.com/company/agnostic/about/,
Agnostiq,anzeat,https://agnostiq.ai/,COMPUTE,,,,"Agnostiq develops Covalent, an open-source workflow platform for quantum computing and HPC.",,,,https://twitter.com/agnostiqHQ,,,,https://github.com/agnostiqHQ/covalent,https://www.linkedin.com/company/agnostiq/,
Agritoken,gaa7c0,https://agritoken.com.ph/,NOT_DEPIN,,,,Agritoken: Tokenizing crop futures for efficient and transparent agricultural investing.,RWA,,,https://twitter.com/AgriToken,,,,,https://www.linkedin.com/company/agritoken/?originalSubdomain=br,
Agrotoken,r2yc3l,https://agrotoken.com/es/,BLOCKCHAIN_INFRA,,,,"Agrotoken allows you to do more and better business with agrocommodities, creating a simpler, more efficient and technological ecosystem. We are the new dimension of agribusiness",,,,https://twitter.com/agrotoken,,,,,https://www.linkedin.com/company/agrotoken/,
AhoyDAO,cqpqpq,https://www.ahoy.org/,BLOCKCHAIN_INFRA,,,,AhoyDAO is a peer-to-peer ecosystem for the marine industry ownership economy.,,,,https://twitter.com/ahoy_dao,,,,https://github.com/ahoy-cli/ahoy,https://www.linkedin.com/company/ahoy-/,
AI ARENA,1q9nu8,https://www.arenaxlabs.com/,AI,,NRN,,"AI ARENA is an Ethereum native game (dApp) where players all over the world can purchase, train, and battle characters powered by AI.",,EV3 Sal,,,,,,,,
AI Power Grid,kv3vqp,https://aipowergrid.io/,AI,,AIPG,ai-power-grid,AI Power Grid is an innovative blockchain project designed to incentivize and reward open-source AI participation.,,ZZ,,,,,,,,
AI Protocol,3zo6h4,https://www.aiprotocol.info/,AI,,,,"Platform merging AI and Web3 for creation, ownership, tokenization, and monetization of AI assets.",,,,https://twitter.com/ProtocolAI1,828681620893466655,,https://medium.com/@protocolai_ready,,https://www.linkedin.com/in/ai-protocol-201214283/,
Aiis,zfup4o,https://aiis.dev/,AI,,,,"Skip complex code. With AI, creating and deploying your own ERC-20 token is as simple as answering a few questions!",,EV3 Sal,,,1170073310000853023,,,,,
Aimedis,p864om,https://aimedis.com/,AI,POLYGON,AIMX,aimedis-new,Aimedis: Blockchain-based eHealth with medical apps and NFT marketplace.,Health & Fitness,,,https://twitter.com/AimedisGlobal,1176263289701945396,https://t.me/AimedisOfficialEnglish,,,https://www.linkedin.com/company/aimedis/?originalSubdomain=nl,
AiONE,oqs9xj,https://ai.one/,AI,BINANCE,AIONE,aione,"AiONE: AI platform that integrates AI into business workflows. User-friendly AI services, APIs, and tools.",,,,https://twitter.com/aionelab,1093106091216347226,https://t.me/aionelab,,,http://www.linkedin.com/company/aionelabs,
AIOZ,tpqdbi,https://aioz.network/,COMPUTE,ETHEREUM,AIOZ,aioz-network,AIOZ is a decentralized content delivery network.,CDN,,,https://twitter.com/aioznetwork?lang=en,,https://t.me/s/aiozofficial,https://medium.com/aioz-network,,https://sg.linkedin.com/company/aioz-ai,
AIREALM,muunxy,https://www.airealm.tech/,AI,ETHEREUM,AIRM,,"AIREALM is an AI Ecosystem that gathers AI utilities into a single platform, enhancing convenience and innovation for users. The AI REALM suite consists of AI Swap, Chatbot, Chart Bot, and AI Auditor, catering to users of all levels.",,ZZ,,,,,,,,
Airlyft,2c4d5r,https://airlyft.one/,NOT_DEPIN,,,,"Discover Thriving Communities, Participate in Engaging Campaigns and Win Irresistible Rewards like NFTS, Tokens and Whitelists.",,,,,906232393986371644,,,,https://www.linkedin.com/products/kyteone-airlyft/,
AIRO,8q0l7y,https://www.airo.network/,SENSORS,,,,AIRO is a decentralized air quality monitoring network.,Environmental,,,https://twitter.com/AIRO_MU,1089157531001167958,,https://medium.com/@airo.network,https://github.com/airo,https://www.linkedin.com/company/airo-missions,
AirTor,l9if1e,https://ator.io/,WIRELESS,ETHEREUM,ATOR,airtor-protocol,AirTor: Proof-of-uptime and relay hardware for passive earning and support of Tor.,,,,https://twitter.com/atorprotocol,1083735132470521907,https://t.me/atorcommunityportal,https://medium.com/@ZeroSumTrayder/ator-protocol-the-next-big-thing-6d67a87243e2,https://github.com/ATOR-Development,,
AIT,ux0c4s,https://ait.tech/,AI,,,,Intersection of AI & blockchain,,EV3 Sal,,,,,,,,
Akash,qmmyw0,https://akash.network/,COMPUTE,COSMOS,AKT,akash-network,Akash is an open-source supercloud that enables secure and efficient buying and selling of computing resources.,GPUs,,,https://twitter.com/akashnet_,747885925232672829,,https://medium.com/@akashnet_,https://github.com/akash-network,http://www.linkedin.com/company/akash-network,
Akord,5fwdog,https://akord.com/,COMPUTE,,,,Akord: decentralized storage solution giving users control over data. A privacy hub and data marketplace.,Storage,,,https://twitter.com/AkordTeam,890229689019432981,,,https://github.com/Akord-com,https://fr.linkedin.com/company/akord-co,
Albedo,iqd05g,https://albedo.com/,NOT_DEPIN,,,,Albedo's low-flying satellites capture visible and thermal imagery at the highest resolution commercially available.,Satellites,,,https://twitter.com/vaxchain,,,,,https://www.linkedin.com/company/albedo-space/,
Aleph Zero,qxdzwc,https://alephzero.org/,NOT_DEPIN,,AZERO,,"Aleph Zero is a layer 1 privacy-enhancing blockchain that ensures scalability, low transaction fees, instant finality, and optimal security. It's powered by a novel consensus protocol and the WASM-based technology stack.",,,,,775720634848116807,,,,,
Aleph,shwbn0,https://aleph.im/,COMPUTE,ETHEREUM,ALEPH,aleph-im,"Aleph.im is an open-source crosschain network featuring decentralized database including file storage, computing, and a decentralized identity (DID) framework.",,,,https://twitter.com/aleph_im,,https://t.me/alephim,https://medium.com/aleph-im,,https://www.linkedin.com/company/aleph-im/?originalSubdomain=fr,
Alephium,agw79k,https://alephium.org/,BLOCKCHAIN_INFRA,ETHEREUM,ALPH,alephium,"Alephium is a blockchain platform that combines innovative sharding, a stateful sUTXO model, and Proof-of-Less-Work to deliver scalable, secure, and energy-efficient dApps for real-world applications.",,ZZ,,,,,,,,
Algovera,vnkyd5,https://www.algovera.ai/,AI,,,,"Algovera is a decentralized AI platform that allows individuals and teams to create, use and share personalized AI.",,,,https://twitter.com/algoveraai,893460895999590450,,https://handbook.algovera.ai/blog/,https://github.com/AlgoveraAI/,https://www.linkedin.com/company/algovera/?originalSubdomain=ie,
AllianceBlock,zgvzl4,https://allianceblock.io/,NOT_DEPIN,ETHEREUM,ALBT,allianceblock,AllianceBlock builds gateways between traditional & decentralized industries with blockchain infrastructure.,,,,https://twitter.com/allianceblock,742466730202234960,https://t.me/allianceblock,https://medium.com/allianceblock/allianceblock-the-next-era-of-allianceblock-eabb78b29ac3,https://github.com/Stichting-AllianceBlock-Foundation/,http://www.linkedin.com/company/allianceblock,
ALLIN,q9od26,https://www.allin.so/,AI,ETHEREUM,ALLIN,all-in,"All In is an AI-focused project, designed to empower communities and projects to fully utilize AI technology. They offer data analysis and management, process automation, customer services and community management, and content development services.",,ZZ,,,,,,,,
Alpha Radar,q4l7ze,https://alpharadarbot.xyz/,AI,ETHEREUM,ARBOT,alpha-radar-bot,"Alpha Radar AI is a powerful AI ecosystem that harnesses advanced AI and LLM technologies. The ecosystem includes a Liquidity scanner, alpha radar bot, GameFi bot, web3.0 LLM, and NFT/Inscription Bot.",,ZZ,,,,,,,,
AlphaRushAI,s99udg,https://alpharush.ai/,AI,ETHEREUM,RUSHAI,alpharushai,"AlphaRush AI: Real-time news, analysis, and personalized trading alpha for cryptocurrency trading.",,,,,,,,,,
Alt Labs,9093bo,https://altlabs.dev/,COMPUTE,,,,Alt Labs builds Web3 infrastructure user-friendly tools and interfaces for decentralized storage networks.,Storage,,,https://mobile.twitter.com/altlabsagency/status/1311308858816704514,,,https://medium.com/@alt_labs,https://github.com/RVA-ALT-Lab,https://uk.linkedin.com/company/alt-labs,
Altered State,9limss,https://www.alteredstatemachine.xyz/,AI,ETHEREUM,ASTO,altered-state-token,"Decentralized AI protocol for NFI, enabling ownership, trading, and training of AI agents through NFTs.",Agents,,,https://twitter.com/altstatemachine,864685888830963742,,,,https://www.linkedin.com/company/altered-state-machine/,
Althea,nag833,https://www.althea.net/,WIRELESS,GNOSIS,,,Althea is a web stack creating a marketplace for building ISPs and providing bandwidth in communities.,,,,,477147257251299350,,,,,
AltLayer,r5tb6n,https://altlayer.io/,NOT_DEPIN,,,,"AltLayer is a decentralized and elastic Rollup-as-a-Service (RaaS) protocol for application developers to launch highly scalable application-tailored execution layers (aka Layer 2s). Built on top of the RaaS protocol, AltLayer offers: 1) an SDK for developers who wish to manage their rollups themselves, and 2) a no-code dashboard for everyday users. ",,,,,954273304099815424,,,,,
Anapaya,q0o1zm,https://www.anapaya.net/,NOT_DEPIN,,,,"Move your critical services, such as websites and VPN endpoints, away from the standard internet path, and secure them behind Anapaya GATE.",,EV3 Sal,,,,,,,,
Anchor,gle4b5,https://www.greymass.com/anchor,NOT_DEPIN,,,,"Anchor Wallet is a developer of smart contract wallets, specializing in quantum resistance and Lamport signatures.",Wallet,,,https://twitter.com/pauli_group,,,,,http://www.linkedin.com/company/pauli-group,
Ancient8,xjogkp,https://www.ancient8.gg/,BLOCKCHAIN_INFRA,ETHEREUM,A8,,Ancient8 is building a DAO that develops a community and software platform to enable everyone to play and build the Metaverse while earning rewards.,,,,https://twitter.com/Ancient8_gg,882274636342116372,https://t.me/ancient8_gg,https://blog.ancient8.gg/,,https://www.linkedin.com/company/ancient8/about/,
Andrena,tgalub,https://andrena.com/,WIRELESS,,,,Andrena is a company offering high-speed internet distribution services with a focus on reduced costs.,,,,https://twitter.com/andrena_wifi?lang=en,,,,,https://www.linkedin.com/company/andrenainternet/,
Andromeda,g23dwt,https://www.andromedaprotocol.io/,COMPUTE,NATIVE,ANDR,andromeda-2,"Andromeda is developing a decentralized on-chain operating system (aOS) for Web3, streamlining operations with enhanced accessibility and efficiency.",,ZZ,,,,,,,,
Ankr,hqtk8u,https://www.ankr.com/,BLOCKCHAIN_INFRA,ETHEREUM,ANKR,ankr,"Ankr is a blockchain node infrastructure network enhancing multi-chain tools for Web3, DeFi, and the crypto economy.",RPC/Indexing,,,http://www.twitter.com/getankr,795634526918279179,https://t.me/ankrnetwork,https://medium.com/ankr-network,https://github.com/Ankr-network,http://www.linkedin.com/company/ankr,
Anon,6mqswi,https://www.anon.com/,NOT_DEPIN,,,,Anon enables developers to securely request and authenticate data from the most popular sites on the internet.,ZK,,,https://twitter.com/anonplatform,,,https://www.linkedin.com/company/anon-dot-com/about/,,,
Anryze,uvtnws,https://anryze.com/,COMPUTE,,,,Anryze is a decentralized data processing network where complex tasks can be distributed and run simultaneously.,,,,https://www.twitter.com/anryze,,https://t.me/,,,https://linkedin.com/company/anryze,
Ansa,i9mqty,https://ansaresearch.ai/,AI,,,,Ansa Research is a research firm focused on distributed infrastructure.,,EV3 Sal,,,,,,,,
Antic,hs6fc5,https://www.antic.xyz/,NOT_DEPIN,,,,Antic: Decentralized co-ownership integration for businesses.,,,,https://twitter.com/Getantic,,,https://medium.com/multeez,,http://www.linkedin.com/company/anticxyz,
Apillion,x94xlf,https://apillon.io/,NOT_DEPIN,,,,Apillion is a Web3 development platform enabling developers to build in the Polkadot ecosystem.,,,,https://twitter.com/Apillon,881835505120079912,,,https://github.com/Apillon,https://www.linkedin.com/company/apillon/,
Apron,bg8k10,https://apron.network/,NOT_DEPIN,ETHEREUM,APN,apron,"Apron is a decentralized infrastructure service network for DApp developers, users, and operators on blockchain.",,,,https://twitter.com/apronofficial1,785051859655458826,,https://apron-network.medium.com/,https://github.com/Apron-Network/,,
Apus,ztd8go,https://www.apus.network/,AI,,,,Apus is a decentralized AI bot creator network that simplifies AI model design using blockchain.,,,,https://twitter.com/apus_network,,https://t.me/+AWdHtLSl2m4yM2I1,https://medium.com/@apusnetwork,https://github.com/apuslabs,http://www.linkedin.com/company/apus-network,
Aqtis,t39a28,https://aqtis.io/,NOT_DEPIN,ETHEREUM,AQTIS,aqtis,"AQTIS is a next-generation DeFi company built on top of their own AI-powered quantitative technology. It harnesses the power of data mining, machine learning, and artificial intelligence to generate yield and distribute it across the AQTIS ecosystem.",,,,https://twitter.com/aqtis_io,1088485685754863616,,,https://aqtis.gitbook.io/aqtis-documentation/,,
AquaSave,j5agj9,https://aquasave.io/,SENSORS,,,,"AquaSave is an ecosystem that uses IoT and blockchain technologies, and relies on community participation to analyze and track the status of the planet‚Äôs water resources.",,W. L.,,https://twitter.com/AquaSaveCrypto,936317978910285844,,https://medium.com/@aquabanknetwork,https://github.com/AquaSave-io,https://www.linkedin.com/company/aquasave-io/,
Arbitrum,v0j5p5,https://arbitrum.io/,NOT_DEPIN,ETHEREUM,ARB,arbitrum,"Arbitrum: Fast, scalable and cost-efficient Ethereum scaling solution.",L1/L2,,,https://twitter.com/arbitrum,585084330037084172,https://t.me/s/arbitrum,https://medium.com/offchainlabs,,,
Arc,234u26,https://arc.market/,AI,ETHEREUM,ARC,arc,Arc is a cutting-edge Web3 and AI company offering tools for developing decentralized projects.,,,,https://twitter.com/defi_arc,835671167838060584,,https://arc-market.medium.com/,https://github.com/ARC-MARKET/,http://www.linkedin.com/company/arcdefi,
Arcblock,w4zy3x,https://www.arcblock.io/en,NOT_DEPIN,ETHEREUM,ABT,arcblock,"ArcBlock is a new decentralized developer platform that simplifies the development of Distributed Ledger Technology (DLT), Blockchain, Web3, and AI.",,,,https://twitter.com/ArcBlock_io?locale=en,,,,https://github.com/arcblock?locale=en,https://www.linkedin.com/company/arcblock/?locale=en,
Archblock,rq4805,https://www.archblock.com/,BLOCKCHAIN_INFRA,,,,"Archblock is a decentralized alternatives marketplace built on TrueFi's open, transparent and immutable financial infrastructure.",,,,https://twitter.com/archblock_,,,https://www.archblock.com/blog,,https://www.linkedin.com/company/archblock/,
Archon,vltnk6,https://archon.network/,COMPUTE,,,,"Archon Developer is a decentralized protocol enabling scientific research with secure storage, access, and governance.",Storage,,,,248822834317492245,,,,,
Arctail,z931sb,https://www.arctail.com/,NOT_DEPIN,,,,Arctail is builduing a new infrastructure for on-chain finance.,,,,,,,,,,
Arden,23pr35,https://www.arden.cc/,NOT_DEPIN,,,,Arden integrates blockchain as an additive element to businesses’ existing systems to provide their customers with the benefits of next generation technology through a familiar web2 experience.,,EV3 Sal,,,,,,,,
ArDrive,e9qw0z,https://ar.io/,COMPUTE,,,,ar.io is a network of decentralized gateways and permanent domains for the Arweave ecosystem.,Storage,W. L.,,https://twitter.com/ar_io_network,908759493943394334,,,https://github.com/ar-io,https://www.linkedin.com/showcase/ar-io/,
Ares Protocol,obq296,https://www.aresprotocol.io/,BLOCKCHAIN_INFRA,ETHEREUM,ARES,ares-protocol,Ares is an on-chain-verified oracle platform that provides secure and reliable data services for the Polkadot DeFi ecosystem,Oracle,,,https://twitter.com/AresProtocolLab,857112014648115221,https://t.me/AresProtocolLab,https://aresprotocollab.medium.com/,https://github.com/aresprotocols,https://www.linkedin.com/company/aresprotocol/,
Argon,vc3622,https://www.argonsuite.org/,BLOCKCHAIN_INFRA,,,,Aragon is a software tools provider for direct democracy.,Gov,,,,,,,https://github.com/alex-dp/solana-democracy,,
Argus,l3bqbb,https://argus.gg/,BLOCKCHAIN_INFRA,,,,"Argus is a game developer and publisher that focuses on creating innovative blockchain-based gaming experiences, with a mission to pioneer the Internet of Games through their World Engine blockchain platform designed specifically for onchain games. They aim to enable developers to build interconnected and scalable game worlds with a high degree of player-driven content and interoperability.",,,,,1113162492445724723,,,,,
AristotleAI,gtqv1n,https://www.aristotle-ai.com/,AI,,,,AristotleAI provides personalized learning experiences and insights.,,,,https://twitter.com/0xAristotleAI,,,,,,
Ark,f918a3,https://ark.io/,NOT_DEPIN,,,,"Ark is a layer-2 protocol enabling cheap, anonymous, off-chain Bitcoin payments.",L1/L2,,,https://twitter.com/survivetheark?ref_src=twsrc%5Egoogle%7Ctwcamp%5Eserp%7Ctwgr%5Eauthor,,https://t.me/s/ARK_Trading_Desk?before=3180,https://projectark.medium.com/,https://github.com/ArkEcosystem,https://uk.linkedin.com/company/ark-schools,
Arkham,zgyen3,https://www.arkhamintelligence.com/,AI,ETHEREUM,ARKM,arkham,"Arkham is a cutting-edge crypto intelligence platform that specializes in the analysis and deanonymization of blockchain transactions, providing users with detailed insights into the real-world entities behind blockchain activities.",,ZZ,,,,,,,,
Arkreen,wyn0zn,https://arkreen.com/,ENERGY,,,,Arkreen is a Web3-powered digital infrastructure for global distributed renewable energy resources.,,W. L.,,https://twitter.com/arkreen_network,1022165037235839007,https://t.me/arkreen_network,https://medium.com/@arkreen,https://github.com/arkreen,https://www.linkedin.com/company/arkreen/,
Armur,ka2bzq,https://armur.ai/,AI,,,,Armur Ai is a web3 cybersecurity product suite/platform that helps secure decentralized applications and blockchain solutions.,,,,https://twitter.com/armur_ai,1021371417134125106,,https://armur.medium.com/,,https://www.linkedin.com/company/armurai/,
Artify,22cfnq,https://artifylabs.io/,AI,ETHEREUM,AFY,artify,Artify is a platform for artists to create and sell artwork without any additional costs.,,,,https://twitter.com/artifyerc,,https://t.me/artifylabs,https://medium.com/@artifylabs,,http://www.linkedin.com/company/artifylabs,
Arttoo,xa5vpi,http://www.arttoo.network/,NOT_DEPIN,,,,Arttoo is a platform that allows for the fractionalized trading of physical artwork.,RWA,,,,,,,,,
Arweave,0vks67,https://www.arweave.org/,COMPUTE,NATIVE,AR,arweave,Arweave is a permanent and decentralized web inside an open ledger.,Storage,,,https://twitter.com/ArweaveTeam,,,https://arweave.medium.com/,,http://www.linkedin.com/company/arweave,
AscensionWx,flp6ko,https://www.ascensionwx.com/,SENSORS,,,,AscensionWx is a WeatherMiner platform that allows users to earn Helium HNT tokens by predicting weather conditions.,Environmental,,,https://twitter.com/kandaweather,859677745860968469,,,,,
Astar,j764ic,https://astar.network/,NOT_DEPIN,ETHEREUM,ASTR,astar,Astar Network is a decentralized blockchain platform for Web3 innovations.,,,,,644182966574252073,,,,,
Aston,7wi7uw,https://www.astonlabs.co/,ENERGY,,,,Aston Labs: Decentralized energy & infrastructure network. Aston Tokens = network ownership.,,,,,,,,,http://www.linkedin.com/company/aston-labs-co,
