name,id,url,category,chain,token,coinGeckoID,description,subcategories,ninja,foundingYear,twitter,discord,telegram,blog,github,linkedin,verified
Edge,gsez5y,https://edge.network/,BLOCKCHAIN_INFRA,NATIVE,EDGE,edge,"Edge is the infrastructure of Web3. A peer-to-peer network and blockchain providing high performance decentralised web services, powered by the spare capacity all around us.",,,,https://twitter.com/edgenetwork,371989135172567051,https://t.me/edgenetwork,,https://github.com/edge,,
EdgeMatrix,iespkr,https://edgematrix.pro/,AI,,,,EMC Hub is a AI+Web3 computing power and model marketplace.,,W. L.,,https://twitter.com/EMCprotocol,1101359709547679848,https://t.me/emc_network,https://medium.com/@EMCProtocol,https://github.com/EMCProtocol-dev,,
Efani,w1b0je,https://www.efani.com/,WIRELESS,,,,Efani is a provider of secure mobile services that protect high-risk individuals from mobile hacks.,,,,https://twitter.com/efani,,,,,https://www.linkedin.com/company/efani/,
Electric Tree,xhfj9r,https://vision.electrictree.com/,BLOCKCHAIN_INFRA,,,,Electric Tree is a decentralized climate finance platform built to bridge the climate financing gap for carbon removal.,Environmental,,,,,,,,,
Element,hz4cbu,https://element.io/,WIRELESS,,HYP,hyperstake,Element is a Matrix-based end-to-end encrypted communications platform.,,,,https://twitter.com/element_hq,,,https://element.io/blog/,https://github.com/vector-im,https://www.linkedin.com/company/element-hq/,
Eleuther,d1vp44,https://www.eleuther.ai/,AI,,,,"A non-profit research lab focused on interpretability, alignment, and ethics of AI. EleutherAI has trained and released many powerful open source LLMs.",,,,https://twitter.com/AiEleuther,729741769192767510,,https://blog.eleuther.ai/,https://github.com/EleutherAI,https://www.linkedin.com/company/eleutherai/,
Elixir,wrifq0,http://www.elixir.finance/,NOT_DEPIN,ETHEREUM,ELXR,elixir-finance,Elixir: Decentralized protocol for secure market-making.,,,,https://twitter.com/ElixirProtocol,1059691738349977674,https://t.me/elixirprotocol,,,http://www.linkedin.com/company/elixir-protocol,
ELOOP,c0u4u3,https://eloop.one/en/,BLOCKCHAIN_INFRA,,,,"ELOOP: Rent, share, and charge electric cars.",Ridesharing,,,,,https://t.me/eloopone,,,https://www.linkedin.com/company/eloopmobi,
Elumicate,ue1aq8,https://elumicate.com/,SENSORS,,,,World vision network powered by the people. Elumicate ceased operations in March 2024,,EV3 Sal,,,945776985240637440,,,,,
Elusiv,3wkk5f,https://www.elusiv.io/,NOT_DEPIN,,,,Elusiv is building a Web3 universal encryption layer empowering the decentralized world.,,,,https://twitter.com/elusivprivacy,963285822327652403,,https://medium.com/elusiv-privacy,https://github.com/elusiv-privacy,https://www.linkedin.com/company/elusiv/,
EMC Protocol,2l10iw,https://www.edgematrix.pro/,COMPUTE,ARBITRUM,EMC,,"EMC is a decentralized GPU computing network supported by EVM and multi-chain, serving as the gateway for Computing Power and Web3 in the AI era",,,,https://twitter.com/EMCprotocol,1101359709547679848,https://t.me/+NGI26KSbBpA3YzA0,https://medium.com/@EMCProtocol,https://github.com/EMCProtocol-dev,,
Emerge,dmf572,https://www.emergetools.com/,NOT_DEPIN,,,,Emerge is a suite of app development products designed to supercharge mobile apps and the teams that build them.,,,,https://twitter.com/emergetools,,,,,https://github.com/EmergeTools/,
Empyreal,mmo63y,https://empyreal.app/,NOT_DEPIN,ARBITRUM,EMP,empyreal,"Empyreal is a protocol that leverages privacy technology, encryption, and automation to optimize trading operations and user security across multiple blockchain platforms.",,,,https://twitter.com/empyrealSDK,1096496676845396108,https://t.me/empyrealportal,https://medium.com/@empyrealsdk,https://github.com/empyrealapp/empyrealSDK/tree/rc0.1,,
Encloud,29p0bm,https://encloud.tech/,AI,,,,"Encloud is a confidential and flexible software that enables organizations to deploy machine learning and AI like LLMs in a private, controllable, and auditable way.",,ZZ,,,,,,,,
Energiedigital,ylaztr,https://www.energiedigital.at/#p,ENERGY,,,,"Energiedigital plans, builds decentralized energy solutions for buildings and districts including private individuals in single-family homes and commercial residential and neighborhood developers.",,,,,,,https://www.energiedigital.at/#blog,,https://www.linkedin.com/company/energiedigital/,
Energy Web,tjcjjf,https://www.energyweb.org/,ENERGY,GNOSIS,EWT,energy-web,"The Energy Web Foundation fosters value creation in the energy sector by building and promoting an open, decentralized software infrastructure built around blockchain technology.",,,,,706103009205288990,,,,,
enq,i5b54g,https://enqai.com/,AI,ETHEREUM," ENQAI",,enqAI is developing a Network for Decentralized Uncensored AI Models,,,,https://twitter.com/enq_AI,1079425803441426562,https://t.me/noisegpt,,,,
enqAI,vwcy0j,https://www.enqai.com/,AI,,,,Decentralized & Uncensored AI,,Mahesh | Escape Velocity,,,1079425803441426562,,,,,
Entheos,0if1hs,https://www.entheos.network/,ENERGY,,,,Entheos Network: energy solutions & batteries for businesses globally.,Batteries,,,,,,https://entheosnetwork.medium.com/entheos-network-b3e43242a5ae,,http://www.linkedin.com/company/entheos-network,
EnviroBLOQ,czooh2,https://envirobloq.io/,SENSORS,IOTEX,,,EnviroBLOQ is a decentralized network of connected smart home devices.,,,,,,,,,,
Enzyme,x7rtjw,https://enzyme.finance/,NOT_DEPIN,ETHEREUM,MLN,melon,"Welcome to the future of asset management. Build, scale and monetise an investment strategy that suits your needs.",,,,https://twitter.com/enzymefinance,515208056720719872,https://telegram.enzyme.finance/,http://www.linkedin.com/company/enzymefinance,https://medium.com/enzymefinance,https://github.com/enzymefinance,
EO3,ttrbf5,https://www.eo3.dev/,SENSORS,,,,"EO3 is a decentralized ecosystem for Earth Data & Intelligence that connects providers (content creators), insight developers (data miners), and the user (purchaser) communities, with verification nodes to validate and distribute data & insights.",,EV3 Sal,,,,,,,,
Epics,w0bliz,https://epics.dev/en/,COMPUTE,,,,Epics is a decentralized build to earn platform for open source software development.,,,,,976136099107840071,,,https://github.com/epics-base,https://www.linkedin.com/company/epic1979,
EpiK,0lasch,https://www.epik-protocol.io/,AI,ETHEREUM,AIEPK,epik-protocol,"EpiK Protocol: Using IPFS, DAO and token economy to build a large-scale knowledge graph.",,,,https://twitter.com/EpikProtocol,740760785487265815,https://t.me/EpikProtocol,https://epikprotocol.medium.com/,https://github.com/EpiK-Protocol,http://www.linkedin.com/company/epikprotocol,
epPlex,ccemio,https://www.epplex.xyz/,NOT_DEPIN,,,,Empowering a new frontier of Solana NFT use-cases with ephemeral epNFTs,,,,,,,,,,
Equito,02ugap,https://equitofinance.com/,NOT_DEPIN,,,,Equito Finance is a chain-agnostic open-source bridge protocol.,Bridges,,,https://twitter.com/EquitoFinance,952703700483330049,,,https://github.com/EquitoBridge,https://it.linkedin.com/company/equito-finance,
Ergo,"5vuxdv""",https://ergoplatform.org/en/,NOT_DEPIN,NATIVE,ERG,ergo,"Ergo is a smart contract platform that ensures the economic freedom of ordinary people through secure, accessible, and decentralized financial tools. It is backed by a powerful scripting language and a suite of powerful zero-knowledge proofs.",,ZZ,,,,,,,,
Espresso Systems,1rgbka,https://www.espressosys.com/,NOT_DEPIN,,CAPE,,Espresso Systems is a decentralized sequencer and data availability system connecting layer-2 scaling solutions.,,,,,,,,,,
ETCMC,weqn6l,https://www.etcmc.org/,NOT_DEPIN,ETHEREUM,ETCPOW,,ETCMC is a community-driven mining pool and decentralized autonomous organization that pays additional rewards to miners through its ETCPOW token.,,,,,,,,,,
ether.fi,1agi71,https://ether.fi/,NOT_DEPIN,,,,Ether.fi is a non-custodial decentralized ETH staking method that rewards node operators for participating in staking.,Rewards,,,https://twitter.com/ether_fi,1064694900819509358,https://t.me/+C3fpSjmPqzA5NTVh,https://medium.com/etherfi,,http://www.linkedin.com/company/etherfi,
Etherisc,mtmthh,https://etherisc.com/,NOT_DEPIN,ETHEREUM,DIP,etherisc,"Etherisc is a decentralized platform that leverages the Ethereum blockchain to offer a range of insurance applications, aiming to reduce costs, automate claims through smart contracts, and democratize access to insurance and reinsurance. It utilizes its native DIP tokens for governance, staking in risk pools, and incentivizing the development of open-source insurance products.",,,,,,,,,,
Etherland,z4helo,https://etherland.world/,NOT_DEPIN,,ELAND,,"Etherland aims to digitalize real-estate properties and their owners' legal documents, granting unhinged traceability and immutability through Blockchain and IPFS technologies. The etherland ecosystem works using a utility token called ELAND. This token is used to pay for bounties, grades subscriptions, and every upcoming platform feature.",RWA,,,,,,,,,
EtherMail,hoaz0e,http://www.ethermail.io/,BLOCKCHAIN_INFRA,ETHEREUM,EMT,ethermail,"EtherMail: secure, anonymous email with blockchain rewards.",,,,https://twitter.com/ethermail_io,,https://t.me/ethermail_official,,,http://www.linkedin.com/company/xearndao,
Ethernity Cloud,iyi6t5,https://ethernity.cloud/,COMPUTE,ETHEREUM,ETNY,ethernity-cloud,Ethernity Cloud is a decentralized confidential computing ecosystem that enforces privacy for the user's data and transparency for the operations that process this data.,,,,,,,,,,
ETHforestAI,njhr2m,https://ethforest.ai/,AI,ARBITRUM,ETHFAI,ethforestai,ETHforestAI is a Web3 learning platform with an integrated AI chatbot and Learn-To-Earn features.,,,,https://twitter.com/ETHforestAI,,https://t.me/ETHforestAI,https://medium.com/@ethforestai,,,
Etho,my9a38,https://ethoprotocol.com/,COMPUTE,NATIVE,ETHO,etho-protocol,Etho Protocol (ETHO) is a decentralized data/storage hosting platform using a community-owned node network combining blockchain indexing technology and the IPFS protocol to deliver decentralized data/content on-demand.,,ZZ,,,,,,,,
Ethstorage,2kn4hu,https://eth-store.w3eth.io/,COMPUTE,,,,Ethstorage is a cost-effective Layer 2 storage rollup solution on Ethereum.,L1/L2,,,https://twitter.com/EthStorage,1040111910802182186,https://t.me/ethstorage,https://ethstorage.medium.com/,https://github.com/ethstorage/,,
Everdome,t4w143,https://everdome.io/,NOT_DEPIN,BINANCE,DOME,everdome,Creating a hyper-realistic Metaverse for a seamless Web3 experience.,,,,https://twitter.com/Everdome_io,1002185140782510181,https://t.me/everdome,,,https://www.linkedin.com/company/everdome-io/,
everVision,zr5vzn,https://ever.vision/,COMPUTE,,,,"everVision: Blockchain provider for Web3 development, offering everPay, Permaswap, PermaDAO, and Web3Infra.",,,,https://twitter.com/everVisionHQ,826354651493564446,,,https://github.com/everFinance,https://sg.linkedin.com/company/ever-vision,
Everyname,2i6tkv,https://www.everyname.xyz/,NOT_DEPIN,,,,Everyname is a provider of an advanced protocol for retrieving info from any blockchain name registry.,,,,,,,,,,
Exa,90eym0,https://www.exaprotocol.com/,COMPUTE,,,,Exa Protocol: Decentralized data storage using mobile devices.,Storage,,,https://twitter.com/ExaProtocol,916886546903347230,https://t.me/exaprotocol,,,https://linkedin.com/company/exa-protocol,
Exabits,ks1fra,https://www.exabits.ai/,COMPUTE,,,,exaBITS is a decentralized infrastructure for AI and computationally intensive applications.,GPUs,,,https://twitter.com/exa_bits,1105999312393076877,https://t.me/+D0CulDl9udZjMWIx,https://medium.com/decentralizedcomputing,,http://www.linkedin.com/company/exabits,
Expanso,rntyxj,https://www.expanso.io/,COMPUTE,,,,"Expanso runs jobs exactly where your data resides, utilizing local compute, and minimizing data throughput.",,EV3 Sal,,,,,,,,
Exponent Energy,6qah9x,https://www.exponent.energy/,ENERGY,,,,"Exponent Energy is a full stack energy company that builds chargers, batteries and everything in between to unlock 15-minute rapid charging for EVs.",,,,,,,,,,
EYWA,tbwx5g,https://eywa.fi/,BLOCKCHAIN_INFRA,,EYWA,,EYWA is a genuinely decentralized medium for transferring data between blockchains and creating aggregated cross-chain assets.,,,,https://twitter.com/eywaprotocol,880102933298049054,https://t.me/eywa_en,https://medium.com/@eywaprotocol,https://github.com/eywa-protocol,https://www.linkedin.com/company/eywa-protocol/,
EZ WiFi,oazct0,https://ezwi.fi/,WIRELESS,,,,"EZ WiFi is a WiFi management platform helping operators and providers build, monetize, and scale wireless networks.",,,,,,,,,https://linkedin.com/company/ezwifitech,
EZKL,oehbnl,https://ezkl.xyz/,AI,,,,Harness the power of machine learning in smart contracts without compromising on trust. ezkl makes it possible for anyone to apply zero-knowledge proofs in their smart contracts.,ZK,,,,1017182037964247101,,,,,
FACT0RN,w0jykb,https://www.fact0rn.io/,BLOCKCHAIN_INFRA,NATIVE,FACT,fact0rn,FACT0RN: a blockchain replacing hashing with Integer Factorization as Proof of Work. Forked from bitcoin V22.0.,,,,https://www.google.com/url?q=https%3A%2F%2Ftwitter.com%2FFACT0RN&sa=D&sntz=1&usg=AOvVaw0BdRfY4zqQMy3pneZ3jbaI,,,,https://github.com/FACT0RN,,
Fairblock,9hptcu,https://www.fairblock.network/,NOT_DEPIN,,,,"Fairblock is a blockchain infrastructure and framework that focuses on conditional decryption and programmable privacy, providing users and developers with enhanced privacy and security for on-chain applications.",,,,,1195755103735513138,,,,,
Fantom Foundation,692g5w,https://www.fantom.foundation/,NOT_DEPIN,,,,"Fantom is a decentralized, open-source, smart contract platform that aims to provide fast, secure, and scalable infrastructure for decentralized applications (dApps).",,,,,582931087005843466,,,,,
FanTV,yoxura,https://fantv.world/,SENSORS,,,,FanTV is an app-based Watch to Earn Platform that allows users to watch ad-free trending videos and earn rewards.,,EV3 Sal,,,,,,,,
Fanztar,94944x,https://fanztar.com/,AI,,,,"Fanztar empowers creators to build their fan communities and enable fans to own a share in their success, giving fans an opportunity to become a part of a Creator exclusive community.",Software,,,https://twitter.com/i/flow/login?redirect_after_login=%2Fjoin_fanztar,,,,,https://www.linkedin.com/company/fanztar/about/,
Farcaster,qbrxm3,https://www.farcaster.xyz/,NOT_DEPIN,,,,Farcaster is a sufficiently decentralized protocol for building social apps.,Social,,,https://twitter.com/farcaster_xyz,,https://t.me/farcasterdevchat,,https://github.com/farcasterxyz,https://www.linkedin.com/company/farcaster/,
Faye,pddr3z,https://www.faye.xyz/,AI,,,,"Faye is a self-learning AI chatbot for accurate, relevant, and on-chain troubleshooting of smart contracts.",,,,https://twitter.com/faye_digital,,,,,https://www.linkedin.com/company/we-eat-software/,
FEDML,913hpf,https://www.fedml.ai/,NOT_DEPIN,,,,"FedML provides an open-source community and an enterprise platform for decentralized and collaborative AI, and a web 3 AI marketplace for everyone to monetize their data, ML models, and AI apps.",L1/L2,,,https://twitter.com/fedml_ai,1011343758463356928,,https://medium.com/@FedML,https://github.com/FedML-AI/FedML,https://www.linkedin.com/company/79483881/,
Felt,9s2i5w,https://feltlabs.ai/,AI,,,,Tools for privacy preserving data science. Run machine learning or simple analytics on distributed data.,,EV3 Sal,,,927873274136891392,,,,,
Fetch.ai,mhpovr,https://fetch.ai/,AI,ETHEREUM,FET,fetch-ai,Fetch.ai is a Blockchain-based AI and ML platform connecting devices for market creation and data value addition.,,,,https://twitter.com/Fetch_ai,1141305890796994651,https://t.me/fetch_ai?utm_source=website,https://medium.com/fetch-ai,https://github.com/fetchai?utm_source=Website,http://www.linkedin.com/company/fetch-ai,
Fhenix,k7ct7d,https://www.fhenix.io/,NOT_DEPIN,ETHEREUM,,,Fhenix is the first Fully Homomorphic Encryption (FHE) powered L2 to bring computation over encrypted data to Ethereum.,,EV3 Sal,,,1113764193670275124,,,,,
Filebase,ush02g,https://filebase.com/,COMPUTE,,,,Filebase is a reliable IPFS pinning service that provides secure and efficient file storage and management.,Storage,,,https://twitter.com/filebase,827386332795371560,,,https://github.com/filebase,https://linkedin.com/company/filebase,
Filecoin,r1uv9t,https://filecoin.io/,COMPUTE,FILECOIN,FIL,filecoin,Filecoin is a decentralized storage network designed to store humanity's most important information.,,,,https://twitter.com/Filecoin,,https://t.me/filecoinio,https://filecoin.io/blog/,https://github.com/filecoin-project,,
FileStar,h7mk5k,https://filestar.net/en,COMPUTE,,STAR,filestar,"FileStar is a Web 3.0 decentralized storage, verifiable computation, and measurable bandwith network infrastructure.",Storage,,,https://twitter.com/FileStarProject,,https://t.me/filestarofficial,https://filestarofficial.medium.com/,https://github.com/filestar-project,,
Fileverse,gtzdge,https://fileverse.io/,COMPUTE,,,,On-chain people and communities deserve on-chain tools for private communication and collaboration.,,EV3 Sal,,,,,,,,
FilSwan,v3ycrj,https://www.filswan.com/homepage,COMPUTE,,,,FilSwan: web3 infrastructure for dApp development.,Storage,,,https://twitter.com/swan_chain,867879887871672331,https://t.me/swan_chain/1,https://medium.com/@swanchain,https://github.com/filswan,https://www.linkedin.com/company/swancloud,
Final Autoclaim,equ0rp,https://spacetoken.tech/,NOT_DEPIN,BINANCE,SPACE,space-token-bsc,Final Autoclaim is a user-friendly cryptocurrency faucet that allows users to claim various cryptocurrencies through automated and easy-to-use processes.,,,,,837632716862128131,,,,,
Findora,rxpqem,https://findora.org/,BLOCKCHAIN_INFRA,NATIVE,FRA,findora,Findora is a Layer-1 protocol delivering zero-knowledge solutions to Web3. Findora integrates two ledgers into a single chain: an EVM ledger for interoperability and a UXTO ledger optimized for zk operations.,,ZZ,,,,,,,,
Finterest,e1k2h0,https://finterest.gitbook.io/product-docs/,NOT_DEPIN,,,,Finterest is a decentralized borrowing/lending protocol on The Internet Computer built to support native Bitcoin.,DeFi,,,https://twitter.com/finterestICP,,,https://medium.com/finteresticp,,https://www.linkedin.com/company/finteresticp,
Firethree,gdo61v,https://www.firethree.xyz/,BLOCKCHAIN_INFRA,,,,Products and solutions for every stage of your app development journey!,,,,https://twitter.com/_firethree,,,,,,
First Studio,9psqih,https://firststudio.ai/,AI,BITTENSOR,,,The First AI Studio built on top of the #bittensor network that will onboard 10 million users.,,EV3 Sal,,,,,,,,
Firstbatch,xjzev4,https://www.firstbatch.xyz/,COMPUTE,,,,HollowDB is a decentralized key-value database on Arweave for secure and efficient data storage.,,,,https://twitter.com/firstbatchxyz_?lang=en,1088019643618308200,,https://medium.com/@FirstBatchLabs,https://github.com/firstbatchxyz,https://www.linkedin.com/company/firstbatchxyz,
FirstTensor,3b72sd,https://firsttensor.com/,AI,,,,FirstTensor is a community-powered Bittensor Validator.,,,,https://twitter.com/firsttensor,1086605920802459691,https://t.me/firsttensor,,,,
Fishcoin,0uzrya,https://fishcoin.co/,SENSORS,,,,Fishcoin is a blockchain based traceability and data ecosystem designed specifically for the global seafood industry.,Environmental,,,https://twitter.com/i/flow/login?redirect_after_login=%2FFishcoinNetwork,,,https://medium.com/fishcoin,,http://www.linkedin.com/company/fishcoin,
Fission,dkaff9,https://fission.codes/,BLOCKCHAIN_INFRA,,,,Fission builds open source protocols and managed solutions that empower developers to construct scalable and secure software applications.,,,,https://twitter.com/FISSIONcodes,478735028319158273,,https://fission.codes/blog/,https://github.com/fission-codes/,https://ca.linkedin.com/company/fissioncodes,
Flai,6j3y7z,https://www.flai.ai/,WIRELESS,,,,Flai develops a web-based application that automatically turns raw geospatial data into meaningful information.,,,,,,,https://www.flai.ai/blog,,http://www.linkedin.com/company/flai-ai,
Flare,8u08fw,https://flare.network/,BLOCKCHAIN_INFRA,ETHEREUM,FLR,flare,"Flare is the blockchain for data, providing developers with secure decentralized access to high-integrity data from other chains and the internet. ",,,,https://twitter.com/FlareNetworks,743422808499028049,https://t.me/FlareNetwork,https://medium.com/flarenetwork,https://github.com/flare-foundation,https://www.linkedin.com/company/flarenetwork/,
Fleek,7f3dsw,ipns://fleek.network/,COMPUTE,,,,"Fleek Network is optimized to facilitate the deployment and running of performant, geo-aware decentralized web and edge services.",,EV3 Sal,,,965698989464887386,,,,,
Flex,nxn4fc,https://flexwallet.xyz/,NOT_DEPIN,,,,Digital wallet from the future,,,,,,,,,,
fliggs,gkt0ei,https://fliggs.com/en,WIRELESS,,,,"fliggs mobile leads the way in the all-digital MVNO revolution, employing Web3 technology to transform the telecom industry.",,,,https://twitter.com/fliggs_mobile,,,,,https://www.linkedin.com/company/fliggs/,
Flock Safety,kcetq1,https://www.flocksafety.com/,NOT_DEPIN,,,,Developer of camera technology designed to capture images to eliminate crime while protecting privacy.,,,,https://twitter.com/Flock_Safety,,,,,https://www.linkedin.com/company/flock-safety/,
Flock,ruqwx5,https://flock.io/,AI,,,,Decentralized federated learning,,EV3 Sal,,,977200106531082240,,,,,
Flow,g4borf,https://flow.com/,NOT_DEPIN,,FLOW,flow,"Flow is a permissionless layer 1 blockchain, empowering developers to create limitless Web3 apps for mainstream adoption",L1/L2,,,https://twitter.com/flow_blockchain,613813861610684416,,https://flow.com/blog,https://github.com/onflow,https://www.linkedin.com/company/flow-blockchain/,
Flowcarbon,hyh5ix,https://www.flowcarbon.com/,NOT_DEPIN,,GNT,,Flowcarbon is a blockchain-enabled carbon credit trading platform leveraging new technology and innovative financing structures to scale the voluntary carbon market (VCM).,,,,https://twitter.com/weareflowcarbon,,,,https://github.com/flowcarbon,https://www.linkedin.com/company/flowcarbon/,
Fluence,ul9uzl,https://fluence.network/,COMPUTE,,,,Fluence - decentralized platform for creating peer-to-peer apps.,,,,https://twitter.com/fluence_project,483968379833679873,https://t.me/fluence_project,https://medium.com/fluence-network,https://github.com/fluencelabs,http://www.linkedin.com/company/fluence-labs,
Fluent,5sn1ou,https://fluentlabs.xyz/,NOT_DEPIN,,,,Fluent is a general-purpose zkWasm L2 that brings web2’s favorite execution environment onto web3’s most permissionless blockchain. Fluent offers developers the freedom to build composable apps in almost any programming language on Ethereum.,,ZZ,,,,,,,,
Flurry,0l3hoz,https://www.flurry.finance/,NOT_DEPIN,ETHEREUM,FLURRY,flurry,Flurry Finance is a protocol that runs on multiple blockchains and specializes in the DeFi market.,,,,https://twitter.com/FlurryFi,896956264590999553,https://t.me/FlurryFinance_Official,https://medium.com/flurry-finance,,https://www.linkedin.com/company/flurryfinance/about/,
Flux,0t3lhn,https://runonflux.io/,COMPUTE,NATIVE,FLUX,zelcash,"Flux is a decentralized Web3 cloud infrastructure comprised of user-operated, scalable and globally distributed computational nodes.",,,,https://twitter.com/RunOnFlux?ref_src=twsrc%5Egoogle%7Ctwcamp%5Eserp%7Ctwgr%5Eauthor,404415190835134464,https://t.me/runonflux,https://fluxofficial.medium.com/,https://github.com/RunOnFlux,https://www.linkedin.com/company/flux,
FluxBeam,t5hmj6,https://fluxbeam.xyz/,NOT_DEPIN,,,,,Telegram,,,https://solana.com/discord,,https://solana.com/telegram,https://solana.com/news,https://solana.com/github,http://www.linkedin.com/company/solanalabs,
Fluxbot,ld3i07,https://fluxbot.xyz/,NOT_DEPIN,,,,Fluxbot Trading is a Solana-based telegram bot.,,,,,,,,,,
Flywheel Systems,yus8h6,https://flywheel.systems/,NOT_DEPIN,,,,Flywheel Systems is a strategic infrastructure deployment and marketing expertise provider offering solutions and advice to smart investors to earn passive income through DePIN projects.,,ZZ,,,,,,,,
FMS,o8amjp,https://fmtlol.com/,NOT_DEPIN,POLYGON,FMS,,"FMS(Freedom of Mind Solutions) is an open-source social and blogging platform that uses web3 technology to power its services. Users can create profiles and share content by posting articles, blogs, images, videos,s, etc., or join groups with similar interests.",,,,https://twitter.com/fmtlol?lang=en,,,,,,
Foam,olxxfj,https://foam.space/,SENSORS,ETHEREUM,FOAM,foam-protocol,Foam is a blockchain-based platform enabling crowdsourced maps and decentralized location services.,Positioning,,,https://twitter.com/foamspace,,,,https://github.com/f-o-a-m/,http://www.linkedin.com/company/foam-corp,
Fog Works,aqg014,https://fogworks.io/,COMPUTE,,,,Fog Works: Developer of decentralized storage using blockchain tech.,Storage,,,https://twitter.com/fogworksinc/,1046683342025789541,,,,https://www.linkedin.com/company/fog-works,
FOIL,wd2g59,https://foil.network/,NOT_DEPIN,,,,"Foil: Scalable, secure blockchain for IoT with high-speed transactions.",L1/L2,,,https://twitter.com/FoilNetwork,773843041357135882,,,,https://www.linkedin.com/company/foil2/about/,
Fonoster,qn9h4k,https://fonoster.com/,NOT_DEPIN,,,,Fonoster is a free platform for building voice applications and integrating them with your business app.,,,,https://twitter.com/fonoster,1016419835455996076,,,https://github.com/fonoster,http://www.linkedin.com/company/fonoster,
Forta,jed7z0,https://forta.org/,AI,ETHEREUM,FORT,forta,"Forta is a real-time detection network for blockchain activity, providing alerts to neutralize threats and prevent loss.",,,,https://twitter.com/FortaNetwork,869983523371642921,https://t.me/s/Forta_Network_Official?before=30,,https://github.com/forta-network,http://www.linkedin.com/company/fortafoundation,
