name,id,url,category,chain,token,coinGeckoID,description,subcategories,ninja,foundingYear,twitter,discord,telegram,blog,github,linkedin,verified
DarkFi,rowqtv,https://dark.fi/,COMPUTE,,,,"DarkFi: secure, anonymous L1 platform for hidden validators & anti-fragile environment for app dev.",L1/L2,,,https://twitter.com/DarkFiSquad,,https://t.me/darkfichat,,https://github.com/darkrenaissance/darkfi,https://linkedin.com/company/dark-oy,
Darwinia,gpxg0c,https://darwinia.network/,NOT_DEPIN,ETHEREUM,KTON,darwinia-commitment-token,Darwinia is a open cross-chain bridge protocol based on Substrate.,Bridges,,,https://twitter.com/DarwiniaNetwork,456092011347443723,https://t.me/DarwiniaNetwork,https://medium.com/darwinianetwork,https://github.com/darwinia-network,http://www.linkedin.com/company/darwinia-network,
Data Lake,tq5svh,https://data-lake.co/,NOT_DEPIN,ETHEREUM,LAKE,data-lake,Data Lake is a DeSci project creating a global Medical Data Donation system based on blockchain technology to support medical research and AI.,DeSci,EV3 Sal,,,,,,,,
Data Union,y01ooy,https://dataunions.org/,BLOCKCHAIN_INFRA,,,,"Data Union incentivizes crowdsourcing for data, enabling x-to-earn models for data unions.",Data,,,https://twitter.com/dataunions,853941437602070549,,https://blog.dataunion.app/,https://github.com/topics/data-unions,https://sg.linkedin.com/company/dataunion-app,
Databroker,08wij5,https://www.databroker.global/,BLOCKCHAIN_INFRA,ETHEREUM,DTX,databroker-dao,Databroker is a secure marketplace for peer-to-peer data exchange.,Data,,,https://twitter.com/Databroker,,,,,https://www.linkedin.com/company/databroker/,
Datagen,6rasyf,https://datagen.tech/,NOT_DEPIN,,,,Datagen provides an all-purpose generator of synthetic images of human faces and bodies.,ML,,,https://twitter.com/datagentech,,,https://datagen.tech/blog/,https://github.com/DatagenTech,https://www.linkedin.com/company/28641774/,
DataHive,ln4d6h,https://www.datahive.network/,NOT_DEPIN,,,,DataHive is an AI data platform providing the infrastructure for a fair and efficient personal information economy and consent data for research.,ZK,ZZ,,,,,,,,
Datalatte,13wbim,https://www.datalatte.com/,NOT_DEPIN,,,,"Datalatte is a dApp that empowers people to monetize their digital footprint in an anonymous, secure, and fair way.",,ZZ,,,,,,,,
DataOS,5myyzh,https://www.dataos.so/,AI,,,,DataOS is an Autonomous AI agents network composing multimodal content for endless innovation.,Agents,ZZ,,https://twitter.com/thedataos,,,,,,
DATS,qc35fu,https://datsproject.io/,COMPUTE,,,,DATS Project: automated vulnerability scanning and cybersecurity solutions with D-HPC for Blockchain and WEB3 security.,,,,https://twitter.com/home,928611824918736996,,,,https://www.linkedin.com/showcase/dats-toll-its-smartcities/,
Datum,zyw7wx,https://datum.org/,BLOCKCHAIN_INFRA,,,,"Datum: Secure, private, and anonymous data storage and trading on blockchain.",Data,,,https://twitter.com/datumnetwork,,,,,https://www.linkedin.com/company/datumfoundation/about/,
Daylight,3lfveq,https://godaylight.com/,ENERGY,,,,Daylight is a community-powered energy grid.,,EV3 Sal,,https://twitter.com/go_daylight,,,,,https://www.linkedin.com/company/go-daylight/,
DBunker,kqm1tp,https://www.dbunker.xyz/,BLOCKCHAIN_INFRA,,,,"DBunker is an RWAs and LSTs solution provider for DePIN, allowing more people to enter the world of DePIN and empowering the DePIN ecosystem.",,EV3 Sal,,https://twitter.com/dbunker_network,,,,,,
DCarbon,1bysjw,https://dcarbon.org/,ENERGY,,,,"DCarbon is a trustless and autonomous Carbon system that uses carbon agents, an autonomous IoT solution for real-time monitoring, reporting, and verification of carbon emission, and Blockchain for secure tamper-proof transactions.",,EV3 Sal,,https://twitter.com/dcarbon_project,,,,,,
dClimate,a5w7th,https://www.dclimate.net/,ENERGY,,,,"dClimate is the first decentralized network for climate data, forecasts, and models.","Environmental, Data",ZZ,,https://twitter.com/dClimateDAO,834637820584263691,http://t.me/dclimatechat-,,https://github.com/dClimate,https://linkedin.com/company/dclimatenet,
DCX,qzb5mw,https://www.dcx.group/,BLOCKCHAIN_INFRA,,,,Digital Commodity Exchange (DCX) is the home of a range of agricultural commodity trading platforms.,,,,,,,,,,
deBridge,rhpzul,https://debridge.finance/,NOT_DEPIN,,,,deBridge: blockchain interoperability and liquidity transfer protocol.,Bridges,,,https://twitter.com/deBridgeFinance,875308315700264970,https://t.me/deBridge_finance,https://debridge.finance/blog/,https://github.com/debridge-finance/,https://www.linkedin.com/company/debridge-finance/,
Decentr,og8gcn,https://decentr.net/,COMPUTE,COSMOS,DEC,decentr,Decentr is a WEB3 browser that is based on Cosmos but is truly chain agnostic. While browsing you can choose to share your data - generating PDV(Personal Data Value) and be able to earn $DEC coin.,,EV3 Sal,,,894947432125837372,,,,,
Decentral Games,m7q3yn,https://decentral.games,NOT_DEPIN,ETHEREUM,DG,decentral-games,"Decentral Games is the first fully licensed Metaverse casino. It allows users to play with crypto, invite their friends, compete for big prizes in weekly casino competitions, and attend live events from the comfort of their own homes.",,ZZ,,,,,,,,
DecentralizedAI,1kehj3,https://www.decentralizedai.xyz/,AI,,,,"DecentralizedAI is an AI Layer-2 for Google Chrome, that allows users to own and earn from their data while browsing.",,ZZ,,https://twitter.com/DecentralAIxyz,,,,,,
DecentraMind,xp303d,https://decentramind.bot/,AI,ETHEREUM,DMIND,decentramind,"DecentraMind is a comprehensive AI aggregator, utilizing BitAPAI, the AI engine of Bittensor into a user-friendly Telegram bot.",,,,,,,,,,
DeCharge,wt9yfq,https://www.rechrg.pro/,ENERGY,,,,"DeCharge offers globally compatible, lightweight hardware with DePIN technology for revolutionizing EV charging.",,ZZ,,https://twitter.com/DeCharge__,,,,,,
Dechat,nh9uzc,https://www.dechat.io/,NOT_DEPIN,ETHEREUM,CHAT,,"Dechat is an open, secure web3 communications protocol that powers decentralized user interactions. It allows developers to let their users chat, discover and transact digital assets seamlessly within and across their applications.",,,,https://twitter.com/dechat_io,1172625278271504494,,https://medium.com/@all420/dechat-e7af2f0182e7,,https://www.linkedin.com/company/dechat/mycompany/,
Deep Green,oz5vb7,https://www.deepgreen.energy/,ENERGY,,,,"Deep Green develops carbon-neutral compute systems & data centers, specializing in metro-edge computing.",,,,https://twitter.com/DeepGreenEnergy,,,,https://github.com/topics/deep-green,https://www.linkedin.com/company/deep-green-energy/about/,
DeepBrain,c1de2i,https://deepbrainchain.org/,COMPUTE,NATIVE,DBC,deepbrain-chain,"DeepBrain Chain is a distributed network for AI & Metaverse use cases, offering high-performance computing capabilities.",,ZZ,,https://twitter.com/DeepBrainChain,,https://t.me/deepbrainchainglobal,https://medium.com/@DeepBrainChainGlobal,https://www.github.com/DeepBrainChain,https://linkedin.com/company/deepbrain-chain,
Deeper,3s1vpm,https://www.deeper.network/,WIRELESS,ETHEREUM,DPR,deeper-network,Deeper is a decentralized VPN and privacy network.,VPN,,,https://twitter.com/deeper_official?lang=en,858020148158005259,https://tlgrm.eu/channels/@pornodrive/46977,https://deeper-network.medium.com/,,https://il.linkedin.com/company/deeper-cloud,
DeepFakeAI,1cdn19,https://fakeai.io/,AI,ETHEREUM,FAKEAI,deepfakeai,DeepFakeAI is a deepfake creation program using a Telegram Bot and Web App.,,,,https://twitter.com/DeepFakeAI_,1120405708186337411,https://t.me/FakeAI,https://medium.com/@FakeAI,,,
DeepSquare,5ymc3k,https://deepsquare.io/,COMPUTE,,,,DeepSquare is a company building an energy-efficient cloud computing ecosystem by reusing ICT generated heat.,,ZZ,,https://twitter.com/DeepSQUAREio,1187531501609431161,,https://medium.com/@DeepSquare.io,https://github.com/deepsquare-io,https://linkedin.com/company/deepsquare-association,
Defilliate,bh55a0,https://defilliate.xyz/,NOT_DEPIN,,,,Defilliate is an affiliate marketing platform built specifically for web3 that allows creators to monetize their content.,,,,https://twitter.com/defilliateXYZ,1158504286808981546,,,,,
Defit,jmavqd,https://app.defit.com/,SENSORS,POLYGON,DEFIT,defit,Defit is a fitness web3 brand that rewards users with a Move to Earn movement.,Health & Fitness,,,https://twitter.com/DEFITofficial,932304379694944277,https://t.me/DEFITofficial,https://defitofficial.medium.com/,,https://sg.linkedin.com/company/defitfitnessclub,
DeFli,14khqv,https://defli.network/,SENSORS,,,,DeFli builds global infrastructure for the unmanned aviation industry.,,,,https://twitter.com/Defli_Networks,1085688022001004676,,https://medium.com/@team_483,https://github.com/DeFliTeam,,
Defog,u43dxj,https://defog.ai/,NOT_DEPIN,,,,Defog.ai helps enterprises deploy fine-tuned LLMs for enterprise analytics.,ML,,,https://twitter.com/defogdata?lang=en,,,http://www.linkedin.com/company/defog-ai,https://defog.ai/blog/,https://github.com/defog-ai,
DEKUBE,q2h5ua,https://dekube.net/,COMPUTE,,,,DEKUBE is a decentralized AI computing network that enables the transformation of consumer-grade GPUs into enterprise-level AI computing power for distributed training of large-scale LLMs.,,EV3 Sal,,https://twitter.com/dekube_official,,,,,,
delta.theta,88l6l8,https://deltatheta.tech/,NOT_DEPIN,ETHEREUM,DLTA,delta-theta,delta.theta is a Peer-to-peer asset options trading platform.,,,,,,,,,,
Delysium,qhxql8,https://link3.to/delysium,AI,ETHEREUM,AGI,delysium,"Delysium develops an AI-Powered Open World Framework that empowers all users to create their own AI-Twins easily. ",,Sami,,,917041957522538557,,,,,
DeMe,oqb51e,https://deme.social/#,NOT_DEPIN,,,,DeMe: a user privacy-focused social media with rewards.,,,,https://twitter.com/DecentralisedMe,,,,,https://www.linkedin.com/company/demesocial/,
DeMR,pfd72p,https://www.demr.xyz/#/,SENSORS,SOLANA,DMR,,DeMR is a decentralized mixed reality infrastructure network (MR-DePIN). Global users can participate in scanning and building MR maps of various cities with consumer-grade devices such as mobile phones to earn tokens as a reward.,,ZZ,,https://twitter.com/DeMR_official,,,,,,
DeNet,g8kgxw,https://denet.pro/,COMPUTE,POLYGON,DE,denet-file-token,"DeNet provides a decentralized storage protocol using spare global capacities, leveraging blockchain for secure, user-owned data.",,ZZ,,,,,,,,
Dent,ahvii3,https://www.dentwireless.com/,WIRELESS,ETHEREUM,DENT,dent,Dent is a Blockchain-powered digital mobile operator providing eSIM-based mobile data and voice call services.,,ZZ,,,,,,,,
Dentity,9a3i9h,https://www.dentity.com/,BLOCKCHAIN_INFRA,,,,"Dentity aims to transform digital credentials, combating enterprise fraud by offering a feature-rich Web3 Identity & Verifiable Credentials Platform with broad identity standard integrations. ",,ZZ,,,,,,,,
DePHY,gmxzzx,https://dephy.io/,SENSORS,,,,"DePHY is an open-source hardware solution, SDKs, and tools that allow users to build and scale their DePIN app with ease.",,EV3 Sal,,https://x.com/dephynetwork,,,,,,
DePIN DAO,ebuevs,https://depindao.co/,SENSORS,SOLANA,DePIN,depin-dao,"DePIN DAO is a Big Data Center Based on Solana that allows users to contribute their data(upload their own eating, driving, and hotel information, etc) earn $Depin rewards and enjoy the process of monetizing their data.",,ZZ,,,,,,,,
DePioneers,yn6y4f,https://depioneers.com/,NOT_DEPIN,,,,"DePioneers is a new type of hybrid NFT community, merging the DePIN market with the social prowess of PFPs.",,EV3 Sal,,,,,,,,
Dera,5yinyq,https://deraconnect.com/,WIRELESS,,,,"WEB3 BASED SERVERLESS SECURE Remote Private Network Achieve high security standards with the power of blockchain Remotely access your apps, devices and business",,,,,,,,,https://www.linkedin.com/company/dera-technology/,
DeStore,ky8cpt,https://www.destore.network/,BLOCKCHAIN_INFRA,,,,DeStore is a technology service provider that facilitates convenient and secure direct-to-customer (DTC) sales. DeStore enables DTC settlement by merging hybrid products and payment data via blockchain-based Digital Twins.,,ZZ,,,,,,,,
Destra,0ln1il,https://www.destra.network/,COMPUTE,ETHEREUM,DSYNC,destra-network,"Destra Network offers a one-stop solution for all of DePIN and AI computing needs by providing a decentralized cloud infrastructure, AI computing, decentralized storage solutions, decentralized databases, and decentralized DNS solutions.",,ZZ,,https://twitter.com/DestraNetwork,,,,,,
DeTensor,be4snz,https://detensor.io/,COMPUTE,ETHEREUM,DETENSOR,detensor,"DeTensor is a marketplace for deploying nodes, VPN, cloud services, and renting & lending GPUs.",,ZZ,,https://twitter.com/DeTensorIO,,,,,,
DeVolt,qtjxs2,https://www.devolt.xyz/,ENERGY,,,,"DeVolt is a decentralized platform and protocol that enables new players to enter the electric vehicle charging market by providing monetary incentives, logistical facilitations, accessible stations, and an open, fully transparent market.",,ZZ,,https://twitter.com/ddevolt/,,,,,,
Devolved,7trv2k,https://www.devolvedai.com/,AI,POLYGON,AGC,argocoin,"Devolved AI is a decentralized AI and blockchain platform built, governed, and owned by the people, fighting corporate agendas with blockchain-based trust and transparency.",,EV3 Sal,,,,,,,,
Devour,k7et05,https://devour.io/,BLOCKCHAIN_INFRA,ETHEREUM,DPAY,devour,"Devour is a blockchain-powered food ordering platform that aims to bridge the gap between restaurants and Gen Z through tokenized campaigns, engagement challenges, and by embedding food ordering options within digital worlds.",,ZZ,,https://twitter.com/GoDevour,,,,,,
DexCheck,wt759c,https://dexcheck.ai/,AI,ETHEREUM,DCK,dexcheck,DexCheck: AI-powered Crypto & NFT Analytics platform for real-time insights and market analysis.,,,,https://twitter.com/DexCheck_io,,https://t.me/dexcheck,https://medium.com/@DexCheck,,,
DIA,p00wkk,https://www.diadata.org/,BLOCKCHAIN_INFRA,ETHEREUM,DIA,dia,"DIA is an open-source data and oracle platform for Web3, providing fully customizable and transparent feeds for smart contracts.",,,,,772395240677179402,,,,,
Dialect,0c8gl1,https://www.dialect.to/,NOT_DEPIN,,,,"Dialect is developing a protocol for smart messaging. It offers ‚Äädynamic, composable dapp notifications and wallet-to-wallet chat. Powered by Solana.",,,,https://twitter.com/saydialect,1168929408279646278,,https://medium.com/dialect-labs,,https://www.linkedin.com/company/dialect-labs/about/,
Digileaf,3qppu8,https://digileaf.io/,ENERGY,,LEAF,,"DigiLeaf is a Solar Panel integrated with the Algorand Blockchain, that not only diminishes carbon footprints but also contributes to a decentralized power network. DigiLeaf hardware earns LEAF tokens, incentivizing support for a greener Earth.",,ZZ,,,,,,,,
Digital Gaia,hq0zgu,https://www.digitalgaia.earth/,BLOCKCHAIN_INFRA,,,,Decentralized platform optimizing local communities environmental impact with AI and mobile app.,"Environmental, Data, Rewards",,,https://twitter.com/_digitalgaia,,,,,http://www.linkedin.com/company/digital-gaia,
Dimitra,18fpn9,https://dimitra.io/,SENSORS,ETHEREUM,DMTR,dimitra,Dimitra is a blockchain platform that is democratizing the Agricultural Technology space for smallholder farmers globally.,,,,,857710510652391505,,,,,
DIMO,0wr2ea,https://dimo.zone/,SENSORS,POLYGON,DIMO,dimo,DIMO is a decentralized ecosystem of connected vehicles.,Auto,,,https://twitter.com/DIMO_Network,892438668453740634,,https://dimo.zone/news,https://github.com/DIMO-Network,https://www.linkedin.com/company/dimo-network,
Dinari,u586qc,https://www.dinari.com/,NOT_DEPIN,ARBITRUM,DIS.D,dinari-nvda-dshares,"Dinari: dShare Platform with real-world asset backed tokens, granting access to securities on Arbitrum network.",RWA,,,https://twitter.com/DinariGlobal,1014801661740462143,https://t.me/dinariglobal,,https://github.com/dinaricrypto,https://www.linkedin.com/company/dinari-global/,
Diode,c01rpe,https://diode.io/,NOT_DEPIN,,,,Diode is a Web3 software company committed to providing fundamental technologies for fully decentralized authentication and routing of network participants.,,,,https://twitter.com/diode_chain,,https://t.me/diode_chain,,https://github.com/diodechain,https://www.linkedin.com/company/diode-chain/,
Dione,ew04hq,https://www.dioneprotocol.com/,ENERGY,ETHEREUM,DIONE,dione,Dione is a blockchain company developing renewable energy trading technology.,L1/L2,,,https://twitter.com/firstone_DIONE,,https://t.me/DioneProtocol,https://github.com/DioneProtocol/Dione,,https://www.linkedin.com/company/dione,
disBalancer,1hoj55,https://disbalancer.com/about/,COMPUTE,ETHEREUM,DDOS,disbalancer,disBalancer operates as a decentralized infrastructure load balancer with a built-in site where users can rent out excess bandwidth and storage and purchase content delivery and DDoS protection services.,,ZZ,,,,,,,,
District Labs,xcf8bl,https://districtlabs.com/,NOT_DEPIN,,,,"Provider of a provision infrastructure that allows developers to connect to protocols, and deploy to decentralized networks with one unified development workflow.",,,,,,,,,https://www.linkedin.com/company/districtlabs/,
district0x,r5hrge,https://district0x.io/,BLOCKCHAIN_INFRA,ETHEREUM,DNT,district0x,"District0x is a blockchain-based network of decentralized online marketplaces, known as districts, which are operated by community members without centralized leadership.",,ZZ,,https://twitter.com/district0x,,,,,,
Dither AI,dgww01,https://dith.ai/,AI,SOLANA,DITH,dither,Dither is a multi-faceted experiment that leverages the Solana ecosystem to build the world's most powerful AI time-series models for trading.,,ZZ,,https://twitter.com/Dither_Solana,,,,,,
dKargo,zt0tgx,https://dkargo.io/en,BLOCKCHAIN_INFRA,ETHEREUM,DKA,dkargo,"dKargo is a Decentralized and Cooperative Protocol for Next Generation Logistics. ",,,,https://twitter.com/dKargo_Official,,https://t.me/dKargo_Official_KR,https://blog.naver.com/dkargo,https://github.com/dKargo,https://www.linkedin.com/company/dkargo/about/,
DLTEO,byzgll,https://www.dlteo.com/,SENSORS,,,,DLTEO is a platform to monetize and process Earth Observation Data & AI models.,Environmental,ZZ,,https://twitter.com/dlt_eo,,,,,https://at.linkedin.com/company/dlteo-gmbh,
Dmail,84v1j0,https://dmail.ai/,AI,BINANCE,DMAIL,dmail-network,Dmail is an AI-powered decentralized email platform that empowers users with ownership and control of their data.,,,,https://twitter.com/dmailofficial,906006936531660831,https://t.me/dmailofficial,https://medium.com/@dmail_official,https://github.com/dmailofficial/dmail,http://www.linkedin.com/company/dmail-idee-utili-e-introvabili,
DMC,eic5xo,https://dmctech.io/en,COMPUTE,,DMC,datamall-coin,Datamall Chain is an open-source blockchain platform that provides stable and decentralized storage services for web3 and Dapps.,Storage,EV3 Sal,,,,,,,,
Dock,rz5js9,https://www.dock.io/,BLOCKCHAIN_INFRA,POLKADOT,DOCK,dock,"Dock is a Verifiable Credentials company that provides Dock Certs, a user-friendly, no-code platform, and developer solutions that enable organizations to issue, verify, manage, and revoke fraud-proof credentials efficiently and securely.",,ZZ,,,,,,,,
Dockhive,gw14hr,https://dockhive.io/,COMPUTE,,,,DockHive is a cutting-edge platform leveraging blockchain and decentralized networks for secure and scalable Docker container management.,,W. L.,,https://twitter.com/dockhive,1141165775625924788,https://t.me/Dockhive,https://dockhive.medium.com/,https://github.com/DockHive/dht,https://www.linkedin.com/company/dockhive/,
Dojima,aomkd4,https://www.dojima.network/,NOT_DEPIN,,,,Dojima is an omnichain EVM layer enabling cross-chain applications.,,,,https://twitter.com/dojimanetwork,864498254958821378,,,https://github.com/dojimanetwork,https://www.linkedin.com/company/dojimanetwork,
Dolpin,ns7fn7,https://dolpin.io/,COMPUTE,,,,"Dolphin: Decentralized cloud storage platform for file encryption, access control, and beneficiaries.",Storage,,,https://twitter.com/Dolphin_Emu,967709540822945792,,,,https://uk.linkedin.com/company/dolphin,
Domani,kistgs,https://domani.finance/,NOT_DEPIN,ETHEREUM,DEXTF,dextf,"DOMANI is an asset management protocol for DeFi that provides minting, trading, redeeming, and liquidity for non-custodial oracle-less tokenized portfolios (XTFs).",,,,,,,,,,
Dongo AI,nse71f,https://dongo.ai/,AI,ETHEREUM,DONGO,dongo-ai,"Dongo AI is a cutting-edge platform that integrates AI with blockchain technology to provide personalized tools and bots for Web 3.0 ecosystems, enhancing market analysis, business automation, and decision-making for digital enterprises.",,ZZ,,https://twitter.com/Dongo_AI,,,,,,
Dor,365s2t,https://www.getdor.com/,SENSORS,NATIVE,DOR,dor,"Dor is a thermal sensing, battery-operated people counter that collects foot traffic data for businesses, provides analytics, and allows them to earn crypto rewards.",,ZZ,,https://twitter.com/dortechnologies,,,,,,
Dotchain,jcei9t,https://dotchain.network/,BLOCKCHAIN_INFRA,,DOT,,Dotchain is the Fastest Launching Blockchain Network that allows users to mine crypto blocks and earn coins using their phones.,,ZZ,,https://twitter.com/dot_blockchain,,,,,,
dotmoovs,lipfwr,https://dotmoovs.com/,AI,ETHEREUM,MOOV,dotmoovs,Dotmoovs uses AI scoring & monetization through $MOOVs investment.,,,,https://twitter.com/dotmoovs,,https://t.me/s/dotmoovs_announcements?before=1038,https://dotmoovs.medium.com/,https://github.com/dotmoovs,http://www.linkedin.com/company/dotmoovs,
DotOracle,n8t17l,https://dotoracle.network/,NOT_DEPIN,,,,DotOracle is a decentralized bridge on Casper Network and a cross-chain bridge supported by EVM chains and non-EVM chains.,Bridges,,,https://twitter.com/DotOracle,,https://t.me/dotoracle,https://medium.com/@dotoracle.network,https://github.com/dotoracle/dotoracle-website,https://www.linkedin.com/company/dotoracle,
Drawtech,xyyiaq,https://www.draw.tech/,NOT_DEPIN,,,,Drawtech is a crypto-economic drawing game built in MUD as a Progressive Web App (PWA).,,,,,,,,,,
DreamOS,k33zry,https://www.dreamos.app/,NOT_DEPIN,,,,DreamOS is the operating system for web3 where users can manage their crypto & NFTs and access their favorite dApps all in the same interface.,,,,,,,,,,
DRIFE,con8un,https://www.drife.io/,SERVICES,BINANCE,DRF,drife,"Drife is a decentralized ride-hailing platform powered by blockchain with the intent of empowering both, the drivers and riders.",Ridesharing,ZZ,,https://twitter.com/Drife_official,1177521017917288448,https://t.me/Drife_officialchat,,,https://www.linkedin.com/company/drifeofficial,
Drive to Earn,bj8kjt,https://www.d2e.info/,SENSORS,POLYGON,DTE,drive-to-earn,Drive to Earn is Web3.0 project that will revolutionize the drive market.,Ridesharing,,,,,,,,,
DriveX,yidy7d,https://www.drivex.zone/,SENSORS,,,,DriveX is a decentralized marketplace for vehicle data that unlocks new revenue and financing opportunities for owners and operators for mobility and transportation.,Auto,,,https://twitter.com/DriveXProtocol,,,,,,
Drone Link,0w936j,https://www.dronelink.com/,BLOCKCHAIN_INFRA,,,,Drone Link uses DePin model to enhance drone performance and accelerate regional expansion.,,,,https://twitter.com/DronelinkHQ/,,,,,https://www.linkedin.com/company/dronelink/,
Drop,qnfsx5,https://dropwireless.io/,WIRELESS,IOTEX,DWIN,,Drop Wireless is a decentralized wireless network for IoT use cases.,Data,ZZ,,https://mobile.twitter.com/dropwireless,,,,https://github.com/timogiles/wireless-dead-drop,https://ca.linkedin.com/company/joindrop,
DROPPS,cmvmnd,https://www.dropps.io/,NOT_DEPIN,,,,Developer of a decentralized infrastructure for the new creative economy intended to build d-apps and protocols that leverage emerging market opportunities.,L1/L2,,,https://twitter.com/dropps_io,900360236051865650,,https://medium.com/dropps,https://github.com/dropps-io,https://www.linkedin.com/company/dropps-io/,
Druglike,axqfta,https://druglike.com/,NOT_DEPIN,,,,"Druglike is a platform for democratizing the access, cost, and rewards of early-stage drug discovery.",,ZZ,,https://twitter.com/druglike_io,977966236627533886,,,,,
DSLA,9mm3mn,https://stacktical.com/,NOT_DEPIN,ETHEREUM,DSLA,stacktical,DSLA Protocol reduces user exposure to service delays and financial losses through agreements.,,,,https://twitter.com/willitscale,,https://t.me/stacktical,https://medium.com/@stacktical,https://github.com/Stacktical,http://www.linkedin.com/company/stacktical,
DStor,p5n1y8,https://dstor.cloud/,COMPUTE,,,,DStor is a globally-distributed cloud storage network.,Storage,ZZ,,https://twitter.com/dstor,,,,https://github.com/SitePen/dstore/blob/master/docs/Store.md,https://www.linkedin.com/company/dstor,
dTelecom,adga80,https://dtelecom.org/,COMPUTE,ARBITRUM,DTEL,,"Decentralized Real-Time Communication: Build app with live audio/video/data communications. Own the resources, network, and data. Earn as a community member.",,W. L.,,https://twitter.com/DTEL_org,,,,https://github.com/dTelecom,,
DTravel,37xksc,https://www.dtravel.com/,SERVICES,ETHEREUM,TRVL,dtravel,"DTravel is a decentralized platform for home-sharing economy, ensuring easy and secure short and long-term stays.",,,,https://twitter.com/DtravelDAO,894038050999517184,https://t.me/dtravelcommunity,https://medium.com/dtravel-community,https://github.com/dTravel,https://www.linkedin.com/company/dtraveldao/,
Dupe Fi,uuhuxv,,NOT_DEPIN,,,,"Dupe Fi is a platform that provides tokenization infrastructure for web2 gaming assets, starting with CSGO.",Gaming,,,,,,,,,
Dusk,hg74ov,https://dusk.network/,NOT_DEPIN,ETHEREUM,DUSK,dusk,"Dusk is a permissionless, ZK-friendly L1 blockchain protocol focused on Compliance and Privacy to tokenize RWA.",,ZZ,,,,,,,,
