name,id,url,category,chain,token,cmcSlug,coinGeckoID,description,subcategories,twitter,discord,telegram,blog,github,linkedin
Realio,tg1g7b,https://realio.network/,NOT_DEPIN,ETHEREUM,RIO,,realio-network,Realio manages real-world assets across multiple chains using Cosmos SDK and Tendermint.,--,https://twitter.com/realio_network,,https://en.telghub.com/content?id=43971,https://www.realio.fund/blog,https://github.com/realiotech,https://www.linkedin.com/company/realio
Really,twhfdd,https://www.really.com/,WIRELESS,,,,,"Really Wireless is a decentralized mobile network based in Austin, Texas.",--,https://twitter.com/reallywireless,,,https://www.really.com/learn,,http://www.linkedin.com/company/reallywireless
ReapChain,15hta4,https://reapchain.com/,NOT_DEPIN,ETHEREUM,REAP,reapchain,reapchain,ReapChain: Hybrid blockchain solving trilemma and integrating IoT through distributed storage and PID.,IoT,https://twitter.com/ReapChain,,https://t.me/ReapchianOfficial,https://blog.naver.com/reapchain,https://github.com/reapchain/testnets,
ReGen,sbgvjh,https://www.regen.network/,NOT_DEPIN,COSMOS,REGEN,,regen,"ReGen focuses on Hydrogen, Ammonia, and Methanol trading for the New Fuel Economy.",Environmental,https://twitter.com/regen_pk,https://discord.com/invite/regen-network,,,,https://www.linkedin.com/company/regen-sw/
Relay,b0vnal,https://www.relaywireless.com/,WIRELESS,,,,,"Relay is a provider of tools for DeWi deployers and WISPs, facilitating telecom network building and management.",--,https://twitter.com/relaydevice,,,,https://github.com/relay-tools,https://www.linkedin.com/company/relaypro
Renatus,83jvhp,https://www.renatus-robotics.com/,,,,,,Renatus is the first logistics system completing orders at one station.,Robotics,https://twitter.com/renatusgaming?lang=en,,,https://discord.com/invite/G9SCvAE,,https://ie.linkedin.com/company/renatus-capital-partners
Render,drs2bu,http://renderfoundation.com/,AI,ETHEREUM,RNDR,,render-token,Render is a decentralized rendering platform for next-gen media production.,GPUs,https://twitter.com/rendernetwork,https://discord.com/invite/rendernetwork,https://t.me/rendernetwork,https://medium.com/render-token/,https://github.com/rendernetwork/,http://www.linkedin.com/company/render-network-foundation
Revert,hcinar,https://www.revert.dev/,NOT_DEPIN,,,,,"Revert makes it incredibly easy to build integrations with any third party API. With Revert Unified API, you can integrate with CRMs, marketing automation platforms, ticketing tools, file storage systems and accounting tools. Oh! And we are open-source too!",,https://twitter.com/revertdotdev,https://discord.com/invite/q5K5cRhymW,,https://www.linkedin.com/company/90436779/,,https://github.com/revertinc/Revert
RevoFi,bdxcwj,https://revofi.com/,WIRELESS,,,,,RevoFi is a decentralized wireless infrastructure platform.,--,https://twitter.com/revofico?lang=en,,,,,https://www.linkedin.com/company/revofi
Riddle&Code,cn2pt1,https://www.riddleandcode.com/,SENSORS,,,,,Riddle&Code: Connecting physical assets with Web3 technology for secure communication and transactions.,IoT,https://twitter.com/riddleandcode,https://discord.com/invite/Cza9zX8RZr,,,,https://www.linkedin.com/company/riddle-&-code/?originalSubdomain=at
RightsfuAlly,stk33p,https://rightsfually.com/en/,NOT_DEPIN,,,,,"We help usher artists and independent content creators into the world of FAIR content attribution. We simplify the process of NFT rights creation, distribution and consumption for the creator and filmmakers economy.",NFTs,https://twitter.com/RightsfuAlly?t=CF-wuGubyRb9dG8K_dnP5Q&s=08,,,https://www.linkedin.com/showcase/rightsfually/?trk=organization_guest_main-feed-card_reshare-text,,
Roam,345ael,https://www.roamnetwork.xyz/,WIRELESS,,,,,Roam is a crypto-native telco initiative enabling easy setup of mobile networks for 4G or 5G connectivity.,Mobile,https://twitter.com/roam_network,https://discord.com/invite/ZKhhX7BKvP,https://t.me/+Xk2-5Sa02yFjMDE0,https://medium.com/@Roam_Network,,http://www.linkedin.com/company/roamnetwork
RobotEra,t7b6bu,https://robotera.io/,NOT_DEPIN,,,,,RobotEra: play-to-earn gaming with NFTs and metaverse world-building.,Gaming,https://twitter.com/robotera_io,https://discord.com/invite/robotera,https://t.me/+_wOHpPocsxE3NjBh,,,https://www.linkedin.com/company/robot-era/
Robotized,n87ym5,https://www.robotiz3d.com/,OTHER,,,,,"Robotiz3d is building the world’s first autonomous road maintenance vehicle to help tackle the spiralling pothole problems. Combining robotics, ai, and autonomous vehicle technologies, their battery powered system can perform driverless patrol of the roads, automatically detecting and repairing surface defects such as cracks and potholes. ",,,,,,,
Roko,kz7n8o,https://roko.network/,AI,ETHEREUM,ROKO,,roko-network,Roko Roko is a self-organizing human-machine network focused on deep-tech R&D protocol bootstrapping.,Agents,,https://discord.com/invite/fZXkYMAchQ,https://t.me/RokoNetwork,,,
Rollbit Coin,3m9m9c,https://rollbit.com/,NOT_DEPIN,ETHEREUM,RLB,,rollbit-coin,"Rollbit offers casino games, sportsbook, futures trading, and NFT trading.",Gaming,https://twitter.com/rollbitcom,https://discord.com/invite/Mwx3zqH,,https://blog.rollbit.com/,,
Roso,36f3to,https://roso.vip/,NOT_DEPIN,ETHEREUM,ROSO,lit,roso-elite-gamblers-mansion,"Roso is a diverse online casino and gaming platform, offering a wide range of gambling experiences.",Gaming,,,,,,
RSS3,1tdy5h,https://rss3.io/,AI,ETHEREUM,RSS3,rss3,rss3,RSS3 is a next-gen feed protocol for decentralized applications.,--,https://twitter.com/RSS3_,https://discord.com/invite/aGuwzF2hW4,https://bit.ly/3e6FZoV,https://rss3.io/blog,https://github.com/NaturalSelectionLabs,http://www.linkedin.com/company/rss3
Ruff,la5o39,http://ruffchain.com,NOT_DEPIN,ETHEREUM,RUFF,ruff,ruff,Ruff is a blockchain-based architecture combining IoT with a public chain and distributed operating system.,IoT,,,,,,https://www.linkedin.com/company/ruffllc/
Rumi,3x8glb,https://www.rumi.finance/,NOT_DEPIN,,RUMI,,rumi-finance,"Building the Infrastructure Layer for DeFi Asset Management Rumi Finance is a revolutionary, permissionless platform that aims to redefine the DeFi asset management landscape by offering a comprehensive, user-friendly, and secure solution for both DeFi native and institutional investors. It's base protocol Rumi is the next generation yield protocol, designed to tackle the challenges and complexities of navigating the decentralized finance ecosystem, providing investors with unparalleled access to a diverse range of sophisticated investment strategies, superior yields, and cutting-edge risk management tools across multiple chains.",DeFi,https://twitter.com/rumilabs/status/1325733403686133760,https://discord.com/invite/T7vkh84Nfg,,,,https://pt.linkedin.com/company/rumi-finance
Runloop,f9rhe0,https://runloop.xyz/,AI,,RUX,,,"Runloop builds DeFi simulation environment for training agents in liquidity provision, risk management, and trading.","Agents, DeFi",https://twitter.com/runloop?lang=en,,,,,https://www.linkedin.com/company/runloop/about/
Safe Haven,ewlwyh,https://safehaven.io/,AI,BINANCE,SHA,,safe-haven,Decentralized digital inheritance,,https://twitter.com/safeHavenio,https://discord.com/invite/ZQGrmP6dfc,https://t.me/safehavenio,http://www.linkedin.com/company/safe-haven-sha,,https://github.com/Safehaven-io
SAFE,t4fjen,https://safenetwork.org/,COMPUTE,NATIVE,SAFE,safe,,SAFE Network is a decentralized data storage and communications network that uses spare computing resources of users.,Storage,https://twitter.com/safenetworktech?lang=en,https://discord.com/invite/0ak6ESm4oAR3oXik,,https://blog.safenetwork.org/,,
Saito,i86y1x,https://saito.tech/,NOT_DEPIN,ETHEREUM,SAITO,saito,saito,"Saito: Layer-1 blockchain empowering web 3.0 apps, with distributed infrastructure.",L1/L2,https://twitter.com/SaitoOfficial,https://discord.com/invite/HjTFh9Tfec,https://t.me/SaitoIO,https://saito.tech/blog/,,http://www.linkedin.com/company/saitonetwork
Sarcophagus,se7wj7,https://sarcophagus.io/,OTHER,ETHEREUM,SARCO,,sarcophagus,Decentralized dead man's switch,,https://twitter.com/sarcophagusio,https://discord.com/invite/5XkvsEmMab,,https://medium.com/sarcophagus-community,,https://github.com/sarcophagus-org
Sayver,zk9cf4,https://sayver.net/,COMPUTE,,,,,Sayver is a blockchain-based platform that enables users to immortalize anything on the blockchain.,Storage,,,,,,
ScPrime,ui2nbm,https://scpri.me/,COMPUTE,NATIVE,SCP,scprime,siaprime-coin,ScPrime is a decentralized network of enterprise-grade cloud storage providers.,Storage,https://twitter.com/ScPrimeCloud,https://discord.com/invite/scprime,,https://medium.com/coinmonks/scprime-long-term-investment-providing-your-own-storage-c2ab374c754a,https://github.com/topics/scprime,https://www.linkedin.com/company/scp-corp
ScyNet,5kz9p0,https://scynet.ai/,COMPUTE,,,,,ScyNet is a blockchain and economic system that rewards nodes for sharing resources in a decentralized network.,--,https://twitter.com/ScynetAI,https://discord.com/invite/zTe3MTH,,https://scynet.ai/blog/,https://github.com/comrade-coop/scynet,
SecondLive,6qvjpf,https://secondlive.world/,OTHER,,LIVE,,,"SecondLive: a metaverse for avatars, virtual spaces, art exhibitions, and gaming.",--,https://twitter.com/SecondLiveReal,https://discord.com/invite/secondlive,https://t.me/SecondLiveCommunity,https://medium.com/@SecondLiveReal,https://github.com/SecondLive23,
Seed Labs,ixg6ts,,NOT_DEPIN,,,,,"Seed Labs is a collectively owned, community-first, open early stage venture capital.",,,,,,,https://www.linkedin.com/in/seed-lab-my-9246951a8/
SelfKey,b12fse,https://selfkey.org/,AI,ETHEREUM,KEY,selfkey,selfkey,SelfKey is a blockchain-based identity platform.,--,https://twitter.com/selfkey,https://discord.com/invite/Ft2U7DKg4X,https://t.me/selfkeyfoundation,https://medium.com/@SelfKey,https://github.com/SelfKeyFoundation,http://www.linkedin.com/company/selfkey
Sensecap,4mztfe,https://www.sensecapmx.com/,OTHER,,,,,"Sensecap: LoRaWAN IoT hardware for Helium hotspots, building decentralized networks.",IoT,https://www.sensecapmx.com/blogs/,https://discord.com/invite/sensecap,,https://www.sensecapmx.com/blogs/,,https://www.linkedin.com/company/seeedstudio/?viewAsMember=true
Sentinel,r77x1a,https://sentinel.co/,COMPUTE,COSMOS,DVPN,sentinel,sentinel,Sentinel is a global ecosystem of autonomous dVPN apps enabling private censorship-resistant internet access.,VPN,https://twitter.com/Sentinel_co,https://discord.com/invite/mmAA8qF,https://t.me/sentinel_co,https://medium.com/sentinel,https://github.com/sentinel-official,https://linkedin.com/company/sentinelco
Set,zftfbg,,NOT_DEPIN,,,,,Set is an onchain indexing protocol,,,,,,,
Setoros,ulo2gi,https://setoros.com/,NOT_DEPIN,,,,,Setoros is a decentralized crypto sportsbook for global betting.,--,https://twitter.com/setoros,https://discord.com/invite/ssSRkyUmsn,,https://medium.com/@baduungg/update-setoros-testnet-now-launching-on-base-network-dbc2a77f232b,https://github.com/setoros-group,
Shadow Storage,v7lzxm,https://www.shadow.storage/,COMPUTE,,,,,Shadow Storage is a decentralized and private data storage company built on Solana blockchain.,Storage,,,,,,
Shardeum,g65u6w,https://shardeum.org/,OTHER,ETHEREUM,SHM,,shardeum,Shardeum: EVM-based platform ensuring decentralization and security.,--,https://twitter.com/shardeum,https://discord.com/invite/shardeum,https://telegram.me/shardeum,https://shardeum.org/blog/,https://github.com/shardeum/,http://www.linkedin.com/company/shardeum
Shibuya,rgobsb,https://www.shibuya.xyz/,OTHER,,,,,"Shibuya is a web3 platform for film financing & production. Users engage, fund, vote, & become owners of content.",--,https://twitter.com/shibuyaxyz,https://discord.com/invite/shibuyaxyz,,https://medium.com/@shibuya.xyz,,http://www.linkedin.com/company/shibuyaxyz
Shipped,v05a0g,https://shipped.com/,OTHER,,,,,Shipped is a logistics industry plugin that enables payment for shipping by scanning the barcode on the parcel.,,https://www.twitter.com/shippedcom,,,https://shipped.com/blog/,,https://linkedin.com/company/shipped-com
Shuttle Labs,aoo9gh,https://shuttlelabs.co/,AI,,,,,Shuttle Labs: AI-powered platform that transforms blockchains into accessible sources for analytics and automation.,--,https://twitter.com/shuttlelab,,,,,https://www.linkedin.com/company/shuttleinc/
Sia,esjdj0,https://sia.tech/,COMPUTE,NATIVE,SC,siacoin,siacoin,Sia is a decentralized cloud storage network combining Proof of Work with a contract-based storage model.,Storage,https://twitter.com/sia__foundation,https://discord.com/invite/sia,,https://blog.sia.tech/,https://github.com/SiaFoundation,http://www.linkedin.com/company/the-sia-foundation
Siglo,7gjqft,https://siglo.com/,WIRELESS,,,,,Siglo is a wireless internet service provider.,--,https://twitter.com/hashtag/siglobar,,,,,http://www.linkedin.com/company/siglointernet
Silence Laboratories,j2py3v,https://www.silencelaboratories.com/,NOT_DEPIN,,,,,Silence Labs is a cybersecurity company specializing in decentralized MFA and MPC-based authentication.,--,https://twitter.com/silentauth,,,https://medium.com/silence-laboratories,,https://www.linkedin.com/company/silencelaboratories/
Silencio,5m6dp8,https://www.silencio.network/,SENSORS,,,,,Silencio rewards users for providing hyper-local noise pollution data from smartphones.,--,https://twitter.com/silencioNetwork?ref_src=twsrc%5Egoogle%7Ctwcamp%5Eserp%7Ctwgr%5Eauthor,https://discord.com/invite/uegUV8UkSJ,https://telegram.me/silencio17,http://www.silencioblog.com/2021/07/mozart-contemporaries-de-vikingur.html,https://github.com/topics/silencio,https://www.linkedin.com/company/silencio
Silent Link,q5prya,https://silent.link/,WIRELESS,,,,,"A mobile service provider that offer users a global mobile 4G/5G Internet access and burner phone numbers instantly and privately on any modern eSIM-compatible smartphone. It offers Worldwide coverage and allows users to pay with Bitcoin, Lightning or with Monero.",,https://twitter.com/silentlink1,,,,,
SingularityDAO,g7dhjc,https://www.singularitydao.ai/,AI,ETHEREUM,SDAO,singularitydao,singularitydao,SingularityDAO: Decentralized Portfolio Management Protocol for safe and easy crypto asset management.,--,https://twitter.com/SingularityDao,https://discord.com/invite/singularitydao,https://t.me/SingDAO,https://medium.com/singularitydao,,http://www.linkedin.com/company/singularitydao
SingularityNET,48m8lh,https://singularitynet.io/,AI,ETHEREUM,AGIX,,singularitynet,"SingularityNET enables easy creation, sharing, and monetization of AI services through its global marketplace.",--,https://twitter.com/singularitynet,https://discord.com/invite/snet,https://telegram.me/singularitynet,https://blog.singularitynet.io/,https://github.com/singnet,http://www.linkedin.com/company/singularitynet
Sitenna,xeu3zu,https://sitenna.com/,WIRELESS,,,,,"Sitenna streamlines the process of site acquisition, portfolio management and collocation sales for telecom companies. Their cloud based platform reduces deployment and management costs for all parties, rapidly accelerating 5G, EV Charging and Smart Cities technologies",Software,,,,,,http://www.linkedin.com/company/sitenna
Skey,v9jtu7,https://skey.network/,NOT_DEPIN,ETHEREUM,SKEY,,skey-network,"Skey is a blockchain-based company connecting decentralized finance and IoT, enabling a new economy of physical assets.","DeFi, IoT",https://twitter.com/skeynetwork,https://discord.com/invite/en7YQU4EBR,https://t.me/SkeyNetworkNews,https://skeynetwork.medium.com/,https://github.com/skey-network,http://www.linkedin.com/company/skeynetwork
Skiff Mail,cxzwvp,https://skiff.com/,NOT_DEPIN,,,,,"Skiff Mail: Open-source email app with privacy, encryption, and collaboration via Skiff Pages.",--,https://twitter.com/skiffprivacy?ref_src=twsrc%5Egoogle%7Ctwcamp%5Eserp%7Ctwgr%5Eauthor,https://discord.com/invite/skiff,,,https://github.com/skiff-org,https://www.linkedin.com/company/skiffprivacy
Sky Trades,mfvv88,https://skytradelinks.com/,OTHER,,,,,"Sky Trades is a marketplace for air rights for drone traffic that aims to enable the air space to be used with the owners permission, to gain passive income without the ownership of the property changing.",,,,,http://www.linkedin.com/company/skytrades,,
Sliceledger,eu6iys,https://sliceledger.io/,NOT_DEPIN,,,,,Sliceledger is a decentralised Ethereum scaling platform empowering developers to build secure and low-fee dapps.,L1/L2,https://mobile.twitter.com/ledgerslice,,,https://sliceledger.io/blog/,,https://www.linkedin.com/company/slice-ledger
SmartCredit,eiq46d,https://smartcredit.io/,AI,ETHEREUM,SMARTCREDIT,,smartcredit-token,"SmartCredit connects lenders and borrowers globally, offering decentralized peer-to-peer lending.",--,https://twitter.com/Smartcredit_io,,https://t.me/SmartCredit_Community,https://smartcredit.io/blog/,https://github.com/SmartCredit-io,https://www.linkedin.com/company/smartcredit-io/
SmartPoint,7su9n8,https://smartpoint.io/,SENSORS,IOTEX,,,,SmartPoint is a decentralized edge computing network.,--,https://twitter.com/SmartPointIO,,,https://github.com/topics/smartpoint-cloud-platform,,https://www.linkedin.com/company/smartpoint
SolanaStock,kdsx3u,,AI,,,,,SolanaStock: Decentralized stock photo marketplace monetizes photos with AI.,,https://solana.com/twitter,https://discord.com/invite/kBbATFA7PW,https://solana.com/telegram,https://solana.com/news,https://solana.com/github,http://www.linkedin.com/company/solanalabs
SolCycle,jypbh1,,SENSORS,,,,,"SolCycle Rewards incentivizes recycling, promoting sustainability and environmental conservation.",Environmental,https://twitter.com/soulcycle,,,,,https://linkedin.com/company/soulcycle
SolRazr,0fi9q0,https://razrfi.ai/,NOT_DEPIN,SOLANA,SOLR,solrazr,solrazr,SolRazr is a decentralized developer ecosystem for Solana.,--,https://mobile.twitter.com/CSolrazr,https://discord.com/invite/A3YP4547Fm,https://t.me/s/solrazr_app,https://medium.com/@RazrFi/solrazr-2021-in-review-5ba669ed2efc,https://github.com/solrazr-app,https://sg.linkedin.com/company/omnistart-network
Somos,ads6qy,https://www.somosinternet.co/,WIRELESS,,,,,"Somos Internet provides prepaid high-speed internet services. Using its FiverWaveTM technology, the company can offer internet service plans with up to 2GBs of speed.",,,,,,,
Sonr,admvie,https://sonr.io/home,NOT_DEPIN,,,,,Sonr is an L1 blockchain for self-custody decentralized identity.,L1/L2,https://sonr.io/twitter,https://discord.com/invite/SapB6fP6A6?utm_campaign=website&utm_medium=bitly&utm_source=website,,https://sonr.io/blog,https://sonr.io/github,http://www.linkedin.com/company/sonr-io
Souq,hprfe1,https://www.souq.finance/,NOT_DEPIN,,,,,Souq is a blockchain company developing an NFT AMM aiming to revolutionize the trading dynamics of NFTs.,,,https://discord.com/invite/clubsouq,,,,
Space & Time,heeyow,https://www.spaceandtime.io/,COMPUTE,,,,,"Space & Time is a decentralized replacement for blockchain indexing, database, data warehouse, and API servers.",--,https://twitter.com/SpaceTimeMedia/,https://discord.com/invite/spaceandtimeDB,https://t.me/spaceandtimedb,https://www.spaceandtime.io/blog,https://github.com/spaceandtimelabs,https://www.linkedin.com/company/space-and-time-media/
Spacemesh,ojaphf,https://spacemesh.io/,COMPUTE,,,,,"Decentralized, energy-efficient blockmesh with unique consensus.",--,https://twitter.com/teamspacemesh,https://discord.com/invite/yVhQ7rC,,https://spacemesh.io/blog,https://github.com/spacemeshos,http://www.linkedin.com/company/spacemesh
Spexigon,xjyor4,https://spexigeo.com/,SENSORS,,,,,Spexigon is a decentralized network of drone operators using the first fly-to-earn drone imagery platform.,Drones,https://twitter.com/spexigon?ref_src=twsrc%5Egoogle%7Ctwcamp%5Eserp%7Ctwgr%5Eauthor,,,,,https://www.linkedin.com/company/spexigon
Spheron Protocol,bpnvkv,https://spheron.network/,COMPUTE,,,,,"Spheron Protocol: decentralized platform for web app deployment with storage, hosting, and compute capabilities.",--,https://twitter.com/SpheronFDN,https://discord.com/invite/ahxuCtm,,https://blog.spheron.network/,https://github.com/spheronFdn,https://www.linkedin.com/company/spheron/
Spreads,s74bpn,https://spreadnetworks.io/,WIRELESS,,,,,Spreads: Empowering communities for digital transformation.,--,https://twitter.com/Mint_HNT,,,,,https://www.linkedin.com/company/minthnt
SQE.io,ipaf0n,https://www.sqe.io/,OTHER,,,,,"SQE.io is a quantum secure, decentralized blockchain-based platform. It uses Simulated Quantum Entanglement technology.","L1/L2, Quantum",https://twitter.com/TheSQE,,,,,http://www.linkedin.com/company/sqe-io
Srcful,k7ie81,https://srcful.io/,ENERGY,,,,,Srcful is a blockchain-enabled Virtual Power Plant maximizing the potential of Distributed Energy Resources.,VPP,,https://discord.com/invite/tux5qPDcWw,,,,https://linkedin.com/company/srcful
StackOS,kd6pyc,https://www.stackos.io/,COMPUTE,ETHEREUM,SFX,stackos,stackos,StackOS is a cross-chain open infrastructure protocol enabling decentralized cloud services.,--,https://twitter.com/DeployOnStackOS,https://discord.com/invite/W3phTcR8sS,https://t.me/DeployOnStackOS,https://medium.com/stackos,https://github.com/stackosofficial,https://linkedin.com/company/stackos
Starpower,3gatyy,http://starpower.group/,ENERGY,,,,,Starpower is an infrastructure company connecting distributed energy resources to decarbonize the energy sector.,--,https://twitter.com/StarpowerTalent,,,,,https://www.linkedin.com/company/starpowerksa/about/
StationX,osv0he,https://www.stationx.network/,NOT_DEPIN,,,,,StationX is a protocol for swiftly creating and overseeing DAOs in under a minute.,,https://twitter.com/stationxnetwork,https://discord.com/invite/FP82PsvWdS,https://t.me/StationXnetwork,,,http://www.linkedin.com/company/stationxnetwork
SteerFinance,nfdwqm,https://steer.finance/,COMPUTE,,,,,SteerFinance is a developer of decentralized compute protocols.,--,https://twitter.com/steerprotocol?lang=en,https://discord.com/invite/M3Xjvv3Zfg,,https://steer.finance/,https://github.com/steerprotocol,https://www.linkedin.com/company/steer-protocol/
Store,nb0mpn,https://storecloud.org/,COMPUTE,,,,,"STORE is a new layer zero staking protocol at the intersection of cloud computing and WEB3. Secured by Dynamic Proof-ofStake (DyPos) - a novel STORE algorithm. ",Storage,,,,,,
Storj,arwynb,https://www.storj.io/,COMPUTE,ETHEREUM,STORJ,storj,storj,Storj is a decentralized cloud storage platform using nodes to host user data in an open-source environment.,Storage,https://twitter.com/storj,https://forum.storj.io/t/unofficial-discord-for-sno-s/10943,https://telegram.me/StorjProject,https://www.storj.io/blog,https://github.com/Storj/,https://www.linkedin.com/company/storj/about/
StorX,t69457,https://storx.tech/,COMPUTE,XDC,SRX,storx-network,storx,StorX is a decentralized cloud storage network enabling permissionless selling/leasing of storage capacity.,Storage,https://twitter.com/StorXNetwork,https://discord.com/invite/GSxBfSmh8G,https://t.me/StorXNetwork,https://medium.com/storx-network,https://github.com/StorXNetwork,https://www.linkedin.com/company/storxnetwork
Stratos,4jq13p,https://www.thestratos.org/,COMPUTE,ETHEREUM,STOS,stratos,stratos,Stratos is a decentralized computing network for efficient and secure data processing.,Data,https://twitter.com/Stratos_Network,https://discord.com/invite/tpQGpC2nMh,https://t.me/Stratos_announcement,https://blog.thestratos.org/,https://github.com/stratosnet,https://www.linkedin.com/company/stratos-network
Streamr,o1pv7k,https://streamr.network/,OTHER,ETHEREUM,DATA,streamr,streamr,"Streamr is a decentralised protocol providing data pipelines, network analytics, and instant messaging.",Data,https://twitter.com/streamr,https://discord.com/invite/gZAm8P7hK8,https://t.me/streamrdata,https://blog.streamr.network/,https://github.com/streamr-dev,https://www.linkedin.com/company/streamr-network/
Suanbot,a4zdzs,t.me/Suanbot,WIRELESS,,,,,Telegram bot for permissionless communications,,,,,,,
SubQuery,kzaj07,https://www.subquery.network/,NOT_DEPIN,NATIVE,SQL,,subquery-network,SubQuery is a decentralized data aggregation and querying layer for Layer-1 blockchains and dApps.,L1/L2,https://twitter.com/SubQueryNetwork,https://discord.com/invite/78zg8aBSMG?ref=blog.subquery.network,https://t.me/subquerynetwork,https://blog.subquery.network/,https://github.com/OnFinality-io/subql,http://www.linkedin.com/company/subquery
Subsquid,cp4cw6,https://www.subsquid.io/,,,,,,Subsquid: Open-source framework to extract & present blockchain data as GraphQL APIs for Web3 builders.,--,https://twitter.com/subsquid,https://discord.com/invite/subsquid,https://t.me/subsquid,https://subsquid.medium.com/,https://github.com/subsquid,https://ch.linkedin.com/company/subsquid
sudoswap,ea506r,https://sudoswap.xyz/#/,NOT_DEPIN,ETHEREUM,SUDO,sudoswap,sudoswap,sudoSwap: A gas-efficient AMM protocol for NFT-to-token swaps with customizable bonding curves. Supports various tokens.,--,https://twitter.com/sudoswap,https://discord.com/invite/KWHFhVnfue,,https://blog.sudoswap.xyz/,https://github.com/sudoswap,
Superalgos,3sy850,https://superalgos.org/,,NATIVE,,superalgos,,"Superalgos: crypto trading platform for open competition, allows traders to earn through signal broadcasting.",--,https://twitter.com/superalgos,https://discord.com/invite/CGeKC6WQQb,,https://medium.com/superalgos,https://github.com/Superalgos/Superalgos,https://mt.linkedin.com/company/superalgos
Superchain,0k93rc,https://www.superchain.network/,NOT_DEPIN,,,,,"Developer of Open Index Protocol, an efficient decentralized indexer for on-chain data.",--,https://twitter.com/OpenSuperchain,,,https://blog.superchain.network/,https://github.com/SuperChainNetwork,http://www.linkedin.com/company/superchain-network
