name,id,url,category,chain,token,coinGeckoID,description,subcategories,ninja,foundingYear,twitter,discord,telegram,blog,github,linkedin,verified
Lake,cpzurk,https://lakenetwork.io/,COMPUTE,,LNT,,"Lake is a Decentralized storage for DApps and Blockchains that incentivizes users to provide Storage and Bandwidth. ",Storage,ZZ,,https://twitter.com/_lakenetwork,,https://t.me/lakenetwork,,,http://www.linkedin.com/company/lakenetwork,
Lambda,129gin,https://lambda.im/,COMPUTE,,,,Decentralized Storage 3.0 Evolution - LWS Modular Storage Network,Storage,W. L.,,,,,,,,
Landshare,v4pxv7,https://www.landshare.io/,NOT_DEPIN,BINANCE,LAND,landshare,"Landshare turns real-world properties into asset-backed, yield-bearing, and fully tradeable asset tokens on the Binance Smart Chain.",,ZZ,,,,,,,,
Lanify,2sr2vy,https://www.lanify.ai/,AI,ETHEREUM,LAN,lanify,"Lanify is a browser extension that allows users to monetize their internet connection by selling unused network resources in real-time. It acts as a decentralized gateway to the public web, providing access to essential data for training AI models.",,ZZ,,https://twitter.com/LanifyAI,,,,,,
Latitude,n0489d,https://www.latitude.sh/,COMPUTE,,,,"Latitude.sh is provider of a network that allows developers to deploy and manage GPU and CPU servers globally and easily. ",,,,https://twitter.com/latitudesh,,,https://www.latitude.sh/blog,https://github.com/latitudesh,https://www.linkedin.com/company/22318494/,
Lava,jq8mvz,https://www.lavanet.xyz/,BLOCKCHAIN_INFRA,,,,Lava is a modular data access (RPC & indexing) layer for rollups and blockchains.,RPC/Indexing,ZZ,,,,,,,,
Lavita.AI,tylsdp,https://www.lavita.ai/,AI,NATIVE,LAVITA,lavita,"LAVITA is a blockchain and AI based next generation healthcare platform, that enables the use of massive biomedical datasets for research while preserving individual privacy and ownership of data.",Health & Fitness,ZZ,,https://twitter.com/LavitaAI,1041587307419017246,https://t.me/Lavita_AI,https://lavita-ai.medium.com/,,http://www.linkedin.com/company/lavita-ai,
Layer N,nvisfm,https://www.layern.com/,NOT_DEPIN,,,,"Layer N is an Ethereum StateNet—A novel L2 designed as a network of custom VMs, called XVMs, powered by a shared communication and liquidity layer.",,,,,1038972328828219462,,,,,
LayerAI,y3zupj,https://layerai.org/,AI,ETHEREUM,LAI,cryptogpt-token,"LayerAI is a blockchain for AI dev, providing layer-2 solution for efficient and secure applications.",,,,https://twitter.com/LayerAIorg,1158724762726584361,https://t.me/LayerAI_org,https://layeraiorg.medium.com/layerai-the-technology-ecosystem-for-the-data-first-age-8ffe4f25e236,,http://www.linkedin.com/company/layeraiorg,
LayerNet,mhypx1,https://layernet.ai/,AI,,,,LayerNet builds a decentralized AI ecosystem to empower native blockchain infrastructure and applications.,,ZZ,,https://twitter.com/layernet_ai,,,,,,
LayerZero,cpd9pq,https://www.layerzero.io/,BLOCKCHAIN_INFRA,,,,LayerZero builds DeWi infrastructure in LA.,Mining,,,,,,,,,
LBRY,jn69a0,https://lbry.com/,COMPUTE,NATIVE,LBRY,lbry-credits,"LBRY protocol is a decentralized network for content sharing and publishing. It enables users to access, publish, and share digital content without intermediaries, ensuring creators and consumers maintain control over their content and data.",,ZZ,,,,,,,,
LBS,elto7m,https://lbschain.org/,NOT_DEPIN,NATIVE,LBS,,"LBS Chain is the world's first location-based Layer 3 blockchain. It allows developers to craft Web3 local service Dapps with ease and affordability while enabling users to contribute and profit from LBS data. ",,,,https://twitter.com/lbschain,,,,,,
Leap,3w2wtc,https://www.leap.energy/,ENERGY,,,,Leap is the leading global platform for generating new value from grid-connected resources and devices through integration with energy markets.,,,,https://twitter.com/leapdex,,,https://www.leap.energy/blog,,https://www.linkedin.com/company/18116834/,
LENA,2qzmdn,https://www.lena.network/,NOT_DEPIN,,,,"LENA: Web3 liquidity provider for NFT lending and borrowing. ETH pools, user autonomy.",,,,https://twitter.com/LENA_Network,1003197622665879562,,https://medium.com/@LENA_Network,,http://www.linkedin.com/company/lena-network,
Lendwill,xofl5l,https://lendwill.com/,NOT_DEPIN,,,,"Lendwill is a sharing economy app where people invest money in each other, all while building a verifiable credit history on the blockchain.",DeFi,ZZ,,https://twitter.com/lendwill,,,,,https://www.linkedin.com/company/lendwill/,
Lever,2xb653,https://www.lever.io/,SERVICES,,,,"Lever is a Web3 influencer marketplace that offers an easy-to-use, all-in-one platform that makes booking influencers safe, quick, and easy for brands and creators alike.",,EV3 Sal,,,,,,,,
Libertai,c1lms4,https://libertai.io/,AI,,,,"Libertai is a decentralized artificial intelligence assistant that operates without a centralized server, allowing for increased privacy and security and employs machine learning algorithms for improved language processing capabilities.",,ZZ,,https://twitter.com/Libertai_DAI,,,,,,
Liberte,c6hicp,,COMPUTE,,,,Liberte is a DePIN compute framework for on-chain games.,Gaming,,,,,,,,,
libp2p,hsbb4a,https://libp2p.io/,BLOCKCHAIN_INFRA,,,,"Libp2p is an open-source network stack that lets you build modern, fully distributed applications.",,,,https://twitter.com/libp2p,,,https://blog.libp2p.io/,https://github.com/libp2p,https://www.linkedin.com/company/protocollabs/,
LIFE Network,8aa0dm,https://www.lifenetwork.ai/,BLOCKCHAIN_INFRA,,,,"LIFE Network is a privacy-first, AI-powered blockchain for the mass adoption of DeSci. It allows users to earn rewards by taking control of their genetic data while empowering researchers and companies with effortless data access.",DeSci,EV3 Sal,,https://twitter.com/LifeNetwork_AI,,,,,,
Lighthouse,24l8zf,https://www.lighthouse.storage/,COMPUTE,,,,Lighthouse is a permanent file storage protocol allowing one-time payment for storing files forever.,,,,https://twitter.com/lhediscovery,920900030771109908,https://t.me/LighthouseStorage,,https://github.com/GoogleChrome/lighthouse,https://www.linkedin.com/company/lighthouse-global/,
lilAI,4orxub,https://lilai.co/,AI,ARBITRUM,LILAI,lilai,"lilAI is an AI powered, smart automated community management solution built on Arbitrum.",,,,,,,,,,
Lilypad,2hvgy5,https://lilypad.tech/,COMPUTE,,,,"Lilypad develops a trustless, distributed compute network that enables internet-scale data processing, AI, ML & other arbitrary computation from blockchains while unleashing idle processing power & unlocking a new marketplace for computing.",,EV3 Sal,,,,,,,,
LimeWire,ubt5kj,https://limewire.com/,AI,ETHEREUM,LMWR,limewire,"LimeWire is an AI-powered content publishing platform that allows users to create, publish, and monetize images, videos, and music with the power of AI. ",,ZZ,,,,,,,,
Linea,xg7vy5,https://linea.build/,NOT_DEPIN,,,,Linea is an EVM-equivalent zk-rollup for scaling Ethereum dapps.,ZK,ZZ,,,,,,,,
Linera,avq9ep,https://linera.io/,NOT_DEPIN,,,,Linera is a Blockchain Infrastructure for Highly Scalable Web3 Applications that give users their own blockspace with microchains.,,,,https://twitter.com/linera_io,984941796272521226,https://t.me/linera_official,https://medium.com/@linera,,https://www.linkedin.com/company/linera-io/,
Lit,cv1odr,https://www.litprotocol.com/,COMPUTE,,,,"Lit Protocol is an autonomous cloud network for decentralized signing, encryption, and compute.",,ZZ,,https://twitter.com/LitProtocol,,,,,,
Lithium,iggqt8,https://lith.finance/,AI,ETHEREUM,LITH,lithium-finance,"Lithium Finance is the first decentralized protocol to harness the power of AI and crowd wisdom. Fundamentally, Lithium Finance uses machine learning algorithms to evaluate historical market data and to identify potential data issues.",,ZZ,,,,,,,,
LiveMind,yeobvh,https://livemind.ai/,AI,,,,"LiveMind.ai is an AI-powered platform designed to help businesses, creatives, and agencies transform their operations with innovative AI technology.",,,,,,,,,,
Livepeer,0dpzm4,https://livepeer.org/,COMPUTE,ETHEREUM,LPT,livepeer,Livepeer is a decentralized network for video encoders and streamers.,,,,https://twitter.com/livepeerorg,423160867534929930,,https://medium.com/livepeer-blog,,http://www.linkedin.com/company/livepeer,
LM Studio,vh0qps,https://lmstudio.ai/,AI,,,,LM Studio allows users to run local/open LLMs on their computers.,,,,https://twitter.com/LMStudioAI,1110598183144399058,,,https://github.com/lmstudio-ai,,
LocalPro,0pgbgt,https://www.getlocalpro.xyz/,BLOCKCHAIN_INFRA,,,,"LocalPro: gamifies experiences, promotes trust, quests, badges, rewards, enhances skills, incentivizes collaboration.",Rewards,,,https://twitter.com/localpro_,,,,,https://www.linkedin.com/company/localpro-x,
Lofty,a0pcew,https://www.lofty.ai/,NOT_DEPIN,,,,Lofty is a fractional real estate marketplace that consists of buyers (token investors) and sellers (people who want to sell their properties).,,,,,,,,,,
Log Store,bs5j3i,https://www.usher.so/technology/,BLOCKCHAIN_INFRA,ETHEREUM,LSAN,,"The Log Store Network is a decentralized, time-series database specializing in high-frequency, time-indexed cryptographic attestations, facilitating real-time data collection through a peer-to-peer data transport layer.",,ZZ,,https://twitter.com/usher_web3,,,,,,
Logion,p1vtxx,https://www.logion.network/,NOT_DEPIN,,LGNT,,Logion is a pioneering blockchain platform that transforms tokens into legal-grade digital assets.,,,,,786689460178911273,,,,,
Logos,dojvzb,https://logos.co/,BLOCKCHAIN_INFRA,,,,"Logos provides trust-minimized, corruption-resistant governing services and institutions for citizens.",Legal,ZZ,,https://twitter.com/Logos_state,,,,https://github.com/logos-co,https://linkedin.com/company/logos-internet-marketing-experts,
Loke,6b4f0x,https://getloke.com/,NOT_DEPIN,,LOKE,,Loke is a gamified social layer for action sports.,,EV3 Sal,,https://twitter.com/getloke,,,,,,
LongFi,nbam9o,https://www.longfisolutions.com/,WIRELESS,,,,LongFi Solutions: Decentralized Infrastructure for community connectivity,Mining,,,https://twitter.com/LongFiSolutions,,,,https://github.com/topics/longfi,https://www.linkedin.com/company/longfisolutions/,
Loom,el7s07,https://loomx.io/,NOT_DEPIN,ETHEREUM,LOOM,loom-network-new,"Loom Network is a production-ready, multichain interop platform for serious dapp developers.",,,,https://twitter.com/loomnetwork,,https://t.me/loomnetwork,https://medium.com/loom-network,https://github.com/loomnetwork,https://www.linkedin.com/company/loom-network/,
Loop,t38une,https://www.theloopnetwork.org/,NOT_DEPIN,BINANCE,LOOP,loopnetwork,Loop is a Layer-1 crypto ecosystem to address scalability in smart contracts.,L1/L2,,,https://twitter.com/loopnetwork3,,https://t.me/loopnetwork,,,,
Lox Network,noieih,https://loxnetwork.co.uk/,WIRELESS,,LOX,lox-network,Lox Network provides the world’s first global IMEI blacklist database for smartphone crime using blockchain. Their project is designed to target and dismantle the phone theft industry through a decentralized blacklist.,,ZZ,,https://twitter.com/LoxNetwork,,,,,,
Loxodrome,vvesfw,https://loxodrome.xyz/,NOT_DEPIN,,,,"Loxodrome is a pioneering DePIN-Focused Dex on the IoTeX, establishing itself as the first native liquidity marketplace focused on DePIN.",,ZZ,,,,,,,,
LTO Network,tny0s0,https://www.ltonetwork.com/,NOT_DEPIN,ETHEREUM,LTO,lto-network,"LTO Network is a Layer 1 blockchain with a Public and Private layer to bridge the gap between real-world and digital ownership, decentralized identities, and privacy.",,ZZ,,,,,,,,
LUKSO,saeow6,https://lukso.network/,NOT_DEPIN,ETHEREUM,LYX,lukso-token,"LUKSO is a next generation EVM blockchain based on Casper PoS and will be the foundation for the New Creative Economy. ",,,,,359064931246538762,,,,,
Lumerin,f0vw9s,https://lumerin.io/,NOT_DEPIN,ETHEREUM,LMR,lumerin,"Lumerin is the World's first P2P low-cost, decentralized marketplace for trading Bitcoin hashpower.",,,,,875744643378200577,,,,,
Lumino,3ttk4l,https://www.luminolabs.ai/,COMPUTE,,,,Decentralized GPU network built on Filecoin,,EV3 Sal,,,,,,,,
Lumishare,6s00n5,https://lumishare.io/,ENERGY,BINANCE,LUMI,lumishare,"LumiShare, powered by $LUMI, is a financial blockchain ecosystem focused on tokenizing renewable energy assets through its NFT Marketplace.",,ZZ,,,,,,,,
Lumoz,x60254,https://lumoz.org/,BLOCKCHAIN_INFRA,,,,Lumoz is a Modular Compute Layer and ZK-RaaS platform that utilizes a PoW mining mechanism to provide ZKP arithmetic for ZK-Rollup.,,ZZ,,https://twitter.com/LumozOrg,,,,,,
Lunyr,74rmzw,https://lunyr.com/,AI,ETHEREUM,LUN,lunyr,Lunyr is a blockchain-based world knowledge base that rewards users for peer-reviewing and contributing information.,,,,https://twitter.com/LunyrInc,365609106863816704,https://t.me/lunyrcommunity,https://medium.com/lunyr,,https://www.linkedin.com/company/lunyr/about/,
Lynq,jq8ero,https://lynqnetworks.com/,WIRELESS,,,,"Lynq enables innovators to design high-value products with infrastructure-free, long-range, and secure network connectivity through their software that can be integrated into any device, starting with drones, two-way radios, and mobile phones.",,,,https://twitter.com/lynqnetworks,,,,,https://www.linkedin.com/company/lynqnetworks/,
Lyzis Labs,hffbvt,https://www.lyzis.tech/,NOT_DEPIN,,,,Lyzis Labs is an incentive-driven and democratic protocol built upon a decentralized online marketplace based on blockchain technology.,,,,https://twitter.com/lyzislabs,984133538427338772,https://t.me/lyzislabsoff,https://medium.com/@lyzislabsofficial,,https://www.linkedin.com/company/lyzis-labs/about/,
M^ZERO,oane9t,https://www.m0.xyz/,NOT_DEPIN,,,,M^ZERO Labs aims to develop a decentralized network enabling institutional participants to reliably link assets to a decentralized infrastructure.,,,,,,,,,https://www.linkedin.com/company/m-zero-labs/?originalSubdomain=de,
M3tering,ae6gb1,https://m3tering.whynotswitch.com/,ENERGY,GNOSIS,,,M3tering incentivizes solar energy investment for underserved regions.,,ZZ,,https://twitter.com/whyNotSwitch,1128564139472736296,,,https://github.com/M3tering,http://www.linkedin.com/company/whynotswitch,
Macha,4i6mkb,https://macha.ai/,BLOCKCHAIN_INFRA,,,,Macha is a private and secured AI-powered search infrastructure for interoperable web powered by Data SDK.,,EV3 Sal,,https://twitter.com/macha0x,,,,,,
Magicblock,i15p9n,https://www.magicblock.gg/,BLOCKCHAIN_INFRA,,,,Magicblock is an open-source stack that enables anyone to build and play on-chain games on Solana & SVM,,,,,943797222162726962,,,,,
Magie,hoxww0,,NOT_DEPIN,,,,Magie aims to be a customer-aligned financial platform that starts with a WhatsApp-based payment assistant for power users and evolves into a network leveraging Open Finance and tokenization to offer competitive financial products and shared ownership.,DeFi,EV3 Sal,,https://twitter.com/dgntec,,,,,,
MagnetAI,1yb2sw,,AI,,,,"Magnet AI is a scalable, permissionless and cost-efficient platform for accessing compute power for inference.",GPUs,,,,,,,,,
MaidSafeCoin,ubmhxr,https://maidsafe.net/,COMPUTE,ETHEREUM,EMAID,maidsafecoin,MaidSafeCoin is a decentralized data network built on autonomous principles for secure and efficient data-sharing.,,,,https://twitter.com/maidsafe,106097460425846784,https://t.me/safenetwork,https://medium.com/safenetwork,https://github.com/maidsafe/maidsafe.net,https://www.linkedin.com/company/maidsafe/about/,
Mande,f3629t,https://www.mande.network/,BLOCKCHAIN_INFRA,,,,Mande is a decentralized reputation & credibility network.,,,,https://twitter.com/MandeNetwork,953348696098103366,,https://www.linkedin.com/company/mande-chain/,,,
Mangata,k4jlda,https://www.mangata.finance/,NOT_DEPIN,,,,"Mangata is a multi-rollup interchain infrastructure that allows users to trade any token, from any chain. Their goal is to build the world's first true interchain trading app using multi-chain ZK rollup technology.",,,,,776977650907480074,,,,,
Manta,m3djiu,https://manta.network/,NOT_DEPIN,POLKADOT,MANTA,,Manta utilises zero-knowledge proofs (ZKPs) to guarantee the secure and private minting of NFTs and SBTs while maintaining the confidentiality of crypto assets.,,,,https://twitter.com/mantanetwork,795390654628102165,https://www.t.me/mantanetworkofficial,https://mantanetwork.medium.com/,https://github.com/manta-network,https://www.linkedin.com/company/mantanetwork,
MANTRA,jnhaaq,https://www.mantraomniverse.com/,NOT_DEPIN,ETHEREUM,OM,mantra-dao,"MANTRA is a first of its kind, vertically-integrated and regulatory compliant blockchain ecosystem. ",DeFi,,,https://twitter.com/MANTRAOMniverse,821988232538357761,https://t.me/MANTRA_omniverse,https://mantraomniverse.medium.com/,,https://www.linkedin.com/company/mantraomniverse/,
Maple,622qp6,https://www.maple.finance/,BLOCKCHAIN_INFRA,ETHEREUM,MPL,maple,Maple Finance is an institutional capital marketplace powered by blockchain technology focused exclusively on serving Institutional and Individual Accredited Investors with high-quality lending opportunities.,,ZZ,,,,,,,,
Mapmetrics,lp6ty8,https://mapmetrics.org/,SENSORS,SOLANA,MMAPS,mapmetrics,Mapmetrics is a web3 navigation app that rewards users with tokens and NFTs.,Auto,ZZ,,https://twitter.com/MapMetrics?ref_src=twsrc%5Egoogle%7Ctwcamp%5Eserp%7Ctwgr%5Eauthor,,,,https://github.com/MobileRoboticsSkoltech/map-metrics,https://nl.linkedin.com/company/mapmetrics,
MAPS,dp6jkl,https://maps.me/,NOT_DEPIN,SOLANA,"MAPS ",maps,Maps.me 2.0 aims to be the ultimate travel companion app that provides both online and offline maps while offering DeFi functionalities.,,ZZ,,,,,,,,
Marina,b6dsog,https://marina-protocol.com/,BLOCKCHAIN_INFRA,BINANCE,SURF,,"Marina Protocol is an app-based Global Web 3 tutorial platform, providing users new to blockchain and Web 3 with easy-to-use content and advanced interfaces for activities like mining, staking, launchpads, and transfers.",,ZZ,,https://twitter.com/MARINA_PROTOCOL,,,,,,
Marlin,7ipv0f,https://www.marlin.org/,COMPUTE,ETHEREUM,POND,marlin,Marlin is an open-source project aimed at scaling peer-to-peer platforms by optimizing the communication between nodes(incentivized libp2p).,,ZZ,,,,,,,,
Maro,q8qiuw,https://ma.ro/,NOT_DEPIN,ETHEREUM,MARO,maro,Developer of a token-incentivized social networking protocol designed to create blockchain-decentralized applications and promotions.,,,,,,,,,,
Masa,dahm7v,https://www.masa.finance/,COMPUTE,AVALANCHE,MASA,,"Masa is building a Decentralized Google, an open, secure, and incentivized economy for the world’s personal data.",ZK,,,https://twitter.com/getmasafi,https://discord.gg/masafinance,https://t.me/masafinance,https://medium.com/masa-finance,https://github.com/masa-finance/,https://www.linkedin.com/company/masa-network/,
Mask,ub9kgi,https://mask.io/,NOT_DEPIN,ETHEREUM,MASK,mask-network,"Mask Network is a protocol that allows users to seamlessly send encrypted messages, cryptocurrencies, and DApps (Defi, NFTs, DAO) over the top of social networks without migrating, thereby creating a decentralized Applet(DApplet) ecosystem.",,EV3 Sal,,https://twitter.com/realMaskNetwork,,,,,,
MASQ,0ezngt,https://masq.ai/,WIRELESS,ETHEREUM,MASQ,masq,"MASQ is a decentralized VPN network built on Polygon, providing secure and private internet browsing.",VPN,ZZ,,https://twitter.com/MASQ_ai,800920941861404733,https://t.me/MASQ_ai,https://medium.com/masq-project,https://github.com/MASQ-Project,https://linkedin.com/company/masqproject,
Massa,10vi0m,https://massa.net/,NOT_DEPIN,NATIVE,MASSA,massa,Massa is a new blockchain based on a multithreaded technology that supports more than 10'000 transactions per second in a fully decentralized network with thousands of nodes.,,,,https://twitter.com/massalabs,828270821042159636,https://t.me/massanetwork,https://massalabs.medium.com/,https://github.com/massalabs/massa,https://www.linkedin.com/company/massa-labs/,
Massive,s4glrh,https://www.joinmassive.com/,COMPUTE,,,,Massive is an SDK enabling developers to offer premium content to users by leveraging their unused processing power.,,,,,,,,https://github.com/topics/massive,https://www.linkedin.com/company/massive/about/,
MatchX,sr6yh3,https://matchx.io/,WIRELESS,,,,MatchX is a hardware and software company specializing in IoT solutions for the industry.,"IoT, Hardware, Software",,,https://twitter.com/matchx_iot,525329441371717675,,,,https://www.linkedin.com/company/matchx/,
Matrix AI,iev3ik,https://www.matrix.io/,AI,NATIVE,MAN,matrix-ai-network,Matrix combines neuroscience with AI and blockchain to create digital user avatars in the Metaverse.,,,,https://twitter.com/MatrixAINetwork,984618085023612999,https://t.me/matrixainetwork,https://matrixainetwork.medium.com/,https://github.com/MatrixAINetwork,http://www.linkedin.com/company/matrixainetwork,
Mawari,ygaj99,https://www.mawari.io/,COMPUTE,,,,Mawari: Decentralized 3D content delivery platform for mobile XR devices.,CDN,,,https://twitter.com/mawarijp,,,,,https://www.linkedin.com/company/mawari/,
MedeLeite,jtrmoh,https://www.medeleite.com/,BLOCKCHAIN_INFRA,,,,Full-stack supply chain platform for mlik production,Software,,,,,,,,,
Media,iqnvgc,https://www.media.network/,COMPUTE,ETHEREUM,MEDIA,media-network,Media Network is a decentralized hub for web services.,,,,https://twitter.com/Media_FDN,832942573642973194,https://t.me/Media_FDN,https://mediafoundation.medium.com/,https://github.com/mediafoundation,https://www.linkedin.com/company/media-network-inc./about/,
MedicalVeda,riq8lw,https://medicalveda.com/,NOT_DEPIN,ETHEREUM,MVEDA,medicalveda,"Medical Veda aims to be the world’s leading open-source health ecosystem for enabling decentralized ownership of patient data while enabling all industry players to get access to this data in a seamless, secure, and instant manner.",,ZZ,,,,,,,,
meet48,mvulhh,https://www.meet48.xyz/,NOT_DEPIN,,,,"MEET48 is an immersive intelligent social Metaverse that integrates AI large models & WEB3, featuring idol entertainment content, AI-driven content & Web3 game.",,EV3 Sal,,https://twitter.com/meet_48,,,,,,
Mem Tech,5fzcjp,https://www.mem.tech/,COMPUTE,,,,The web3-ready serverless functions platform. Build and deploy trustless dApps in record time,,EV3 Sal,,,999990037779333130,,,,,
MemoLabs,8ul10b,https://www.memolabs.org/,COMPUTE,,,,"Provide decentralized underlying data storage technology for Metaverse&NFT to open up data value transfer channels, and help human civilization survive forever. ",Storage,W. L.,,https://twitter.com/MemoLabsOrg,849100463441444894,,https://memolabs.medium.com/,https://github.com/memoio,,
MeMusic,lwwf21,https://www.memusic.io/,NOT_DEPIN,NATIVE,MMT,memusic,"MeMusic is a blockchain end-to-end platform designed to create, listen, and share music.",,ZZ,,https://twitter.com/MeMusicNews,,,,,,
Mentaport,y363g8,https://www.mentaport.xyz/,NOT_DEPIN,,,,"Mentaport provides a content-authenticating platform that protects the work of musicians, artists, and creators with its advanced fingerprinting technology to ensure authenticity and track ownership.",,EV3 Sal,,https://twitter.com/mentaportinc,,,,,,
Menthol,b9egeq,https://www.mentholprotocol.com/,ENERGY,,COOL,,Menthol Protocol is a multi-chain decentralized sustainability protocol that will automatically offset carbon emissions user or dApp transactions with verified renewable energy and carbon credits.,Environmental,,,https://twitter.com/MentholProtocol,852523511414784027,https://t.me/mentholprotocol,https://medium.com/mentholprotocol,https://github.com/mentholprotocolfoundation,https://www.linkedin.com/company/menthol-protocol/,
Meshmerize,s8j4j9,https://meshmerize.net/,WIRELESS,,,,"Meshmerize is an industry-grade mesh network software that enhances off-the-shelf WiFi hardware to deploy an ultra-reliable mesh network, ensuring highly reliable, resilient, and low-latency connectivity specifically designed for moving machines.",,,,https://twitter.com/meshmerizenet,,,https://meshmerize.net/blog/,,https://www.linkedin.com/company/meshmerize/,
Meshtastic,8b6kci,https://meshtastic.org/,WIRELESS,,,,"Meshtastic is an open source, off-grid, decentralized, mesh network built to run on affordable, low-power devices.",,,,https://twitter.com/TheMeshtastic,867578229534359593,,,https://github.com/meshtastic,,
Meson,wop23m,https://www.meson.network/,COMPUTE,ETHEREUM,MSN,meson-network,Meson is building a decentralized CDN and Bandwidth Exchange.,CDN,,,,784251111678148608,,,,,
Metablox,k5fxwj,https://metablox.io/,WIRELESS,,,,"Metablox is a provider of enterprise-grade WiFi roaming solutions, delivering worldwide public access.",,,,https://twitter.com/metablox,916937100744597548,,https://metabloxnetwork.medium.com/metablox-x-cryptolab-ama-recap-highlights-ba556d3ce506,https://github.com/MetaBloxIO,https://www.linkedin.com/company/metablox/,
MetaEngine,l7klou,https://www.metaengine.gg/,NOT_DEPIN,,,,MetaEngine is a decentralized all-in-one platform for the development and publishing of GameFi / Metaverse games and apps.,Gaming,,,https://twitter.com/meta_engine,915343753726799902,https://t.me/metaEngine_Community,https://metaengine.medium.com/,,https://www.linkedin.com/company/metaengine/,
Metafi,cu6hqb,https://www.metafi.org/,NOT_DEPIN,,,,MetaFi is a crowdfunding ecosystem that allows users to acquire tokens of upcoming technology innovators.,DeFi,ZZ,,https://twitter.com/MetaFi_Official,,,https://medium.com/easify-network/a-brief-about-metafi-cf3f1736e930,https://github.com/metafiofficial,https://uk.linkedin.com/company/meta-fi,
MetaFlyers,k9uwcc,https://www.metaflyers.xyz,NOT_DEPIN,,,,"MetaFlyers: a decentralized rewards marketplace connecting consumers, brands, and NFT communities.",Rewards,,,https://twitter.com/metaflyers,,,https://medium.com/@metaflyers,,https://www.linkedin.com/company/metaflyers?trk=similar-pages,
MetafourAI,wko5kg,,AI,,,,MetafourAI is developing telepathy-enabled apps using EEG signals and language models.,,,,,,,,,,
