name,id,url,category,chain,token,coinGeckoID,description,subcategories,ninja,foundingYear,twitter,discord,telegram,blog,github,linkedin,verified
"Weather Union ",00xbqx,https://www.weatherunion.com/,SENSORS,,,,"Weather Union by Zomato is a crowd-supported weather infrastructure providing real-time weather data through a network of on-ground weather stations, aimed at boosting productivity and aiding research institutes and enterprises.",Environmental,EV3 Sal,,,,,,,,
0G Labs,3klhti,https://0g.ai/,BLOCKCHAIN_INFRA,,,,0G is an infinitely scalable data availability (DA) layer and modular AI blockchain.,,ZZ,,https://twitter.com/0G_labs,,,,,,
0Knowledge,sq9otq,https://0101010011.xyz/,WIRELESS,ETHEREUM,0KN,0-knowledge-network,0KN is a next generation decentralized and incentivized metadata-private mixnet-based anonymous broadcast network with cryptographic security guarantees.,ZK,,,https://twitter.com/0Knowledge_net,,https://t.me/Entry_Portal_0KN,https://medium.com/@0knowledgee,https://github.com/31333337,,
0x0.ai,vqpvwd,https://0x0.ai/,AI,ETHEREUM,0X0,0x0-ai-ai-smart-contract,0x0.ai is an AI for secure smart contract development.,,,,https://twitter.com/0x0audits,1105051738806951976,https://t.me/Portal0x0,https://medium.com/@privacy0x0,https://github.com/0x0exchange,https://www.linkedin.com/company/0x0/,
0xParc,zf9ws4,https://0xparc.org/,NOT_DEPIN,,,,0xPARC supports the next generation of cryptography-enabled applications.,,,,,,,,,,
0xScope,0hgye7,https://www.0xscope.com/,AI,,,,"0xScope is a Web3 AI Data Layer with an established and complete set of standards for collecting, cleaning, and managing relevant on- and off-chain data specifically adapted for Web3 AI training.",,,,https://twitter.com/ScopeProtocol,,,,,,
0xVPN,4p96w0,https://0xvpn.org/,WIRELESS,ETHEREUM,VPN,,0xVPN is a Decentralized P2P VPN Network that allows users to browse the web securely and privately without any restrictions using a distributed P2P network.,VPN,ZZ,,https://twitter.com/0xVPN_org,,,,,,
1000Houses,2ly60i,https://www.1kh.org/,NOT_DEPIN,,,,"1000Houses is a tokenizing platform for real estate rent, connecting investors and tenants in a streamlined marketplace.",RWA,,,https://twitter.com/#!/Mitch_Stephen,,,https://1000houses.com/blog/,,https://www.linkedin.com/in/mitch-stephen-5a83156/,
2appy,s3mmvo,https://www.2appy.it/,NOT_DEPIN,,,,Digitize your communications in just a few clicks. The VoIP switchboard that saves you money in call management.,,,,,,,,,,
2DAI,cv1vse,https://dapp.2dai.io/,AI,ETHEREUM,2DAI,2dai-io,2DAI is an innovative AIaaS platform that combines multiple neural engines and leverages cutting-edge cloud technology to empower creative professionals to generate unique visuals and develop AI-powered solutions.,,ZZ,,,,,,,,
30sec,e1rwdv,https://30sec.net/#/,SENSORS,BINANCE,YET,,"30sec is a watch-to-earn app that incentivizes users to actively watch ads, enabling companies to spread brand advertisements efficiently and cost-effectively.",Advertising,ZZ,,https://twitter.com/30sec_yet,,,,,,
369 AI,lkgvvp,https://three69ai.com/,AI,ETHEREUM,369,,369 AI is a high-performance blockchain for AI applications.,,,,https://twitter.com/Three69AI,,https://t.me/Three69AI,,,,
3DOS,5dho62,https://3dos.io/,BLOCKCHAIN_INFRA,,,,3DOS is building a decentralized manufacturing network on Web 3.0 using NFTs as a licensing tool.,Manufacturing,,,https://twitter.com/3DOSNetwork,1065763640105521232,,,,https://www.linkedin.com/company/3dosio/,
3Dpass,b7kmt6,https://3dpass.org/,BLOCKCHAIN_INFRA,NATIVE,P3D,3dpass,"3DPass is a Layer 1 blockchain platform for the tokenization of objects, Proof of Scan protocol based on recognition, useful smart contracts, and dApps.","L1/L2, RWA",EV3 Sal,,https://twitter.com/3Dpass_official,,,,,,
3NUM,f5qe2h,https://www.3num.co/,WIRELESS,,,,3Num connects mobile subscribers for secure communication.,,,,https://twitter.com/3numdao,953486199799025704,,https://medium.com/@3NUMDAO,https://github.com/3numdao,https://www.linkedin.com/company/3numdao/,
3TV,jcp53v,https://3tv.chat/,NOT_DEPIN,,,,3TV.chat is a live-streaming app for creators and communities.,,,,https://twitter.com/3tv_chat,,,,,,
4everland,0tmpgv,https://www.4everland.org/,COMPUTE,,,,"4everland is a decentralized cloud provider integrating storage, computing, and networking resources.",Storage,ZZ,,https://twitter.com/4everland_org,852482727164117022,,,,https://au.linkedin.com/company/4everlandorg,
6079,v4u52z,https://6079.ai/,AI,,,,6079.ai is an open and distributed protocol for AI inference.,,ZZ,,https://twitter.com/6079ai,,,,,,
AANN.ai,ut3zdh,https://aann.ai/,NOT_DEPIN,,AN,,"AANN.ai Lab is the creator of a next-generation AI-powered social Authenticity Network ""AN"" which is designed to help users elevate, grow, and monetize their online social authenticity.",,ZZ,,https://twitter.com/aann_ai,,,,,,
Abacus.AI,ydunf2,https://abacus.ai/,AI,,,,Abacus.AI is an AI-assisted data science platform to build ML systems and AI agents at scale.,Agents,ZZ,,https://twitter.com/abacusai,,,,,,
Access,i4tcnw,https://www.accessprotocol.co/,NOT_DEPIN,SOLANA,ACS,access-protocol,ACCESS Protocol lays the foundation for digital content monetization using a web3 wallet.,,,,,1001837380044587118,,,,,
Acorn,a0dbki,https://acorn.eco/#/,BLOCKCHAIN_INFRA,NATIVE,ACN,acorn-protocol,Acorn Protocol is a data ecosystem that rewards users for contributing and monetizing data value in a vibrant way.,,,,https://twitter.com/AcornProtocol,,,,https://mobile.twitter.com/AcornProtocol/status/1706843598581358812,https://www.linkedin.com/company/acorn,
Acurast,o2w9zn,https://acurast.com/,COMPUTE,NATIVE,ACU,acurast,"Acurast is a decentralized and serverless cloud platform with a trustless, verifiable, and confidential computing environment leveraging mobile hardware to disrupt traditional server infrastructure.",,ZZ,,http://x.com/Acurast,,https://t.me/acurastnetwork,https://acurast.medium.com/,https://github.com/Acurast,,
Acxyn,ktxx7q,https://www.acxyn.xyz/,BLOCKCHAIN_INFRA,,,,Acxyn is a web3 company that aims to revolutionize the gaming industry as the world's first IP tokenization platform.,Gaming,,,https://twitter.com/Acxynteam,,,,,http://www.linkedin.com/company/acxyn,
Adapt,ct8tqp,https://www.adaptframework.solutions/,COMPUTE,,,,"Adapt is a developer framework for full-stack decentralized software development, focusing on peer-to-peer data sharing and decentralization of non-blockchain components of web3 dApps.",,,,,979396568597799012,,,,,
Addresso,a0a6d7,https://www.addresso.com/,NOT_DEPIN,,,,"Addresso is the address book app for the next era of the web, helping users store and organize wallet and smart contract addresses simply, intuitively, and privately.",,EV3 Sal,,,,,,,,
AdHash,p6m3rb,https://adhash.com/,BLOCKCHAIN_INFRA,,,,"AdHash is a self-hosted advertising platform that allows publishers and advertisers to serve ads, manage campaigns, and collect performance data on-premise.",Advertising,,,,,https://t.me/adhashprotocol,,https://github.com/AdHashProtocol,https://www.linkedin.com/company/adhashprotocol/,
Adot,iuet6b,https://www.a.xyz/,NOT_DEPIN,,,,"Adot is a decentralized Web3 search engine that redefines how data is collected, organized, and delivered. It sorts, aggregates, and indexes data from both on-chain and off-chain sources, allowing users to create personalized search functionalities.",,ZZ,,https://twitter.com/Adot_web3,,,,,,
Advantis,qvo0gi,https://www.advantistoken.com/,AI,ETHEREUM,ADVT,advantis,"Advantis AI empowers crypto enthusiasts with innovative solutions like AI Outlook, Scanner, and University.",,,,https://twitter.com/AdvantisToken,909875543128821811,https://t.me/advantisai,https://medium.com/@advantisai,,http://www.linkedin.com/company/advantisai,
AEGIS,ib50zn,https://aiaegis.org/,AI,ETHEREUM,AEGIS,aegis-ai,AEGIS AI is developing a pioneering Blockchain Security with AI-Enabled Audit Solutions,,,,https://twitter.com/AegisAISecurity,,https://t.me/AegisAISecurity,,,,
AeroNyx,5w860i,https://aeronyx.network/,WIRELESS,,,,"AeroNyx - decentralized DePIN protocol for privacy solutions, using Web3 principles.",,,,https://twitter.com/Aeronyx9,,,,,https://www.linkedin.com/company/aeronyx/,
Aethero,zualg9,https://www.aethero.com/,COMPUTE,,,,"Aethero builds radiation-hardened edge computers to process data from orbit and let users compress their bandwidth needs, automate tasks like navigation, or manage satellites in a constellation by deploying and training ML applications.",,EV3 Sal,,https://twitter.com/aetherospace,,,,,,
Aethir Edge,e3bezv,https://www.myedge.io/,COMPUTE,,,,"Aethir Edge is the next evolution of a decentralized, community-powered computing device integrated with Aethir's distributed GPU cloud infrastructure.",Hardware,ZZ,,https://twitter.com/AethirEdge,,,,,,
Aethir,oo2cn2,https://www.aethir.com/,COMPUTE,,ATH,aethir,Aethir is a Scalable Decentralised Cloud Infrastructure (DCI) for Gaming and AI.,,,,https://twitter.com/AethirCloud,993758224438284291,,,,https://www.linkedin.com/company/aethir-limited,
Agave Zwolf,zd2zu6,https://agavezwolf.com/,SERVICES,,AGVZ,,"Agave Zwolf is the provider of a token that is backed up by a plant of blue agave which is used to produce Tequila. When a new plant is planted by AgaveZwolf, a new Token is issued.",,,,,,,,,,
Agnostic,2pv22r,https://agnostic.engineering/,BLOCKCHAIN_INFRA,,,,Agnostic is the fastest access to aggregated smart-contract data. It allows developers to build their decentralised app without worrying about devops and data engineering.,,,,,,,https://medium.com/agnosticeng,,https://www.linkedin.com/company/agnostic/about/,
Agnostiq,anzeat,https://agnostiq.ai/,COMPUTE,,,,"Agnostiq develops Covalent, an open-source workflow platform for quantum computing and HPC.",,,,https://twitter.com/agnostiqHQ,,,,https://github.com/agnostiqHQ/covalent,https://www.linkedin.com/company/agnostiq/,
Agritoken,gaa7c0,https://agritoken.com.ph/,NOT_DEPIN,,,,Agritoken is tokenizing crop futures for efficient and transparent agricultural investing.,RWA,,,https://twitter.com/AgriToken,,,,,https://www.linkedin.com/company/agritoken/?originalSubdomain=br,
Agrotoken,r2yc3l,https://agrotoken.com/es/,BLOCKCHAIN_INFRA,,,,"Agrotoken allows you to do more and better business with agrocommodities, creating a simpler, more efficient and technological ecosystem. We are the new dimension of agribusiness",,,,https://twitter.com/agrotoken,,,,,https://www.linkedin.com/company/agrotoken/,
AhoyDAO,cqpqpq,https://www.ahoy.org/,BLOCKCHAIN_INFRA,,,,AhoyDAO is a peer-to-peer ecosystem for the marine industry ownership economy.,,,,https://twitter.com/ahoy_dao,,,,https://github.com/ahoy-cli/ahoy,https://www.linkedin.com/company/ahoy-/,
AI ARENA,1q9nu8,https://www.arenaxlabs.com/,AI,,NRN,,"AI ARENA is an Ethereum native game (dApp) where players all over the world can purchase, train, and battle characters powered by AI.",,EV3 Sal,,,,,,,,
AI Network,owekxa,https://www.ainetwork.ai/,AI,ETHEREUM,AIN,ai-network,"AI Network is a blockchain protocol-based collaborative computing architecture for AI and metaverse. ",,ZZ,,https://twitter.com/ainetwork_ai,,,,,,
AI Power Grid,kv3vqp,https://aipowergrid.io/,AI,,AIPG,ai-power-grid,AI Power Grid is an innovative blockchain project designed to incentivize and reward open-source AI participation.,,ZZ,,,,,,,,
AI Protocol,3zo6h4,https://www.aiprotocol.info/,AI,,,,"Platform merging AI and Web3 for creation, ownership, tokenization, and monetization of AI assets.",,,,https://twitter.com/ProtocolAI1,828681620893466655,,https://medium.com/@protocolai_ready,,https://www.linkedin.com/in/ai-protocol-201214283/,
AI21 Labs,byddbz,https://www.ai21.com/,AI,,,,AI21 Labs builds Foundation Models and AI Systems for enterprises that accelerate the use of GenAI in production.,ML,ZZ,,https://twitter.com/AI21Labs,,,,,,
AIgentX,ovok3r,https://aigentx.xyz/,AI,ETHEREUM,AIX,aigentx,"AIgentX is developing next-gen AI-driven chat solutions that simplify the user experience on Web3, making blockchain technology accessible to everyone.",,EV3 Sal,,https://twitter.com/0xaigentx,,,,,,
Aiis,zfup4o,https://aiis.dev/,AI,,,,"Skip complex code. With AI, creating and deploying your own ERC-20 token is as simple as answering a few questions!",,EV3 Sal,,,1170073310000853023,,,,,
Aimedis,p864om,https://aimedis.com/,AI,POLYGON,AIMX,aimedis-new,Aimedis is a Blockchain-based eHealth with medical apps and an NFT marketplace.,Health & Fitness,,,https://twitter.com/AimedisGlobal,1176263289701945396,https://t.me/AimedisOfficialEnglish,,,https://www.linkedin.com/company/aimedis/?originalSubdomain=nl,
AiONE,oqs9xj,https://ai.one/,AI,BINANCE,AIONE,aione,"AiONE: AI platform that integrates AI into business workflows. User-friendly AI services, APIs, and tools.",,,,https://twitter.com/aionelab,1093106091216347226,https://t.me/aionelab,,,http://www.linkedin.com/company/aionelabs,
AIOZ,tpqdbi,https://aioz.network/,COMPUTE,ETHEREUM,AIOZ,aioz-network,AIOZ is a decentralized content delivery network.,CDN,ZZ,,https://twitter.com/aioznetwork?lang=en,,https://t.me/s/aiozofficial,https://medium.com/aioz-network,,https://sg.linkedin.com/company/aioz-ai,
AIREALM,muunxy,https://www.airealm.tech/,AI,ETHEREUM,AIRM,,"AIREALM is an AI Ecosystem that gathers AI utilities into a single platform, enhancing convenience and innovation for users. The AI REALM suite consists of AI Swap, Chatbot, Chart Bot, and AI Auditor, catering to users of all levels.",,ZZ,,,,,,,,
Airlyft,2c4d5r,https://airlyft.one/,NOT_DEPIN,,,,"Discover Thriving Communities, Participate in Engaging Campaigns and Win Irresistible Rewards like NFTS, Tokens and Whitelists.",,,,,906232393986371644,,,,https://www.linkedin.com/products/kyteone-airlyft/,
AIRO,8q0l7y,https://www.airo.network/,SENSORS,,,,AIRO is a decentralized air quality monitoring network.,Environmental,ZZ,,https://twitter.com/AIRO_MU,1089157531001167958,,https://medium.com/@airo.network,https://github.com/airo,https://www.linkedin.com/company/airo-missions,
AirTor,l9if1e,https://ator.io/,WIRELESS,ETHEREUM,ATOR,airtor-protocol,AirTor: Proof-of-uptime and relay hardware for passive earning and support of Tor.,,,,https://twitter.com/atorprotocol,1083735132470521907,https://t.me/atorcommunityportal,https://medium.com/@ZeroSumTrayder/ator-protocol-the-next-big-thing-6d67a87243e2,https://github.com/ATOR-Development,,
AIT,ux0c4s,https://ait.tech/,AI,,,,Intersection of AI & blockchain,,EV3 Sal,,,,,,,,
Aizel,xziezz,https://aizelnetwork.com/,AI,,,,Aizel is an on-chain verifiable AI inference network that empowers blockchains with trustless AI abilities.,,ZZ,,https://twitter.com/aizel_network,,,,,,
Akash,qmmyw0,https://akash.network/,COMPUTE,COSMOS,AKT,akash-network,Akash is an open-source supercloud that enables secure and efficient buying and selling of computing resources.,GPUs,,,https://twitter.com/akashnet_,747885925232672829,,https://medium.com/@akashnet_,https://github.com/akash-network,http://www.linkedin.com/company/akash-network,
Akord,5fwdog,https://akord.com/,COMPUTE,,,,Akord: decentralized storage solution giving users control over data. A privacy hub and data marketplace.,Storage,,,https://twitter.com/AkordTeam,890229689019432981,,,https://github.com/Akord-com,https://fr.linkedin.com/company/akord-co,
Albedo,iqd05g,https://albedo.com/,NOT_DEPIN,,,,Albedo's low-flying satellites capture visible and thermal imagery at the highest resolution commercially available.,Satellites,,,https://twitter.com/vaxchain,,,,,https://www.linkedin.com/company/albedo-space/,
Aleo,y5j1bu,https://aleo.org/,NOT_DEPIN,,,,Aleo is a privacy-first Layer-1 blockchain that's zero-knowledge by design.,L1/L2,ZZ,,https://twitter.com/AleoHQ,,,,,,
Aleph Zero,qxdzwc,https://alephzero.org/,NOT_DEPIN,,AZERO,,"Aleph Zero is a layer 1 privacy-enhancing blockchain that ensures scalability, low transaction fees, instant finality, and optimal security. It's powered by a novel consensus protocol and the WASM-based technology stack.",,,,,775720634848116807,,,,,
Aleph,shwbn0,https://aleph.im/,COMPUTE,ETHEREUM,ALEPH,aleph-im,"Aleph.im is an open-source crosschain network featuring decentralized database including file storage, computing, and a decentralized identity (DID) framework.",,,,https://twitter.com/aleph_im,,https://t.me/alephim,https://medium.com/aleph-im,,https://www.linkedin.com/company/aleph-im/?originalSubdomain=fr,
Alephium,agw79k,https://alephium.org/,BLOCKCHAIN_INFRA,ETHEREUM,ALPH,alephium,"Alephium is a blockchain platform that combines innovative sharding, a stateful sUTXO model, and Proof-of-Less-Work to deliver scalable, secure, and energy-efficient dApps for real-world applications.",,ZZ,,,,,,,,
Alethea,zzxlj6,https://alethea.ai/,AI,ETHEREUM,ALI,artificial-liquid-intelligence,Alethea AI is a research and development studio building at the intersection of two of the most transformative technologies of our time: Generative AI and Blockchain.,NFTs,,2019,https://twitter.com/real_alethea,https://discord.com/invite/aiprotocol,,,,https://www.linkedin.com/company/realalethea/,
Algovera,vnkyd5,https://www.algovera.ai/,AI,,,,"Algovera is a decentralized AI platform that allows individuals and teams to create, use and share personalized AI.",,,,https://twitter.com/algoveraai,893460895999590450,,https://handbook.algovera.ai/blog/,https://github.com/AlgoveraAI/,https://www.linkedin.com/company/algovera/?originalSubdomain=ie,
Alkimi,xvizp7,https://www.alkimi.org/,NOT_DEPIN,ETHEREUM,ADS,alkimi,"Alkimi is a blockchain-based advertising exchange built on the fundamentals of lower fees, increased transparency, and reduced carbon emissions.",Advertising,ZZ,,https://twitter.com/AlkimiExchange,,,,,,
AllianceBlock,zgvzl4,https://allianceblock.io/,NOT_DEPIN,ETHEREUM,ALBT,allianceblock,AllianceBlock builds gateways between traditional & decentralized industries with blockchain infrastructure.,,,,https://twitter.com/allianceblock,742466730202234960,https://t.me/allianceblock,https://medium.com/allianceblock/allianceblock-the-next-era-of-allianceblock-eabb78b29ac3,https://github.com/Stichting-AllianceBlock-Foundation/,http://www.linkedin.com/company/allianceblock,
ALLIN,q9od26,https://www.allin.so/,AI,ETHEREUM,ALLIN,all-in,"All In is an AI-focused project, designed to empower communities and projects to fully utilize AI technology. They offer data analysis and management, process automation, customer services and community management, and content development services.",,ZZ,,,,,,,,
Allora,qs7j6q,https://allora.network/,AI,,,,"Allora is a self-improving decentralized AI network. It enables applications to leverage smarter, more secure AI through a self-improving network of ML models by crowdsourcing mechanisms, federated learning, and zkML.",,,,https://twitter.com/AlloraNetwork,,,,,,
Aloega,ki4zze,https://www.aloega.com/,SENSORS,,,,"ALOEGA is a global healthcare blockchain platform to enable decentralized, equitable, and secure sharing of health data.",,EV3 Sal,,https://twitter.com/Aloega_Official,,,,,,
Alpha Radar,q4l7ze,https://alpharadarbot.xyz/,AI,ETHEREUM,ARBOT,alpha-radar-bot,"Alpha Radar AI is a powerful AI ecosystem that harnesses advanced AI and LLM technologies. The ecosystem includes a Liquidity scanner, alpha radar bot, GameFi bot, web3.0 LLM, and NFT/Inscription Bot.",,ZZ,,,,,,,,
AlphaRushAI,s99udg,https://alpharush.ai/,AI,ETHEREUM,RUSHAI,alpharushai,"AlphaRush AI: Real-time news, analysis, and personalized trading alpha for cryptocurrency trading.",,,,,,,,,,
Alt Labs,9093bo,https://altlabs.dev/,COMPUTE,,,,Alt Labs is a builder of Web3 infrastructure user-friendly tools and interfaces for decentralized storage networks.,Storage,ZZ,,https://mobile.twitter.com/altlabsagency/status/1311308858816704514,,,https://medium.com/@alt_labs,https://github.com/RVA-ALT-Lab,https://uk.linkedin.com/company/alt-labs,
Altered State,9limss,https://www.alteredstatemachine.xyz/,AI,ETHEREUM,ASTO,altered-state-token,"Decentralized AI protocol for NFI, enabling ownership, trading, and training of AI agents through NFTs.",Agents,,,https://twitter.com/altstatemachine,864685888830963742,,,,https://www.linkedin.com/company/altered-state-machine/,
Althea,nag833,https://www.althea.net/,WIRELESS,GNOSIS,,,Althea is a web stack creating a marketplace for building ISPs and providing bandwidth in communities.,,,,,477147257251299350,,,,,
AltLayer,r5tb6n,https://altlayer.io/,NOT_DEPIN,,,,AltLayer is a decentralized protocol that facilitates the launch of native and re-staked rollups with both optimistic and zk rollup stacks.,,,,,954273304099815424,,,,,
Anapaya,q0o1zm,https://www.anapaya.net/,NOT_DEPIN,,,,"Move your critical services, such as websites and VPN endpoints, away from the standard internet path, and secure them behind Anapaya GATE.",,EV3 Sal,,,,,,,,
Anchor,gle4b5,https://www.greymass.com/anchor,NOT_DEPIN,,,,"Anchor Wallet is a developer of smart contract wallets, specializing in quantum resistance and Lamport signatures.",Wallet,,,https://twitter.com/pauli_group,,,,,http://www.linkedin.com/company/pauli-group,
Ancient8,xjogkp,https://www.ancient8.gg/,BLOCKCHAIN_INFRA,ETHEREUM,A8,,Ancient8 is building a DAO that develops a community and software platform to enable everyone to play and build the Metaverse while earning rewards.,,,,https://twitter.com/Ancient8_gg,882274636342116372,https://t.me/ancient8_gg,https://blog.ancient8.gg/,,https://www.linkedin.com/company/ancient8/about/,
Andrena,tgalub,https://andrena.com/,WIRELESS,,,,Andrena is a company offering high-speed internet distribution services with a focus on reduced costs.,,,,https://twitter.com/andrena_wifi?lang=en,,,,,https://www.linkedin.com/company/andrenainternet/,
Andromeda,g23dwt,https://www.andromedaprotocol.io/,COMPUTE,NATIVE,ANDR,andromeda-2,"Andromeda is developing a decentralized on-chain operating system (aOS) for Web3, streamlining operations with enhanced accessibility and efficiency.",,ZZ,,,,,,,,
Ankr,hqtk8u,https://www.ankr.com/,BLOCKCHAIN_INFRA,ETHEREUM,ANKR,ankr,"Ankr is a blockchain node infrastructure network enhancing multi-chain tools for Web3, DeFi, and the crypto economy.",RPC/Indexing,,,http://www.twitter.com/getankr,795634526918279179,https://t.me/ankrnetwork,https://medium.com/ankr-network,https://github.com/Ankr-network,http://www.linkedin.com/company/ankr,
Anon,6mqswi,https://www.anon.com/,NOT_DEPIN,,,,Anon enables developers to securely request and authenticate data from the most popular sites on the internet.,ZK,,,https://twitter.com/anonplatform,,,https://www.linkedin.com/company/anon-dot-com/about/,,,
Anryze,uvtnws,https://anryze.com/,COMPUTE,,,,Anryze is a decentralized data processing network where complex tasks can be distributed and run simultaneously.,,ZZ,,https://www.twitter.com/anryze,,https://t.me/,,,https://linkedin.com/company/anryze,
Ansa,i9mqty,https://ansaresearch.ai/,AI,,,,Ansa Research is a research firm focused on distributed infrastructure.,,EV3 Sal,,,,,,,,
Antic,hs6fc5,https://www.antic.xyz/,NOT_DEPIN,,,,Antic: Decentralized co-ownership integration for businesses.,,,,https://twitter.com/Getantic,,,https://medium.com/multeez,,http://www.linkedin.com/company/anticxyz,
Antimetal,gzcc2r,https://www.antimetal.com/,NOT_DEPIN,ETHEREUM,ACAI,,"Antimetal is an AWS cloud cost optimization platform that utilizes AI to analyze and optimize cloud spending, helping users maximize savings.",,,,https://twitter.com/AntimetalCloud,,,,,,
APhone,p8juld,https://www.aphone.com/,SENSORS,,PHONE,,"APhone is the 1st decentralized cloud smartphone, powered by Aethir.",,EV3 Sal,,https://twitter.com/aphonelabs,,,,,,
API3,agq5jo,https://api3.org/,BLOCKCHAIN_INFRA,,API3,,"API3 is a decentralized data oracle network that facilitates direct integration of APIs with blockchain applications, eliminating the reliance on third-party intermediaries.",,,,,758003776174030948,,,,,
Apillion,x94xlf,https://apillon.io/,NOT_DEPIN,,,,Apillion is a Web3 development platform enabling developers to build in the Polkadot ecosystem.,,,,https://twitter.com/Apillon,881835505120079912,,,https://github.com/Apillon,https://www.linkedin.com/company/apillon/,
Apraemio,nx180n,https://www.apraemio.com/,NOT_DEPIN,BINANCE,APRA,,"Apraemio is a gold-backed cryptocurrency project with exclusive rights to access one of the largest gold reserves in Mali, Africa, committed to using blockchain technology to provide investors with a secure and transparent way to invest in gold.",RWA,ZZ,,https://twitter.com/Apraemio_ofc,,,,,,
Apron,bg8k10,https://apron.network/,NOT_DEPIN,ETHEREUM,APN,apron,"Apron is a decentralized infrastructure service network for DApp developers, users, and operators on blockchain.",,,,https://twitter.com/apronofficial1,785051859655458826,,https://apron-network.medium.com/,https://github.com/Apron-Network/,,
Apus,ztd8go,https://www.apus.network/,AI,,,,Apus is a decentralized AI bot creator network that simplifies AI model design using blockchain.,,ZZ,,https://twitter.com/apus_network,,https://t.me/+AWdHtLSl2m4yM2I1,https://medium.com/@apusnetwork,https://github.com/apuslabs,http://www.linkedin.com/company/apus-network,
Aqtis,t39a28,https://aqtis.io/,NOT_DEPIN,ETHEREUM,AQTIS,aqtis,"AQTIS is a next-generation DeFi company built on top of their own AI-powered quantitative technology. It harnesses the power of data mining, machine learning, and artificial intelligence to generate yield and distribute it across the AQTIS ecosystem.",,,,https://twitter.com/aqtis_io,1088485685754863616,,,https://aqtis.gitbook.io/aqtis-documentation/,,
AquaSave,j5agj9,https://aquasave.io/,SENSORS,,,,"AquaSave is an ecosystem that uses IoT and blockchain technologies, and relies on community participation to analyze and track the status of the planet‚Äôs water resources.",,W. L.,,https://twitter.com/AquaSaveCrypto,936317978910285844,,https://medium.com/@aquabanknetwork,https://github.com/AquaSave-io,https://www.linkedin.com/company/aquasave-io/,
