name,id,url,category,chain,token,coinGeckoID,description,subcategories,ninja,foundingYear,twitter,discord,telegram,blog,github,linkedin,verified
Rivalz,4r3sn3,https://rivallz.network/,AI,NATIVE,RIZ,,"Rivalz is an AI-driven Data Provenance DePIN RollApp focusing on AI data provenance and creating a modular ecosystem for AI applications and agents. ",,EV3 Sal,,https://twitter.com/Rivalz_AI,,,,,,
Roam,345ael,https://www.roamnetwork.xyz/,WIRELESS,,,,Roam is a crypto-native telco initiative enabling easy setup of mobile networks for 4G or 5G connectivity.,Mobile,,,https://twitter.com/roam_network,1074654906436296734,https://t.me/+Xk2-5Sa02yFjMDE0,https://medium.com/@Roam_Network,,http://www.linkedin.com/company/roamnetwork,
Robonet,ecb4bs,https://robonet.finance/,NOT_DEPIN,,,,"RoboNet is an AI-powered DeFi protocol that leverages several new developments in decentralized MI and zkML to enable more advanced AI-powered DeFi strategies. It consists of three types of participants: strategists, liquidity providers, and traders.",,ZZ,,https://twitter.com/RoboNetHQ,,,,,,
Robonomics,47a3ty,https://robonomics.network/,NOT_DEPIN,ETHEREUM,XRT,robonomics-network,"Robonomics is an open-source platform for IoT applications which enables the exchange of technical and economic information between user applications, IoT services, and complex robotics.",,,,,803947358492557312,,,,,
Robot AI,12ku5r,https://www.0xrobot.ai/,NOT_DEPIN,IOTEX,ROBA,,"Robot AI is an innovative blockchain project on IoTeX integrating unique features including POW, DePIN, 404, and Meme culture.",,ZZ,,https://twitter.com/0xrobot_ai,,,,,,
RobotEra,t7b6bu,https://robotera.io/,NOT_DEPIN,,,,RobotEra: play-to-earn gaming with NFTs and metaverse world-building.,Gaming,,,https://twitter.com/robotera_io,,https://t.me/+_wOHpPocsxE3NjBh,,,https://www.linkedin.com/company/robot-era/,
Robotized,n87ym5,https://www.robotiz3d.com/,BLOCKCHAIN_INFRA,,,,Robotiz3d is building the world‚Äôs first autonomous road maintenance vehicle to help tackle the pothole problem.,,,,,,,,,,
Roko,kz7n8o,https://roko.network/,AI,ETHEREUM,ROKO,roko-network,Roko is a self-organizing human-machine network focused on deep-tech R&D protocol bootstrapping.,Agents,ZZ,,,1080924910018367630,https://t.me/RokoNetwork,,,,
Rollbit Coin,3m9m9c,https://rollbit.com/,NOT_DEPIN,ETHEREUM,RLB,rollbit-coin,"Rollbit offers casino games, sportsbook, futures trading, and NFT trading.",Gaming,,,https://twitter.com/rollbitcom,698240441316802589,,https://medium.com/coinmonks/what-is-rlb-rollbit-the-solution-for-crypto-degens-ef9af8d35d9e,,,
Roso,36f3to,https://roso.vip/,NOT_DEPIN,ETHEREUM,ROSO,roso-elite-gamblers-mansion,"Roso is a diverse online casino and gaming platform, offering a wide range of gambling experiences.",Gaming,,,,,,,,,
Routie,v0g1yx,https://routie.io/,WIRELESS,NATIVE,PKT,pkt,"Routie enables businesses to offer free internet, collect customer data, and earn revenue through captive portals.",,ZZ,,https://twitter.com/helloroutie,,,,,http://www.linkedin.com/company/routie,
ROVI,tpkifk,https://www.rovimobility.com/,BLOCKCHAIN_INFRA,,,,The ROVI is one of the most innovative power-bases ever created.,Health & Fitness,,,https://twitter.com/rovimobility,,,,,,
Rowan Energy,erdh9p,https://www.rowanenergy.com/,ENERGY,,RWN,rowan-coin,Developer of a Community Supported Green Energy Blockchain. Members will be able to buy their energy from other members who produce it using solar panels.,,,,https://twitter.com/RowanRewards,,,,,https://www.linkedin.com/company/rowanenergy/,
Royal,t62qym,https://royal.io/,NOT_DEPIN,,,,Royal is a marketplace built on top of the Polygon blockchain that enables anyone to invest in music and earn royalties alongside artists.,,,,https://twitter.com/join_royal,867511488151683083,,https://support.royal.io/hc/en-us,,https://www.linkedin.com/company/joinroyal/,
Royale,csbwex,https://www.royale.finance/,NOT_DEPIN,ETHEREUM,ROYA,royale,Provider of cross-chain decentralized finance services intended to serve the iGaming industry.,,,,https://twitter.com/Royale_Finance,,https://t.me/RoyaleFinance,https://officialroyale.medium.com/,,https://www.linkedin.com/company/officialroyale/about/,
RPS AI,k014yh,https://www.rpslabs.io/,AI,,,,"RPS is building AI infrastructure to power tomorrow's autonomous agents, DApps, and next-gen blockchain analytics. The infrastructure allows anyone to build autonomous AI agent apps securely with the full context of the blockchain in real time.",Agents,ZZ,,https://twitter.com/RPS_Labs,,,,,,
RSS3,1tdy5h,https://rss3.io/,AI,ETHEREUM,RSS3,rss3,RSS3 is a next-gen feed protocol for decentralized applications.,,,,https://twitter.com/RSS3_,837332113677090876,https://bit.ly/3e6FZoV,https://medium.com/tag/rss3,https://github.com/NaturalSelectionLabs,http://www.linkedin.com/company/rss3,
RTK Direct,i2rdst,https://rtkdirect.com/,WIRELESS,POLYGON,RTK,,RTK Direct is a blockchain powered RTK Hotspot. The solution refines and boosts GPS/GNSS data which can then be used to improve the accuracy in that area. With this proven concept they can improve accuracy from 5 meters to 1 centimeter in real-time.,,W. L.,,https://twitter.com/rtkdirect,,,,,,
Ruff,la5o39,http://ruffchain.com,NOT_DEPIN,ETHEREUM,RUFF,ruff,Ruff is a blockchain-based architecture combining IoT with a public chain and distributed operating system.,IoT,,,,,,,,https://www.linkedin.com/company/ruffllc/,
Rumi,3x8glb,https://www.rumi.finance/,NOT_DEPIN,,RUMI,rumi-finance,Rumi is a permissionless platform for DeFi asset management.,DeFi,ZZ,,https://twitter.com/rumilabs/status/1325733403686133760,1030554262670942208,,,,https://pt.linkedin.com/company/rumi-finance,
Runloop,f9rhe0,https://runloop.xyz/,AI,,,,"Runloop builds DeFi simulation environment for training agents in liquidity provision, risk management, and trading.","Agents, DeFi",,,https://twitter.com/runloop?lang=en,,,,,https://www.linkedin.com/company/runloop/about/,
Ruuvi,3mrg2q,https://ruuvi.com/,SENSORS,,,,"Ruuvi creates simple and powerful environmental sensor products for consumers and businesses.The Ruuvi sensors measure air temperature, humidity, pressure, and acceleration, depending on the models.",,,,https://twitter.com/ruuvicom,,https://t.me/ruuvicom,https://ruuvi.com/blog/,https://github.com/ruuvi,https://www.linkedin.com/company/ruuvi,
RWA Inc,6xg4oq,https://www.rwa.inc/,NOT_DEPIN,,RWA,,RWA.Inc is a Real World Asset Tokenization eco-system enabling issuers of Real World Assets to tokenize any asset instantly and investors to safely invest in digital assets.,RWA,ZZ,,https://twitter.com/RWA_Inc_,,,,,,
Rymedi,aexn5y,https://rymedi.com/,BLOCKCHAIN_INFRA,,,,Rymedi is a blockchain-enabled platform empowering health workers and patients to improve the quality of care.,Health & Fitness,,,,,,,,,
RyuChain,8w0s7k,https://ryuchain.io/,AI,NATIVE,RYU,,Ryu Chain is decentralized software enabling everyone to use the full capability of NFTs in combination with decentralized Software and the power of AI.,,ZZ,,,,,,,,
SAC,pl7sq2,https://sac-nft.com/,SENSORS,ETHEREUM,SAT,super-athletes-token,SAC is a Sports To Earn project that allows users to exercise with the SAC APP and earn tokens that can be converted into real assets.,Health & Fitness,ZZ,,https://twitter.com/sacnft_official,,,,,,
Safe Haven,ewlwyh,https://safehaven.io/,AI,BINANCE,SHA,safe-haven,Decentralized digital inheritance,,,,https://twitter.com/safeHavenio,951025651463385129,https://t.me/safehavenio,http://www.linkedin.com/company/safe-haven-sha,,https://github.com/Safehaven-io,
SAFE,t4fjen,https://safenetwork.org/,COMPUTE,NATIVE,SAFE,safe-anwang,SAFE Network is a decentralized data storage and communications network that uses spare computing resources of users.,Storage,ZZ,,https://twitter.com/safenetworktech?lang=en,,,https://medium.com/safenetwork/about,,,
Saga,95fcvd,https://www.saga.xyz/,NOT_DEPIN,,SAGA,,Saga is a Layer 1 protocol that allows developers to automatically spin up parallelized and interoperable dedicated chains that elastically scale with their Web3 application needs.,,,,,950275843949736006,,,,,
Sahara,a2h6y8,https://www.saharalabs.ai/,AI,,,,Sahara is a decentralized AI network enabling everyone to securely deploy and leverage custom AI agents.,Agents,ZZ,,https://twitter.com/SaharaLabsAI,,,,,,
Saito,i86y1x,https://saito.tech/,NOT_DEPIN,ETHEREUM,SAITO,saito,"Saito: Layer-1 blockchain empowering web 3.0 apps, with distributed infrastructure.",L1/L2,,,https://twitter.com/SaitoOfficial,595860623901065237,https://t.me/SaitoIO,https://saito.tech/blog/,,http://www.linkedin.com/company/saitonetwork,
Sapien,k2xr2i,https://www.sapien.io/,AI,,,,"Sapien is building a large network of human data labelers for the AI industry, utilizing gamification and blockchain incentives to power high-performance models.",,ZZ,,https://twitter.com/SapienGamified,,,,,,
Sarcophagus,se7wj7,https://sarcophagus.io/,BLOCKCHAIN_INFRA,ETHEREUM,SARCO,sarcophagus,Decentralized dead man's switch,,,,https://twitter.com/sarcophagusio,753398645507883099,,http://www.linkedin.com/company/sarcophagusio,,https://github.com/sarcophagus-org,
Satea,7piuxo,https://satea.io/,BLOCKCHAIN_INFRA,,,,"Satea is a fully managed Web3 infrastructure, democratizing access to computing resources worldwide for Depin and AI projects through tailored solutions and managed services.",,ZZ,,https://twitter.com/SateaLabs,,,,,,
Sator,jxy5nc,https://sator.io/,WIRELESS,ETHEREUM,SAO,sator,Sator is a Blockchain-enabled TV engagement that allows users to earn crypto rewards for watching TV.,,,,,839345964129320970,,,,,
Satori,gp6a8t,https://satori.finance/,BLOCKCHAIN_INFRA,,,,Satori is a decentralized financial derivatives platform with an “off-chain aggregation and on-chain settlement” design.,,EV3 Sal,,https://twitter.com/SatoriFinance,,,,,,
Saturn,dar2ui,https://saturn.tech/,COMPUTE,FILECOIN,,,"Saturn is an open-source, community-run Content Delivery Network (CDN) built on Filecoin.",CDN,ZZ,,https://twitter.com/FilecoinSaturn,,,,,,
Sayver,zk9cf4,https://sayver.net/,COMPUTE,,,,Sayver is a blockchain-based platform that enables users to immortalize anything on the blockchain.,Storage,,,,,,,,,
Scalia,4d015n,https://scalia.app/,COMPUTE,ETHEREUM,SCALIA,scalia-infrastructure,"Scalia Infrastructure is a pioneering platform that aggregates and scales DePIN resources to democratize access to decentralized infrastructure resources, enabling individuals, enterprises, and organizations to leverage decentralized technologies.",,EV3 Sal,,https://twitter.com/scaliainfra,,,,,,
SCINET,exm7xr,https://www.scinet.one/,NOT_DEPIN,,,,SCINET is a decentralized life sciences research and investment platform that revolutionizes the way people do and support science.,,,,https://twitter.com/scinet_inc,933419136934101013,,,,https://www.linkedin.com/company/scinet-us/,
ScPrime,ui2nbm,https://scpri.me/,COMPUTE,NATIVE,D2X,d2,ScPrime is a decentralized network of enterprise-grade cloud storage providers.,Storage,ZZ,,https://twitter.com/ScPrimeCloud,500467593375645706,,https://scpri.me/articles/,https://gitlab.com/scpcorp/,https://www.linkedin.com/company/scp-corp,
Script TV,3yilwl,https://token.script.tv/,WIRELESS,ETHEREUM,SCPT,script-network,Script TV is a decentralized video delivery network that furnishes an expansive range of blockchain-enabled solutions to the problems related to the traditional video-streaming sector.,,,,,849605237185970196,,,,,
ScyNet,5kz9p0,https://scynet.ai/,COMPUTE,,,,ScyNet is a Decentralized network for creating and training autonomous AI agents.,,ZZ,,https://twitter.com/ScynetAI,484370483739885608,,,https://github.com/comrade-coop/scynet,,
SDrive,hvlpd4,https://sdrive.app/,COMPUTE,SOLANA,SCOIN,sdrive-app,"SDrive is a decentralized storage solution offering secure, immutable file storage with user-friendly access and strong privacy features on the Solana blockchain, complemented by robust developer tools including CLI, SDKs, and APIs.",,ZZ,,,,,,,,
Sealink,spnzni,https://sealink.network/,WIRELESS,NATIVE,SLK,sealink-network,"The Sealink Network integrates Proof of Stake (PoS) and a unique Proof of Work (uPoW) blockchain technology to offer a decentralized, secure, and free virtual private network (VPN) service, which includes features like remote access and port mapping.",,ZZ,,,,,,,,
SecondLive,6qvjpf,https://secondlive.world/,BLOCKCHAIN_INFRA,,,,"SecondLive: a metaverse for avatars, virtual spaces, art exhibitions, and gaming.",,,,https://twitter.com/SecondLiveReal,864036969851650048,https://t.me/SecondLiveCommunity,https://medium.com/@SecondLiveReal,https://github.com/SecondLive23,,
SEDA,mbv7cs,https://www.seda.xyz/,BLOCKCHAIN_INFRA,ETHEREUM,SEDA,seda-protocol,"SEDA is an intent-based, modular data layer that enables developers to conduct data queries for any data type from any blockchain, facilitating permissionless integration of external data within their native blockchain environments.",Oracle,ZZ,,,,,,,,
Seed Labs,ixg6ts,,NOT_DEPIN,,,,"Seed Labs is a collectively owned, community-first, open early stage venture capital.",,,,,,,,,https://www.linkedin.com/in/seed-lab-my-9246951a8/,
SEI,qijvwz,https://www.sei.io/,NOT_DEPIN,,SEI,,"Sei is a specialized Layer 1 blockchain optimized for digital asset exchanges, offering unparalleled speed and a unique consensus mechanism to solve the Exchange Trilemma, enhancing user experience across trading, gaming, and NFT marketplaces.",,,,,973057323805311026,,,,,
SelfChain,151ado,https://selfchain.xyz/,AI,,,,Self Chain Is The First Modular Intent-Centric Access Layer L1 Blockchain And Keyless Wallet Infrastructure Service That Uses MPC-TSS/AA For Multi-Chain Web3 Access,Software,,,https://twitter.com/selfchainxyz,1146385445563944961,https://t.me/selfchainxyz,,,,
SelfKey,b12fse,https://selfkey.org/,NOT_DEPIN,ETHEREUM,KEY,selfkey,SelfKey is a blockchain-based identity platform.,,,,https://twitter.com/selfkey,897002577831526460,https://t.me/selfkeyfoundation,https://medium.com/@SelfKey,https://github.com/SelfKeyFoundation,http://www.linkedin.com/company/selfkey,
Semaphore,4ubfgn,,NOT_DEPIN,,,,The Semaphore Network is developing an EthSIM Wallet to allow anyone to turn ANY cellphone into a secure air-gapped hardware wallet for Ethereum transactions.,,EV3 Sal,,,,,,,,
Sending Labs,xe4qlj,https://www.sending.network/,BLOCKCHAIN_INFRA,,,,"SendingNetwork is a Web3 Communication Stack that helps developers create secure dapps that include in-app or cross-app chats, notifications, wallet or decentralized ID logins, and non-fungible token (NFT) transactions.",,EV3 Sal,,,,,,,,
Sensecap,4mztfe,https://www.sensecapmx.com/,BLOCKCHAIN_INFRA,,,,"Sensecap: LoRaWAN IoT hardware for Helium hotspots, building decentralized networks.",IoT,,,https://www.sensecapmx.com/blogs/,,,,,https://www.linkedin.com/company/seeedstudio/,
Sentinel,r77x1a,https://sentinel.co/,COMPUTE,COSMOS,DVPN,sentinel,Sentinel is a global ecosystem of autonomous dVPN apps enabling private censorship-resistant internet access.,VPN,ZZ,,https://twitter.com/Sentinel_co,436630361313640469,https://t.me/sentinel_co,https://medium.com/sentinel,https://github.com/sentinel-official,https://linkedin.com/company/sentinelco,
SEOR,wpruwu,https://www.seor.io/#/home,NOT_DEPIN,BINANCE,SEOR,seor-network,"SEOR is the next generation of decentralized Web3.0 application technology development infrastructure, which aims to provide users and developers of Web3.0 with an easy-to-use blockchain technology development platform.",,,,https://twitter.com/SEOR001,882647441193725953,https://t.me/SeorGroup,https://medium.com/@SEOR,,,
Serenity Shield,yc3xgv,https://www.serenityshield.io/,COMPUTE,BINANCE,SERSH,serenity-shield,"StrongBox is a fully decentralized and privacy-preserving app for storing, transferring, and recovering confidential data. The platform also boasts a customizable inheritance option, enabling users to manage their data according to their preferences.",Storage,ZZ,,https://twitter.com/SerenityShield_,,,,,,
Session,xm8o5o,https://getsession.org/,BLOCKCHAIN_INFRA,,,,"Session is an end-to-end encrypted messenger that minimises sensitive metadata, designed and built for people who want absolute privacy and freedom from any form of surveillance.",,,,https://twitter.com/session_app,,,https://getsession.org/blog,https://github.com/oxen-io,http://www.linkedin.com/company/sessionmessenger,
Set,zftfbg,,NOT_DEPIN,,,,Set is an onchain indexing protocol,,,,,,,,,,
Setoros,ulo2gi,https://setoros.com/,NOT_DEPIN,,,,Setoros is a decentralized crypto sportsbook for global betting.,,,,https://twitter.com/setoros,1077512035899809823,,https://medium.com/@baduungg/update-setoros-testnet-now-launching-on-base-network-dbc2a77f232b,https://github.com/setoros-group,,
Setter,9emkwg,https://www.setter.co/,NOT_DEPIN,,,,Setter is the go-to app for drops and community. Be the first to RSVP for upcoming releases and limited editions.,,EV3 Sal,,,,,,,,
Sfero,k02lxn,https://sfero.io/,SENSORS,,,,"Sfero is a decentralized POS terminal integrating conventional payment methods alongside modern options like Apple Pay, Google Pay, and cryptocurrency transactions using cutting-edge biometric solutions.",Hardware,EV3 Sal,,https://twitter.com/sfero_io,,,,,,
SFT Protocol,hb0kuf,https://sft.network/,COMPUTE,,SFT,,"SFT Chain, a 'Chain of Chains', bridges physical infra with Web3, focusing on a DePIN platform that integrates storage, computing, edge CDN , and beyond.",,ZZ,,https://twitter.com/SFTProtocol,,,,,,
Shadeform,d4dfm9,https://www.shadeform.ai/,AI,,,,Shadeform is building a one stop shop for cloud GPUs. Here‚Äôs a look at our upcoming roadmap and upcoming features!,,,,,1085330034614616134,,,,http://www.linkedin.com/company/shadeformai,
Shadow Node,qlbqnf,https://shadownode.org/,WIRELESS,ETHEREUM,SVPN,shadow-node,"Explore Shadow Node is a decentralized VPN framework that empowers users with secure, private, and uncensored internet access.",VPN,ZZ,,https://twitter.com/shadownodeVPN,,,,,,
Shaga,t5y2jk,https://linktr.ee/web3shaga,COMPUTE,,,,Shaga offers a unique gaming ecosystem that empowers gamers to lend access to their gaming PCs and monetize their hardware.,,,,https://twitter.com/Web3Shaga,,,,https://github.com/ShagaDAO/Shaga-Monorepo,,
Shamba,zfwfw0,https://shamba.link/,BLOCKCHAIN_INFRA,,,,"Shamba is a Web3 ecological data oracle and Decentralized Monitoring, Reporting & Verification Network.",Oracle,ZZ,,,,,,,,
Shardeum,g65u6w,https://shardeum.org/,BLOCKCHAIN_INFRA,ETHEREUM,SHM,shardeum,Shardeum: EVM-based platform ensuring decentralization and security.,,,,https://twitter.com/shardeum,933959587462254612,https://telegram.me/shardeum,https://medium.com/@Shardeum,https://github.com/shardeum/,http://www.linkedin.com/company/shardeum,
Shentu Chain,vp6r7p,https://www.shentu.technology/,BLOCKCHAIN_INFRA,POLYGON,CTK,shentu,"Shentu Chain enables a system of decentralized Security Oracles that provide runtime analysis of the security of live smart contracts. ",,ZZ,,,,,,,,
SherLOCKED,rm0wa6,,NOT_DEPIN,,,,,,,,,,,,,,
Shibuya,rgobsb,https://www.shibuya.xyz/,BLOCKCHAIN_INFRA,,,,"Shibuya is a web3 platform for film financing & production. Users engage, fund, vote, & become owners of content.",,,,https://twitter.com/shibuyaxyz,946167913021333635,,https://medium.com/@shibuya.xyz,,http://www.linkedin.com/company/shibuyaxyz,
Shimmer,11u1dj,https://shimmer.network/,NOT_DEPIN,NATIVE,SMR,shimmer,"Shimmer is a high-performance, feeless, and parallelized Directed Acyclic Graph (DAG) ledger offering a chain-agnostic solution for fully customizable smart contract chains to be built on top.",,ZZ,,,,,,,,
Shinkai,vm959p,https://www.shinkai.com/,AI,,,,"Shinkai combines LLM-based AI, private data, and task scheduling together with file support, deep crypto integration, and a decentralized p2p network.",,ZZ,,https://twitter.com/ShinkaiProtocol,,,,,,
Shipped,v05a0g,https://shipped.com/,BLOCKCHAIN_INFRA,,,,Shipped is a logistics industry plugin that enables payment for shipping by scanning the barcode on the parcel.,,,,https://www.twitter.com/shippedcom,,,https://shipped.com/blog/,,https://linkedin.com/company/shipped-com,
SHOGGOTH,w72dm1,https://shoggoth.systems/,AI,,,,"Shoggoth is a peer-to-peer, anonymous network for publishing and distributing open-source code, Machine Learning models, datasets and research papers.",,,,,,,,,,
ShopConnect,butvw4,https://www.shopconnect.live/,NOT_DEPIN,,,,Our disruptive innovation reduces the dependence on travel and paper. To optimize costs and control the carbon footprint with a virtual shopping platform.,ZK,,,https://twitter.com/ETHGlobal,,,https://ethglobal.medium.com/,https://github.com/ethglobal,https://www.linkedin.com/company/ethglobal/,
Shuttle Labs,aoo9gh,https://shuttlelabs.co/,AI,,,,Shuttle Labs: AI-powered platform that transforms blockchains into accessible sources for analytics and automation.,,,,https://twitter.com/shuttlelab,,,,,https://www.linkedin.com/company/shuttleinc/,
Sia,esjdj0,https://sia.tech/,COMPUTE,NATIVE,SC,siacoin,Sia is a decentralized cloud storage network combining Proof of Work with a contract-based storage model.,Storage,,,https://twitter.com/sia__foundation,809849352516141067,,,https://github.com/SiaFoundation,http://www.linkedin.com/company/the-sia-foundation,
Side,62pug3,https://www.side.one/,NOT_DEPIN,,SIDE,,"The Side Protocol is a modular infrastructure designed to scale Bitcoin. At its core is SIDE, a Bitcoin sidechain secured by BTC and serving as the settlement layer for zk-rollups within the modular stack.",,,,,1031431934204706856,,,,,
Siglo,7gjqft,https://siglo.com/,WIRELESS,,,,Siglo is a wireless internet service provider.,,,,https://twitter.com/hashtag/siglobar,,,,,http://www.linkedin.com/company/siglointernet,
Sigmoid,v0hgwm,https://www.sigmoid.wtf/,AI,,SIGMA,,"Sigmoid is a coordination protocol between decentralized AI networks, node operators, and users.",,EV3 Sal,,https://twitter.com/sigmoidwtf,,,,,,
Silence,j2py3v,https://www.silencelaboratories.com/,NOT_DEPIN,,,,Silence Labs is a cybersecurity company specializing in decentralized MFA and MPC-based authentication.,,,,https://twitter.com/silentauth,,,https://medium.com/silence-laboratories,,https://www.linkedin.com/company/silencelaboratories/,
Silencio,5m6dp8,https://www.silencio.network/,SENSORS,,,,Silencio rewards users for providing hyper-local noise pollution data from smartphones.,,ZZ,,https://twitter.com/silencioNetwork,1034207908210147489,https://telegram.me/silencio17,https://medium.com/@eversept/about?source,https://github.com/topics/silencio,https://www.linkedin.com/company/silencio,
Silent Link,q5prya,https://silent.link/,WIRELESS,,,,Silent Link provides global mobile 4G/5G Internet access and burner phone numbers on any eSIM-compatible smartphone.,,,,https://twitter.com/silentlink1,,,,,,
SingularityDAO,g7dhjc,https://www.singularitydao.ai/,AI,ETHEREUM,SDAO,singularitydao,SingularityDAO: Decentralized Portfolio Management Protocol for safe and easy crypto asset management.,,,,https://twitter.com/SingularityDao,918044007521714239,https://t.me/SingDAO,https://medium.com/singularitydao,,http://www.linkedin.com/company/singularitydao,
SingularityNET,48m8lh,https://singularitynet.io/,AI,ETHEREUM,AGIX,singularitynet,"SingularityNET enables easy creation, sharing, and monetization of AI services through its global marketplace.",,,,https://twitter.com/singularitynet,909843832491896832,https://telegram.me/singularitynet,https://medium.com/tag/singularitynet,https://github.com/singnet,http://www.linkedin.com/company/singularitynet,
Sinso,tde0ef,https://www.sinso.io/,COMPUTE,,SINSO,,Sinso is a Web3.0 Infrastructure Simplifying Decentralized HotData Cache and Data Governance.,,,,,,,,,,
Sirius,tqnguc,https://www.siriuschain.io/,BLOCKCHAIN_INFRA,NATIVE,XPX,proximax,"Sirius Chain is an advanced Proof-of-Stake and Proof-of-Greed blockchain with built-in features such as multi-level multisig, validator rewards, fast finality, easy digital asset creation, and transaction management.",,ZZ,,,,,,,,
Sitenna,xeu3zu,https://sitenna.com/,WIRELESS,,,,"Sitenna streamlines the process of site acquisition, portfolio management and collocation sales for telecom companies.",Software,,,,,,,,http://www.linkedin.com/company/sitenna,
Skey,v9jtu7,https://skey.network/,NOT_DEPIN,ETHEREUM,SKEY,skey-network,"Skey is a blockchain-based company connecting decentralized finance and IoT, enabling a new economy of physical assets.","DeFi, IoT",,,https://twitter.com/skeynetwork,,https://t.me/SkeyNetworkNews,https://skeynetwork.medium.com/,https://github.com/skey-network,http://www.linkedin.com/company/skeynetwork,
Skeye,lmzn0p,https://skeye.ai/,SENSORS,NATIVE,SKEYE,,"Skeye is a provider of a platform that democratizes access to celestial data, fostering collaboration among sky observers and researchers.  Skeye Recon is a monitoring device to capture and analyze sky-related activities and phenomena.",,ZZ,,https://twitter.com/skeyeai,,,,,,
Skiff,bts0sr,http://www.skiff.com/,NOT_DEPIN,,,,"Skiff is an end-to-end encrypted, privacy-first workspace built for communicating and collaborating freely. They offer Mail, Calendar, Pages (notes), and Drive products.",,ZZ,,https://twitter.com/skiffprivacy,,,https://skiff.com/blog,https://github.com/skiff-org,https://www.linkedin.com/company/skiffprivacy/,
Skillful,8lb0be,https://skillfulai.io/,AI,,SKAI,,"Skillful AI is a personalized AI ecosystem, offering domain-specific virtual assistants, tailored interactions, developer tools, and blockchain integration for staying ahead in a dynamic digital landscape.",,EV3 Sal,,,,,,,,
Sky Trades,mfvv88,https://skytradelinks.com/,BLOCKCHAIN_INFRA,,,,Sky Trades is a marketplace for air rights for drone traffic.,,,,,,,http://www.linkedin.com/company/skytrades,,,
Skypier,5dkcg6,https://skypier.io/,WIRELESS,,,,Skypier decentralized network is a subscription-based peer-to-peer VPN that enables anyone to create their own hybrid cloud.,VPN,ZZ,,https://twitter.com/SkypierIO,,,,,,
